"TSLA’s last call? A 3M, TXN &amp; TSLA earnings parlay",,/r/wallstreetbets/comments/scbex6/tslas_last_call_a_3m_txn_tsla_earnings_parlay/,Choice-Tap6955,1,2022-01-25 05:17:19
Every morning I open this sub,,/r/wallstreetbets/comments/scbh3x/every_morning_i_open_this_sub/,Zookamatchi,1,2022-01-25 05:21:13
Uhh…. This doesn’t look right…,,/r/wallstreetbets/comments/scbio7/uhh_this_doesnt_look_right/,ZiRoRi,1,2022-01-25 05:23:42
INFLATION YOU STUPID SON OF A BITCH!,,/r/wallstreetbets/comments/scbnw2/inflation_you_stupid_son_of_a_bitch/,ZiRoRi,1,2022-01-25 05:32:43
I cant do this anymore.,,/r/wallstreetbets/comments/scbo39/i_cant_do_this_anymore/,DieGerechtigkeit,1,2022-01-25 05:33:00
Getting ready for my Job interview at McDonald's,,/r/wallstreetbets/comments/scbpx5/getting_ready_for_my_job_interview_at_mcdonalds/,mynameisjeffbezos,1,2022-01-25 05:36:23
X5 DEALS Deal sourcing and origination platform,,/r/wallstreetbets/comments/scbs60/x5_deals_deal_sourcing_and_origination_platform/,themanwithnocountry,1,2022-01-25 05:40:23
Built different 🦍,,/r/wallstreetbets/comments/scbsk6/built_different/,broomshed,1,2022-01-25 05:41:01
STONKS,,/r/wallstreetbets/comments/scbsx6/stonks/,thesocialplaza,1,2022-01-25 05:41:36
Thoughts?,,/r/wallstreetbets/comments/scbuye/thoughts/,plancey1,1,2022-01-25 05:45:07
How long is the Crash gonna last?,,/r/wallstreetbets/comments/scbw8g/how_long_is_the_crash_gonna_last/,stonkz01,1,2022-01-25 05:47:25
Every morning,,/r/wallstreetbets/comments/scbzdz/every_morning/,fyusy,1,2022-01-25 05:52:36
How long is the crash gonna last,,/r/wallstreetbets/comments/scc0nx/how_long_is_the_crash_gonna_last/,stonkz01,1,2022-01-25 05:54:47
For some it's just a dream...,,/r/wallstreetbets/comments/scc0oh/for_some_its_just_a_dream/,fyusy,1,2022-01-25 05:54:48
Futures deep in the red again. Can’t wait for another -600pts to +50,,/r/wallstreetbets/comments/scc2u7/futures_deep_in_the_red_again_cant_wait_for/,dabskinumba9,1,2022-01-25 05:58:37
Entering NDAQ straddle end of day today,,/r/wallstreetbets/comments/scc4kl/entering_ndaq_straddle_end_of_day_today/,yokashi-monta,1,2022-01-25 06:01:02
Tesla: The Melt Up Is Coming,,/r/wallstreetbets/comments/scc4p3/tesla_the_melt_up_is_coming/,droneauto,1,2022-01-25 06:01:13
Tesla: The Melt Up Is Coming,,/r/wallstreetbets/comments/scc5fm/tesla_the_melt_up_is_coming/,droneauto,1,2022-01-25 06:02:20
Tesla: The Melt Up Is Coming,,/r/wallstreetbets/comments/scc6bg/tesla_the_melt_up_is_coming/,droneauto,1,2022-01-25 06:03:31
New! Trying to learn!,,/r/wallstreetbets/comments/scc89m/new_trying_to_learn/,smellyfaces,1,2022-01-25 06:07:00
Will be #bynd the new #gme with more than 40% of short?,,/r/wallstreetbets/comments/sccdpb/will_be_bynd_the_new_gme_with_more_than_40_of/,Shantikk,1,2022-01-25 06:15:31
DD about $GMVD,,/r/wallstreetbets/comments/sccg47/dd_about_gmvd/,Im_Advancing,1,2022-01-25 06:19:56
CTRM being shorted,,/r/wallstreetbets/comments/sccgo9/ctrm_being_shorted/,Acceptable-Host-7076,1,2022-01-25 06:20:44
Wish Aero IPO,,/r/wallstreetbets/comments/scchpd/wish_aero_ipo/,Ghost_AR,1,2022-01-25 06:22:15
I am in Australia and wondering if there are any good robinhood alternatives?,,/r/wallstreetbets/comments/sccipy/i_am_in_australia_and_wondering_if_there_are_any/,arlenoz,1,2022-01-25 06:23:47
I know you don't want to see long ones. Shorten the content and see if you are satisfied.,,/r/wallstreetbets/comments/sccita/i_know_you_dont_want_to_see_long_ones_shorten_the/,lilyxu185,1,2022-01-25 06:23:57
How does liquidation work?,,/r/wallstreetbets/comments/scclho/how_does_liquidation_work/,stackshockprism,1,2022-01-25 06:28:35
Due Diligence,,/r/wallstreetbets/comments/sccmaf/due_diligence/,shell_shock_45,1,2022-01-25 06:29:55
You all will be blown out,,/r/wallstreetbets/comments/sccmau/you_all_will_be_blown_out/,Mr_Joe01,1,2022-01-25 06:29:57
1000 point swings= big wigs using your stop losses as a meme stock….what say you,,/r/wallstreetbets/comments/sccmty/1000_point_swings_big_wigs_using_your_stop_losses/,LeaderAppropriate420,1,2022-01-25 06:30:39
What is litecoin. History and future predictions of litecoin ?,,/r/wallstreetbets/comments/scco2x/what_is_litecoin_history_and_future_predictions/,EffectSignificant840,1,2022-01-25 06:32:30
Wisk Aero questions,,/r/wallstreetbets/comments/sccovm/wisk_aero_questions/,Ghost_AR,1,2022-01-25 06:33:41
"Pls sir, tweet about WISH",,/r/wallstreetbets/comments/sccptd/pls_sir_tweet_about_wish/,Garc-,1,2022-01-25 06:35:15
Is it Possible to predict one of the top Mover with like 2000% in 24 Hours?,,/r/wallstreetbets/comments/sccrie/is_it_possible_to_predict_one_of_the_top_mover/,Bxtchslayer69,1,2022-01-25 06:38:04
Is the next Great Muppet Reaping at hand?,,/r/wallstreetbets/comments/sccsuv/is_the_next_great_muppet_reaping_at_hand/,Boo_Randy,1,2022-01-25 06:40:09
Thanks IBM,,/r/wallstreetbets/comments/sccthm/thanks_ibm/,kartayyar,1,2022-01-25 06:41:01
Why I HODL Tesla Shares,,/r/wallstreetbets/comments/sccuca/why_i_hodl_tesla_shares/,mlamping,1,2022-01-25 06:42:11
"Sorrento therapeutic (SRNE): New Synthetic Antibody Appears To Block Omicron, All Other Known Variants",,/r/wallstreetbets/comments/sccuf6/sorrento_therapeutic_srne_new_synthetic_antibody/,Impressive_Article64,1,2022-01-25 06:42:18
First time posting / complete noob to trading. Trying to wrap brain around PUTS.,,/r/wallstreetbets/comments/sccui0/first_time_posting_complete_noob_to_trading/,CODM-VANILLA_DENZEL,1,2022-01-25 06:42:24
WTF is going on? Was yesterday’s red crash to green a BS bull trap?,,/r/wallstreetbets/comments/sccun3/wtf_is_going_on_was_yesterdays_red_crash_to_green/,dabskinumba9,1,2022-01-25 06:42:37
"If at first you don't succeed try, try again",,/r/wallstreetbets/comments/sccuq2/if_at_first_you_dont_succeed_try_try_again/,kartayyar,1,2022-01-25 06:42:43
I think my mind just went on a Tinder date with the algos and I think she revealed how she works the market.,,/r/wallstreetbets/comments/sccvx0/i_think_my_mind_just_went_on_a_tinder_date_with/,DaDegenerateGambler,1,2022-01-25 06:44:32
NFLX $300 puts? 🙈🤷‍♂️,,/r/wallstreetbets/comments/sccxry/nflx_300_puts/,Quick_Seesaw_2164,1,2022-01-25 06:47:37
I've been recently interested in tracking trades from congressional members. Is there a way to track their transactions the day it happened?,,/r/wallstreetbets/comments/scd054/ive_been_recently_interested_in_tracking_trades/,actuallyimfunny,1,2022-01-25 06:51:08
Is the next Great Muppet Reaping at hand?,,/r/wallstreetbets/comments/scd17q/is_the_next_great_muppet_reaping_at_hand/,Boo_Randy,1,2022-01-25 06:52:33
A literal shit post 💩,,/r/wallstreetbets/comments/scd4n8/a_literal_shit_post/,NoobWhoLikesTheStock,1,2022-01-25 06:57:45
Please stop this man,,/r/wallstreetbets/comments/scd5jg/please_stop_this_man/,ilovenomar5,1,2022-01-25 06:59:08
Finally made it wsb worthy I guess. Is anyone else using their 401k through work? Can you still drs? Thanks,,/r/wallstreetbets/comments/scd9ae/finally_made_it_wsb_worthy_i_guess_is_anyone_else/,asimes1,1,2022-01-25 07:04:00
I think I see a trend starting to form here,,/r/wallstreetbets/comments/scdcj9/i_think_i_see_a_trend_starting_to_form_here/,xDeadPresidents,1,2022-01-25 07:08:55
I don’t know what to make of this…I’m so confused.,,/r/wallstreetbets/comments/scdck2/i_dont_know_what_to_make_of_thisim_so_confused/,COVID-SIXTY9,1,2022-01-25 07:08:58
A flat year is a win in my book,,/r/wallstreetbets/comments/scdedg/a_flat_year_is_a_win_in_my_book/,robotpirate,1,2022-01-25 07:11:33
PENTA TOKEN,,/r/wallstreetbets/comments/scdeqo/penta_token/,Nasir18018,1,2022-01-25 07:12:02
I’ve been keeping this strategy to myself for a while now.,,/r/wallstreetbets/comments/scdim7/ive_been_keeping_this_strategy_to_myself_for_a/,Any-coat-1321,1,2022-01-25 07:17:23
🕖The best sites to make money online 🕚,,/r/wallstreetbets/comments/scdjj9/the_best_sites_to_make_money_online/,Interesting_Test6074,1,2022-01-25 07:18:27
Going hard at GOFL - Goldflare Exploration - solid locations in Quebec - nice and cheap and lots of upside.,,/r/wallstreetbets/comments/scdkiq/going_hard_at_gofl_goldflare_exploration_solid/,Positive_Slight,1,2022-01-25 07:19:33
Gme squeeze?,,/r/wallstreetbets/comments/scdl3n/gme_squeeze/,RunningEmu77,1,2022-01-25 07:20:12
Not a Bear. Not a Bull. A Bumble. Bumbles bounce!,,/r/wallstreetbets/comments/scdmom/not_a_bear_not_a_bull_a_bumble_bumbles_bounce/,GrymmTravel,1,2022-01-25 07:22:11
Is Peter Tuchman buy signal ?,,/r/wallstreetbets/comments/scdo6n/is_peter_tuchman_buy_signal/,indigoskcz,1,2022-01-25 07:24:18
Is Peter Tuchman buy signal ?,,/r/wallstreetbets/comments/scdp3o/is_peter_tuchman_buy_signal/,indigoskcz,1,2022-01-25 07:25:38
I hope all you bro's have your applications filled out.,,/r/wallstreetbets/comments/scdqda/i_hope_all_you_bros_have_your_applications_filled/,Silent-Oblivion,1,2022-01-25 07:27:35
Do you think my portfolio is over-diversified?,,/r/wallstreetbets/comments/scdrnl/do_you_think_my_portfolio_is_overdiversified/,t014,1,2022-01-25 07:29:34
Portfolio is 23% down from the day before. I hope you bro's have your applications filled out as I do.,,/r/wallstreetbets/comments/scds2m/portfolio_is_23_down_from_the_day_before_i_hope/,Silent-Oblivion,1,2022-01-25 07:30:10
"Chargepoint- looks like a good company with potential, and seems to have 15% short intrest, what your thoughts? Any potential for squiz?",,/r/wallstreetbets/comments/scdsf0/chargepoint_looks_like_a_good_company_with/,Little_Sort9612,1,2022-01-25 07:30:34
The Fed corruption “scandal” and how they fooled the world…,,/r/wallstreetbets/comments/scdsia/the_fed_corruption_scandal_and_how_they_fooled/,headforhead,1,2022-01-25 07:30:41
Pros and Cons of Online Education,,/r/wallstreetbets/comments/scdvpv/pros_and_cons_of_online_education/,maheshwarisid17,1,2022-01-25 07:35:01
"14.65% of QS stocks, that is 31.4 Million QS stocks are short, it will take 2.7 days to cover short. Short squeeze ?",,/r/wallstreetbets/comments/scdwk4/1465_of_qs_stocks_that_is_314_million_qs_stocks/,Smart_Trade_Buy_Now,1,2022-01-25 07:36:11
"WSB Pre-Market Community Talk for Tuesday January 25th, 2022 (8:30am - 9:30am EST)",,/r/wallstreetbets/comments/scdwp2/wsb_premarket_community_talk_for_tuesday_january/,OPINION_IS_UNPOPULAR,1,2022-01-25 07:36:22
NFT Project is about to relase!!,,/r/wallstreetbets/comments/scdx60/nft_project_is_about_to_relase/,Jxnasa,1,2022-01-25 07:37:00
Anyone else?,,/r/wallstreetbets/comments/scdym0/anyone_else/,Lotus_Stalker,1,2022-01-25 07:39:03
$DWAC Fintel reports 11.2% of the float short and a 103.3% cost to borrow on shares.,,/r/wallstreetbets/comments/scdzia/dwac_fintel_reports_112_of_the_float_short_and_a/,CareNo8418,1,2022-01-25 07:40:16
Why boomers think tech is dead,,/r/wallstreetbets/comments/sce3ax/why_boomers_think_tech_is_dead/,eyerollingsex,1,2022-01-25 07:45:31
This is the market now…,,/r/wallstreetbets/comments/sce3jp/this_is_the_market_now/,Adventurous_Lunch984,2,2022-01-25 07:45:51
Elon Musk loses $34b while Jeff Bezos loses $27b in horror week for billionaires,,/r/wallstreetbets/comments/sce7cp/elon_musk_loses_34b_while_jeff_bezos_loses_27b_in/,Boo_Randy,1,2022-01-25 07:51:03
$$$TESLA RECORD HIGH EARNINGS TOMORROW AH STOCK LOOKS DIRT CHEAP BUYING CALLS,,/r/wallstreetbets/comments/sce7k9/tesla_record_high_earnings_tomorrow_ah_stock/,Teslatothemilkyway,1,2022-01-25 07:51:19
Bullish stand for QS - whales are betting on QS - price goal of $16-$30. What I am missing?,,/r/wallstreetbets/comments/sce8i6/bullish_stand_for_qs_whales_are_betting_on_qs/,CongressCA17,1,2022-01-25 07:52:34
Every $500 billion on the Fed balance sheet is worth 25 basis points of tightening.,,/r/wallstreetbets/comments/sceayx/every_500_billion_on_the_fed_balance_sheet_is/,saysjuan,1,2022-01-25 07:56:04
NFT,,/r/wallstreetbets/comments/sced1b/nft/,NFT-Main,1,2022-01-25 07:58:58
Zerohedge says:,,/r/wallstreetbets/comments/scefjx/zerohedge_says/,Which-Run5249,1,2022-01-25 08:01:50
Lebanon depression ‘orchestrated by the country’s elite’: World Bank,,/r/wallstreetbets/comments/scege6/lebanon_depression_orchestrated_by_the_countrys/,Boo_Randy,1,2022-01-25 08:02:49
Republican Congresswoman Nancy Mace Is On A Mission To Legalize Cannabis—And Amazon Just Got Behind Her,,/r/wallstreetbets/comments/scehkx/republican_congresswoman_nancy_mace_is_on_a/,wolfcross_8ema50wma,1,2022-01-25 08:04:21
It’s time to go to war. Suit up.,,/r/wallstreetbets/comments/sceik9/its_time_to_go_to_war_suit_up/,papalongstrokee69,1,2022-01-25 08:05:39
GameStop apes!,,/r/wallstreetbets/comments/sceine/gamestop_apes/,Character_Broccoli79,1,2022-01-25 08:05:45
"Nancy Pelosi has amassed a $117 million fortune during her ""public service."" Her stock portfolio is up 69% year to date. No wonder all of ""our"" representatives are multimillionaires by the time they retire from Congress &amp; the Senate",,/r/wallstreetbets/comments/scejfa/nancy_pelosi_has_amassed_a_117_million_fortune/,Boo_Randy,1,2022-01-25 08:06:50
🚨🐻🚨 Thanks Yahoo Finance for the DD,,/r/wallstreetbets/comments/scejgd/thanks_yahoo_finance_for_the_dd/,holyeffman,1,2022-01-25 08:06:52
The yesterday's deep just looks very similar to the deep back in 2020 Feb to me....,,/r/wallstreetbets/comments/scejmk/the_yesterdays_deep_just_looks_very_similar_to/,MayTheBearbewithU,1,2022-01-25 08:07:06
China property giant has once again missed debt deadline but bankruptcy filings remain elusive,,/r/wallstreetbets/comments/scejnk/china_property_giant_has_once_again_missed_debt/,fuckHg,1,2022-01-25 08:07:09
things will go back to green when he stops tearing it up,,/r/wallstreetbets/comments/scekow/things_will_go_back_to_green_when_he_stops/,ItchyRice69,1,2022-01-25 08:08:37
I am an Ape who went all in on GME options!! Second year apart of WSB. To the mooon!! I would do it all over again. YOLO everything AMC IS STILL MY BEST TRADE. 🚀🌙🦍,,/r/wallstreetbets/comments/scelsh/i_am_an_ape_who_went_all_in_on_gme_options_second/,Rude-Candle-3251,1,2022-01-25 08:10:07
More losses.. Gonna have to skip lunch today,,/r/wallstreetbets/comments/scemgv/more_losses_gonna_have_to_skip_lunch_today/,themfeelsyo,1,2022-01-25 08:10:54
"The market has fucked me, and my asshole is the same color as it",,/r/wallstreetbets/comments/scenrv/the_market_has_fucked_me_and_my_asshole_is_the/,awesomazz,1,2022-01-25 08:12:26
"TLRY showing promise in next quarter, get in on the dip!",,/r/wallstreetbets/comments/scepzb/tlry_showing_promise_in_next_quarter_get_in_on/,Redrocker28,1,2022-01-25 08:15:24
🚨🐻🚨 Thanks Yahoo Finance for the DD,,/r/wallstreetbets/comments/scer5e/thanks_yahoo_finance_for_the_dd/,holyeffman,1,2022-01-25 08:17:02
"Pre-market watch: European stocks rally across the board! Tensions Ease Between Russia, Ukraine?",,/r/wallstreetbets/comments/scerxt/premarket_watch_european_stocks_rally_across_the/,abigaillv700,1,2022-01-25 08:18:08
Looking at SDC Options Play,,/r/wallstreetbets/comments/sces1g/looking_at_sdc_options_play/,ThePracticalInvestor,1,2022-01-25 08:18:15
Any thoughts on Diana Shipping Inc (DSX)?,,/r/wallstreetbets/comments/sceshv/any_thoughts_on_diana_shipping_inc_dsx/,Norm-is-here,1,2022-01-25 08:18:52
Looking at SDC Options Play,,/r/wallstreetbets/comments/scet7o/looking_at_sdc_options_play/,ThePracticalInvestor,1,2022-01-25 08:19:50
"From down 95% to up 99%, don't give up retards",,/r/wallstreetbets/comments/scetoc/from_down_95_to_up_99_dont_give_up_retards/,FederalParfait,1,2022-01-25 08:20:24
Imagine if Putin shorts IXIC before launching the invasion...,,/r/wallstreetbets/comments/scetr5/imagine_if_putin_shorts_ixic_before_launching_the/,loughl,1,2022-01-25 08:20:30
ITS NOT OVER!!,,/r/wallstreetbets/comments/sceu6h/its_not_over/,Few_Application,1,2022-01-25 08:20:58
"From down 95% to up 99%, don't give up retards. It's only a loss when you give up, not when you sell at a loss.",,/r/wallstreetbets/comments/scev4e/from_down_95_to_up_99_dont_give_up_retards_its/,FederalParfait,1,2022-01-25 08:22:05
SDC Options Play,,/r/wallstreetbets/comments/scew1l/sdc_options_play/,ThePracticalInvestor,1,2022-01-25 08:23:07
"As inflation gets worse, this stock looks better:",,/r/wallstreetbets/comments/scf033/as_inflation_gets_worse_this_stock_looks_better/,Green-Clerk6,1,2022-01-25 08:28:38
It’s starring you right in the face!,,/r/wallstreetbets/comments/scf1q2/its_starring_you_right_in_the_face/,Tight-Low-420,1,2022-01-25 08:30:49
Who’s buyin the dip?,,/r/wallstreetbets/comments/scf4yh/whos_buyin_the_dip/,Additional_Bet_3752,1,2022-01-25 08:35:16
Green day after this?,,/r/wallstreetbets/comments/scf5lt/green_day_after_this/,rdxgcg,1,2022-01-25 08:36:15
AMARIN- Going to skyrocket because of Denner,,/r/wallstreetbets/comments/scf6sy/amarin_going_to_skyrocket_because_of_denner/,Andbie0220,1,2022-01-25 08:37:56
"Alright, which one of you retards is this",,/r/wallstreetbets/comments/scf7b2/alright_which_one_of_you_retards_is_this/,sethpwnsk,1,2022-01-25 08:38:39
NASDAQ future,,/r/wallstreetbets/comments/scf7ne/nasdaq_future/,TQQQBuyAndHold,1,2022-01-25 08:39:06
Doing better than arkk,,/r/wallstreetbets/comments/scfaeo/doing_better_than_arkk/,bryantheactivist,1,2022-01-25 08:42:46
Doing better than ARKK,,/r/wallstreetbets/comments/scfbci/doing_better_than_arkk/,bryantheactivist,1,2022-01-25 08:44:00
You know your down bad when these are the only types of calls you can afford anymore,,/r/wallstreetbets/comments/scfbqa/you_know_your_down_bad_when_these_are_the_only/,Tylenol_Creator,1,2022-01-25 08:44:30
need some opinions on clguf,,/r/wallstreetbets/comments/scfbxy/need_some_opinions_on_clguf/,Material-Bad-3942,1,2022-01-25 08:44:46
WINTER BLUES,,/r/wallstreetbets/comments/scfghr/winter_blues/,clinchgrinch,1,2022-01-25 08:50:53
Anybody else get a daily ~360 low on SPY today?,,/r/wallstreetbets/comments/scfgy0/anybody_else_get_a_daily_360_low_on_spy_today/,GreenDildoSurprise,1,2022-01-25 08:51:33
We appreciate you!,,/r/wallstreetbets/comments/scfj4h/we_appreciate_you/,connsack,1,2022-01-25 08:54:28
Onyx and Introduction is a type of agate on Peshawar.,,/r/wallstreetbets/comments/scfk99/onyx_and_introduction_is_a_type_of_agate_on/,Dry_Cycle_4578,1,2022-01-25 08:56:05
WINTER BLUES (w/positions),,/r/wallstreetbets/comments/scfl72/winter_blues_wpositions/,clinchgrinch,1,2022-01-25 08:57:18
TDA: Massive spy wick!?,,/r/wallstreetbets/comments/scfmzb/tda_massive_spy_wick/,no_prop,1,2022-01-25 08:59:41
Advice please - Dads IRA,,/r/wallstreetbets/comments/scfof2/advice_please_dads_ira/,Valuable_Tap530,1,2022-01-25 09:01:18
TXMD?,,/r/wallstreetbets/comments/scfohm/txmd/,david-of_all_trades,1,2022-01-25 09:01:23
Check out CRK,,/r/wallstreetbets/comments/scfoii/check_out_crk/,Repulsive-Animal4650,1,2022-01-25 09:01:24
Anyone else ready to watch it burn?,,/r/wallstreetbets/comments/scfojk/anyone_else_ready_to_watch_it_burn/,EnoughIndependence81,1,2022-01-25 09:01:27
How does someone buy SPY for 364 when it's trading sideways at 428?,,/r/wallstreetbets/comments/scfp09/how_does_someone_buy_spy_for_364_when_its_trading/,Present-Evidence-905,1,2022-01-25 09:02:05
They will never learn.,,/r/wallstreetbets/comments/scfqwe/they_will_never_learn/,jonahpryor,1,2022-01-25 09:04:33
There is nothing as satisfying as being a 🌈🐻 watching some hardcore recession gore,,/r/wallstreetbets/comments/scfqxl/there_is_nothing_as_satisfying_as_being_a/,Friendlywagie,1,2022-01-25 09:04:35
Is anyone else getting a SPY daily low of ~365? This is from ToS,,/r/wallstreetbets/comments/scfrh0/is_anyone_else_getting_a_spy_daily_low_of_365/,GreenDildoSurprise,1,2022-01-25 09:05:19
Question about SPY price.,,/r/wallstreetbets/comments/scfter/question_about_spy_price/,Present-Evidence-905,1,2022-01-25 09:07:43
RETO,,/r/wallstreetbets/comments/scftuc/reto/,GnarlyNugget12,1,2022-01-25 09:08:16
We now know what Cathie gonna be doing tonight 🙃,,/r/wallstreetbets/comments/scfv05/we_now_know_what_cathie_gonna_be_doing_tonight/,daynightcase,1,2022-01-25 09:09:48
This is what my ToS charts are showing on SPY today. Did this actually happen or is this just a bug on my chart? Anyone else seeing it?,,/r/wallstreetbets/comments/scfxf1/this_is_what_my_tos_charts_are_showing_on_spy/,Kane1124,1,2022-01-25 09:13:05
"We all had times where we invested and were almost 100 percent certain it will go the way we wanted , no doubt, and it actually did go that way. What was your play?",,/r/wallstreetbets/comments/scfyv0/we_all_had_times_where_we_invested_and_were/,QuietCauliflower4371,1,2022-01-25 09:15:03
🍌📈,,/r/wallstreetbets/comments/scfza8/_/,SkippyGG,1,2022-01-25 09:15:34
Money Tree stopped shedding and now is sprouting new leaves. Correction is about to be over.,,/r/wallstreetbets/comments/scfzo3/money_tree_stopped_shedding_and_now_is_sprouting/,DoolgiB,1,2022-01-25 09:16:08
NASDAQ future .. chart of two way,,/r/wallstreetbets/comments/scg1sh/nasdaq_future_chart_of_two_way/,TQQQBuyAndHold,1,2022-01-25 09:18:58
Bad news bears for the guy talking Logitech in the community chat this morning. I'm so sorry 😞,,/r/wallstreetbets/comments/scg2f1/bad_news_bears_for_the_guy_talking_logitech_in/,M45K3DG4M3R,1,2022-01-25 09:19:49
Something looks wrong with SPY,,/r/wallstreetbets/comments/scg2ra/something_looks_wrong_with_spy/,TendieSheriff,1,2022-01-25 09:20:13
CRK (Comstock Resources),,/r/wallstreetbets/comments/scg3rs/crk_comstock_resources/,Repulsive-Animal4650,1,2022-01-25 09:21:29
Bad news bears for the dude talking Logitech in the community talk yesterdayand today. I'm so sorry 😞,,/r/wallstreetbets/comments/scg5rd/bad_news_bears_for_the_dude_talking_logitech_in/,M45K3DG4M3R,1,2022-01-25 09:24:02
"Who gives two singular fucks what Jim Cramer says or who he is? He is old money, bleeting like a sheep to old fogies on daytime television.",,/r/wallstreetbets/comments/scg6o9/who_gives_two_singular_fucks_what_jim_cramer_says/,Vaginal_Rights,1,2022-01-25 09:25:15
He's probably writing more MOASS DD,,/r/wallstreetbets/comments/scg73c/hes_probably_writing_more_moass_dd/,aubullion,1,2022-01-25 09:25:47
How is the Mattress King doing? $PRPL is down 80% from its ATH and I need to know if he is okay.,,/r/wallstreetbets/comments/scg7gz/how_is_the_mattress_king_doing_prpl_is_down_80/,-Schweini31-,1,2022-01-25 09:26:17
GME,,/r/wallstreetbets/comments/scg8wh/gme/,Ok_Coat_921,1,2022-01-25 09:28:06
Recession Over !!!!! BUY SIGNAL !!!,,/r/wallstreetbets/comments/scg934/recession_over_buy_signal/,djexit,1,2022-01-25 09:28:22
ADGI going up,,/r/wallstreetbets/comments/scg9wp/adgi_going_up/,sis23,1,2022-01-25 09:29:21
"“Be careful buying stock at a lower price, instead, buy it at a higher one”",,/r/wallstreetbets/comments/scgaqe/be_careful_buying_stock_at_a_lower_price_instead/,murph663,1,2022-01-25 09:30:22
Fed “put” will stop this bleeding. They are discussing changing course with interest rates as we speak. Buy up!,,/r/wallstreetbets/comments/scgc0e/fed_put_will_stop_this_bleeding_they_are/,MassiveCockie,1,2022-01-25 09:31:54
#buildamericabetter,,/r/wallstreetbets/comments/scgc6i/buildamericabetter/,Sad_Confidence_2640,1,2022-01-25 09:32:07
Should WSB take on NFTs?) An Opensea bug that made Bored Apes NFTs go bananas!,,/r/wallstreetbets/comments/scgcct/should_wsb_take_on_nfts_an_opensea_bug_that_made/,andreilicious,1,2022-01-25 09:32:21
should i sell my entire portfolio now?,,/r/wallstreetbets/comments/scgcsi/should_i_sell_my_entire_portfolio_now/,BuffaloDull1149,1,2022-01-25 09:32:53
Buy the dip you idiots. Powell actually growing wings he is so dovish.,,/r/wallstreetbets/comments/scgd6i/buy_the_dip_you_idiots_powell_actually_growing/,xxbearillaxx,1,2022-01-25 09:33:21
We’ll my yolo puts on IBM didn’t work out at all 🤣🤣🤣🤣🤣,,/r/wallstreetbets/comments/scge7x/well_my_yolo_puts_on_ibm_didnt_work_out_at_all/,Dapper-Advertising53,1,2022-01-25 09:34:36
Look at my beautiful new NFT,,/r/wallstreetbets/comments/scghio/look_at_my_beautiful_new_nft/,TheOriginike,1,2022-01-25 09:38:42
6th attempt at longing the bottom.,,/r/wallstreetbets/comments/scgi4d/6th_attempt_at_longing_the_bottom/,fiftytacos,1,2022-01-25 09:39:26
still buying the dip after losing everything ✋💎🤚,,/r/wallstreetbets/comments/scgiab/still_buying_the_dip_after_losing_everything/,L0rd_Le0-1404,1,2022-01-25 09:39:39
I just called all these useless pieces of shit and let them know that they should all be fired and go to jail! Their going to meet tomorrow to vote on whether they should do something about the blatant corruption occurring every single trading day. CALL THE LEAVE THE WORST MESSAGE.,,/r/wallstreetbets/comments/scgj60/i_just_called_all_these_useless_pieces_of_shit/,bartroberts2003,1,2022-01-25 09:40:44
Since we aren't allowed to post about the Tr*mp stock over here(LGB) come on over to the subreddit dedicated to the stock https://www.reddit.com/r/DWAC_Stock?utm_medium=android_app&amp;utm_source=share,,/r/wallstreetbets/comments/scgjrc/since_we_arent_allowed_to_post_about_the_trmp/,TrumpWillWinIn2020,1,2022-01-25 09:41:24
HOOD lovely dip,,/r/wallstreetbets/comments/scglf7/hood_lovely_dip/,TrickyAcanthisitta84,1,2022-01-25 09:43:32
Anatomy of a Bear Market,,/r/wallstreetbets/comments/scgljj/anatomy_of_a_bear_market/,Vincent_Langley,1,2022-01-25 09:43:40
Spaghetti fingers indicator showing definite buzzwords bug short gamma squeeze incoming soon,,/r/wallstreetbets/comments/scgmoh/spaghetti_fingers_indicator_showing_definite/,walnuts223,1,2022-01-25 09:45:06
Find the 2nd GME stock? You want to earn 5 to 10 times more?,,/r/wallstreetbets/comments/scgn3j/find_the_2nd_gme_stock_you_want_to_earn_5_to_10/,Korean_MNA_Pro,1,2022-01-25 09:45:36
DWAC to the moon!! LFG!,,/r/wallstreetbets/comments/scgn3y/dwac_to_the_moon_lfg/,Chenz-Theking-3156,1,2022-01-25 09:45:37
Lol we’ll see,,/r/wallstreetbets/comments/scgnyf/lol_well_see/,TheGreatGoosby,1,2022-01-25 09:46:41
I... Declare.... BANKRUPTCYYYY,,/r/wallstreetbets/comments/scgo6e/i_declare_bankruptcyyyy/,AV8r-2018,1,2022-01-25 09:46:58
