"Got this in the post yesterday, it’s a good sign right? Right?",,/r/wallstreetbets/comments/sdfuoa/got_this_in_the_post_yesterday_its_a_good_sign/,To-The-Moon-Baby,1,2022-01-26 14:41:21
Can someone smart help me out with this?,,/r/wallstreetbets/comments/sdfv45/can_someone_smart_help_me_out_with_this/,SquirmyApe,1,2022-01-26 14:41:51
It's Jerome's fault.,,/r/wallstreetbets/comments/sdfvp6/its_jeromes_fault/,ShickyMicky,1,2022-01-26 14:42:34
Collectively shorting,,/r/wallstreetbets/comments/sdfw4h/collectively_shorting/,Missionximpossible,1,2022-01-26 14:43:04
What is happening with AMD?,,/r/wallstreetbets/comments/sdfxg9/what_is_happening_with_amd/,e_ri_c,1,2022-01-26 14:44:40
Biggest dumbass since 2020? Loss porn is back baby. $NIO $SPY $PTON (my wife’s boyfriend broke up with her),,/r/wallstreetbets/comments/sdfxhh/biggest_dumbass_since_2020_loss_porn_is_back_baby/,TeslaNioBull,1,2022-01-26 14:44:42
Every time.,,/r/wallstreetbets/comments/sdfzwn/every_time/,themarath0n,1,2022-01-26 14:47:33
Now this is the kinda action I like to see,,/r/wallstreetbets/comments/sdg0a0/now_this_is_the_kinda_action_i_like_to_see/,vocatus,1,2022-01-26 14:47:59
#phigroup #phil #philstock #pennystock #amcshortsqueeze #pennystocks #otc #otcstocks TIP TO MAKE MILLIONS DOLLARS!!!$$$$$$ A penny stock to $1.00 HERES PROOF now BUY BUY BUY $PHIL and become Rich 😀 😉 money 💰 💸 😀 https://www.globenewswire.com/news-release/2022/01/25/2372716/0/en/PHI-GROUP-JOI,,/r/wallstreetbets/comments/sdg1c0/phigroup_phil_philstock_pennystock/,brokerwallstny,1,2022-01-26 14:49:12
Included a nice little graphic on the front page of recent report I made for work 🦍,,/r/wallstreetbets/comments/sdg29f/included_a_nice_little_graphic_on_the_front_page/,thechipzz,1,2022-01-26 14:50:23
Summary of what happened at 2pm Eastern Time today,,/r/wallstreetbets/comments/sdg2cw/summary_of_what_happened_at_2pm_eastern_time_today/,Native136,1,2022-01-26 14:50:31
Apology email on StockTwits for calling someone “retarded”,,/r/wallstreetbets/comments/sdg3b2/apology_email_on_stocktwits_for_calling_someone/,MaroonHawk27,1,2022-01-26 14:51:40
When JPOW opens his mouth,,/r/wallstreetbets/comments/sdg3hh/when_jpow_opens_his_mouth/,herrrrrr,2,2022-01-26 14:51:53
TSLA yolo gains,,/r/wallstreetbets/comments/sdg3iz/tsla_yolo_gains/,yellowoutt,1,2022-01-26 14:51:57
Just buy silver.,,/r/wallstreetbets/comments/sdg3od/just_buy_silver/,Silver-Streaker,1,2022-01-26 14:52:08
On sale: This week only!,,/r/wallstreetbets/comments/sdg4qs/on_sale_this_week_only/,Silver-Streaker,1,2022-01-26 14:53:25
Young Cathie Wood pictures are not priced into ARKK. Bullish!,,/r/wallstreetbets/comments/sdg7lm/young_cathie_wood_pictures_are_not_priced_into/,BenDoverR8Now,1,2022-01-26 14:56:48
With Great Risks Comes Great Rewards,,/r/wallstreetbets/comments/sdg7y5/with_great_risks_comes_great_rewards/,audyntarek,1,2022-01-26 14:57:11
Tesla calls or puts ?,,/r/wallstreetbets/comments/sdg7zd/tesla_calls_or_puts/,Aerostyles13,1,2022-01-26 14:57:13
"What Are Your Moves Tomorrow, January 27, 2022",,/r/wallstreetbets/comments/sdgahh/what_are_your_moves_tomorrow_january_27_2022/,AutoModerator,1,2022-01-26 15:00:13
If it's free why'd it cost so much..,,/r/wallstreetbets/comments/sdgb0x/if_its_free_whyd_it_cost_so_much/,TendiesApp,1,2022-01-26 15:00:36
"MJNA is one of these companies!!! if the news of cbds act as a covid blocker is real, MJNA good spot!!!",,/r/wallstreetbets/comments/sdgbi2/mjna_is_one_of_these_companies_if_the_news_of/,Montalian,1,2022-01-26 15:01:10
He wasn’t lying 🤥,,/r/wallstreetbets/comments/sdgcmk/he_wasnt_lying/,fandj1,1,2022-01-26 15:02:30
ETF Portfolio: QQQ + SCHD 50/50?,,/r/wallstreetbets/comments/sdgdqk/etf_portfolio_qqq_schd_5050/,zendmugz,1,2022-01-26 15:03:50
Why no APES in this film poster!? I feel misrepresented.,,/r/wallstreetbets/comments/sdgdsj/why_no_apes_in_this_film_poster_i_feel/,LuthienDragon,1,2022-01-26 15:03:54
"Well, it was a good run boys. Time to YOLO",,/r/wallstreetbets/comments/sdgeth/well_it_was_a_good_run_boys_time_to_yolo/,rexviper1,1,2022-01-26 15:05:15
My Dad when he sees my trades after moving back in.,,/r/wallstreetbets/comments/sdgg4o/my_dad_when_he_sees_my_trades_after_moving_back_in/,Frosty_Potatoes,1,2022-01-26 15:06:52
Coke rat is hitting the bottle again. We are starting to get to him🦍🚀,,/r/wallstreetbets/comments/sdgg6l/coke_rat_is_hitting_the_bottle_again_we_are/,rocket6733,1,2022-01-26 15:06:56
"Well boys, it’s time to start labeling this a recession. 2008 Nasdaq vs current. See any similarities?",,/r/wallstreetbets/comments/sdgh1i/well_boys_its_time_to_start_labeling_this_a/,louiscasey,1,2022-01-26 15:07:57
Do you ever get scared by the market? Are you ever afraid you may be really retarded?,,/r/wallstreetbets/comments/sdghat/do_you_ever_get_scared_by_the_market_are_you_ever/,YTChillVibesLofi,1,2022-01-26 15:08:17
Powell = Fry,,/r/wallstreetbets/comments/sdghxf/powell_fry/,Repulsive_Coat_3130,1,2022-01-26 15:09:02
Are there any awards for people this retarded?,,/r/wallstreetbets/comments/sdgi3m/are_there_any_awards_for_people_this_retarded/,YarOldeOrchard,1,2022-01-26 15:09:13
This is me throughout entire FOMC,,/r/wallstreetbets/comments/sdgi8t/this_is_me_throughout_entire_fomc/,-Jerms-,1,2022-01-26 15:09:24
I was a little scared bear 🐻 today until Jerome saved the day .. what a roller coaster of a day .,,/r/wallstreetbets/comments/sdgiof/i_was_a_little_scared_bear_today_until_jerome/,MoreToFuture,1,2022-01-26 15:09:56
"Tesla earnings beat, why’s the stock down AH?",,/r/wallstreetbets/comments/sdgjvr/tesla_earnings_beat_whys_the_stock_down_ah/,swiftd03,1,2022-01-26 15:11:24
Tesla beats on earnings and revenue,,/r/wallstreetbets/comments/sdgkql/tesla_beats_on_earnings_and_revenue/,AptitudeSky,1,2022-01-26 15:12:24
Is Steph Curry's 3-point shooting slump happening because of bit coin?,,/r/wallstreetbets/comments/sdgolg/is_steph_currys_3point_shooting_slump_happening/,RobertRo7e,1,2022-01-26 15:17:03
Confused about Tesla moves after hours. Beat earnings by 20% but the stock drops 5% AH’s?,,/r/wallstreetbets/comments/sdgp27/confused_about_tesla_moves_after_hours_beat/,swiftd03,1,2022-01-26 15:17:35
Novavax Inc - NVAX Catalysts are quickly approaching,,/r/wallstreetbets/comments/sdgppk/novavax_inc_nvax_catalysts_are_quickly_approaching/,1400yearsold,1,2022-01-26 15:18:23
DigiMax Global (CNSX: $DIGI) (OTC: $DBKSF) CryptoHawk AI Provides Power Predictive Tool to Provide Insight into Volatile Trading Space,,/r/wallstreetbets/comments/sdgqvs/digimax_global_cnsx_digi_otc_dbksf_cryptohawk_ai/,stanmilc,1,2022-01-26 15:19:44
Thoughts on Interest Rates and Inflatio,,/r/wallstreetbets/comments/sdgrbk/thoughts_on_interest_rates_and_inflatio/,BarbarousRelic,1,2022-01-26 15:20:14
Money printer still go brrr?,,/r/wallstreetbets/comments/sdgtmz/money_printer_still_go_brrr/,yolocallking,1,2022-01-26 15:23:01
Do you all actually think GME will moon?,,/r/wallstreetbets/comments/sdgtnv/do_you_all_actually_think_gme_will_moon/,Strict_Reflection553,1,2022-01-26 15:23:02
How will MSFT close on Jan 27th?,,/r/wallstreetbets/comments/sdgtyz/how_will_msft_close_on_jan_27th/,OPINION_IS_UNPOPULAR,1,2022-01-26 15:23:25
How will SPY close on Jan 27th?,,/r/wallstreetbets/comments/sdgvbc/how_will_spy_close_on_jan_27th/,OPINION_IS_UNPOPULAR,1,2022-01-26 15:25:06
Rode the Powell calls and switched to puts right before he spoke,,/r/wallstreetbets/comments/sdgwpz/rode_the_powell_calls_and_switched_to_puts_right/,Mission_Paramedic831,1,2022-01-26 15:26:44
What am I waking up to tomorrow?,,/r/wallstreetbets/comments/sdgwso/what_am_i_waking_up_to_tomorrow/,Butt-Spelunker,1,2022-01-26 15:26:50
ARKK before vs ARKK now,,/r/wallstreetbets/comments/sdgxez/arkk_before_vs_arkk_now/,delsombra,1,2022-01-26 15:27:36
Definitely in Correction Territory Now,,/r/wallstreetbets/comments/sdgxj7/definitely_in_correction_territory_now/,The_Justin_Memer,1,2022-01-26 15:27:45
I’m somewhat of an investor myself.,,/r/wallstreetbets/comments/sdgyh3/im_somewhat_of_an_investor_myself/,Marnip,1,2022-01-26 15:28:53
What am I waking up to tomorrow?,,/r/wallstreetbets/comments/sdgz35/what_am_i_waking_up_to_tomorrow/,Butt-Spelunker,1,2022-01-26 15:29:40
Somebody advised VTVT one year ago on wsb...,,/r/wallstreetbets/comments/sdgz7o/somebody_advised_vtvt_one_year_ago_on_wsb/,danger89,1,2022-01-26 15:29:50
Today was a hell of a year.,,/r/wallstreetbets/comments/sdh064/today_was_a_hell_of_a_year/,lifeinthefastLAN,1,2022-01-26 15:30:53
Helping retail traders invest responsibly,,/r/wallstreetbets/comments/sdh0y2/helping_retail_traders_invest_responsibly/,freedomlovepeace,1,2022-01-26 15:31:52
J pow raped my calls...it's fun being retarded,,/r/wallstreetbets/comments/sdh47m/j_pow_raped_my_callsits_fun_being_retarded/,Expert_Bag8784,1,2022-01-26 15:35:45
"they better keep a close eye on Wendy's ""vacant positions"" rate",,/r/wallstreetbets/comments/sdh5ab/they_better_keep_a_close_eye_on_wendys_vacant/,mbj7000,1,2022-01-26 15:37:03
"Thanks daddy Powell, just made more than my 9-5 would pay me in a year",,/r/wallstreetbets/comments/sdh6y2/thanks_daddy_powell_just_made_more_than_my_95/,EpacTheta,1,2022-01-26 15:39:01
Thanks daddy Powell,,/r/wallstreetbets/comments/sdh7ax/thanks_daddy_powell/,EpacTheta,1,2022-01-26 15:39:26
"Momentum. Hey y’all! Whats the short percentage on Nio, AAL or any of the pot stocks? Im itching for some action😂",,/r/wallstreetbets/comments/sdh7mw/momentum_hey_yall_whats_the_short_percentage_on/,No-Asparagus680,1,2022-01-26 15:39:51
"Low effort, but its how I feel.... like Batman, only not dangerous at all and broke",,/r/wallstreetbets/comments/sdh9ds/low_effort_but_its_how_i_feel_like_batman_only/,CraftyWookiee,1,2022-01-26 15:42:00
New guy,,/r/wallstreetbets/comments/sdh9pq/new_guy/,krunous,1,2022-01-26 15:42:27
What to do with my GME $115 call expiring on 1/28 ?? 😔😔 I am 70% down rn,,/r/wallstreetbets/comments/sdhbbf/what_to_do_with_my_gme_115_call_expiring_on_128_i/,OverCrazy2434,1,2022-01-26 15:44:35
Mcdonalds already hitting me up,,/r/wallstreetbets/comments/sdhcfv/mcdonalds_already_hitting_me_up/,IN-B4-404,1,2022-01-26 15:46:00
Check out CCL. Its up and ready to break out imo,,/r/wallstreetbets/comments/sdhdnv/check_out_ccl_its_up_and_ready_to_break_out_imo/,No-Asparagus680,1,2022-01-26 15:47:34
new guy,,/r/wallstreetbets/comments/sdhem3/new_guy/,krunous,1,2022-01-26 15:48:43
DKNG Stock: Accumulate DraftKings Stock While It's Selling at a Discount,,/r/wallstreetbets/comments/sdhf5g/dkng_stock_accumulate_draftkings_stock_while_its/,Street_Country_1266,1,2022-01-26 15:49:24
Red carpet post-FOMC Q&amp;A session,,/r/wallstreetbets/comments/sdhg2m/red_carpet_postfomc_qa_session/,Damascinos,1,2022-01-26 15:50:30
QUESTION - After hours movements and IV,,/r/wallstreetbets/comments/sdhj2l/question_after_hours_movements_and_iv/,TheUltimator5,1,2022-01-26 15:54:02
Am I doing this right?,,/r/wallstreetbets/comments/sdhly8/am_i_doing_this_right/,vicjitsu,1,2022-01-26 15:57:43
LOVE JPOW,,/r/wallstreetbets/comments/sdhmb7/love_jpow/,Life-Scientist5102,1,2022-01-26 15:58:12
How…..someone explain this,,/r/wallstreetbets/comments/sdhmea/howsomeone_explain_this/,Swamy_ji,1,2022-01-26 15:58:19
Jim if you see this im not sorry,,/r/wallstreetbets/comments/sdhmrt/jim_if_you_see_this_im_not_sorry/,steve27477,1,2022-01-26 15:58:47
"Loss porn (screenshot from Oct 21’) ANY, BITF, NCTY, HUT (a friend, not me)",,/r/wallstreetbets/comments/sdhmtt/loss_porn_screenshot_from_oct_21_any_bitf_ncty/,jimzenn,1,2022-01-26 15:58:51
Why do you think that Karp and Thiel do not participate in the earnings calls?,,/r/wallstreetbets/comments/sdhmvq/why_do_you_think_that_karp_and_thiel_do_not/,prettyboyv,1,2022-01-26 15:58:55
$SHIBER 🇺🇸 ShiBerse HAS ARRIVED 🚀 📅 02/16,,/r/wallstreetbets/comments/sdhn7i/shiber_shiberse_has_arrived_0216/,FriendDeep8215,1,2022-01-26 15:59:20
$SHIBER 🇺🇸 ShiBerse HAS ARRIVED 🚀 📅 02/16,,/r/wallstreetbets/comments/sdhpgu/shiber_shiberse_has_arrived_0216/,FriendDeep8215,1,2022-01-26 16:01:39
AMRN has a white knight. But who is Dr Denner? And why should you follow him into AMRN?,,/r/wallstreetbets/comments/sdhpho/amrn_has_a_white_knight_but_who_is_dr_denner_and/,Disasterdujour888,1,2022-01-26 16:01:41
"Time-Lapse: Losing $2,400,000 Robinhood Portfolio",,/r/wallstreetbets/comments/sdhpvt/timelapse_losing_2400000_robinhood_portfolio/,WozhaemoL,1,2022-01-26 16:02:09
Mood,,/r/wallstreetbets/comments/sdhtqv/mood/,MrLETTUCE414,1,2022-01-26 16:06:52
Rare NFT &gt; fiat money,,/r/wallstreetbets/comments/sdhtx6/rare_nft_fiat_money/,Rang_Dipkin,1,2022-01-26 16:07:05
👀🦶🏻✨,,/r/wallstreetbets/comments/sdhviw/_/,Single_Taro_4242,1,2022-01-26 16:09:02
This.,,/r/wallstreetbets/comments/sdhvnw/this/,TheRealDONjohnson_24,1,2022-01-26 16:09:12
Was this a good idea?,,/r/wallstreetbets/comments/sdhw1h/was_this_a_good_idea/,MemeMachine83,1,2022-01-26 16:09:41
https://www.the-sun.com/news/4541224/ozzie-zoo-atlanta-oldest-gorilla-dead/,,/r/wallstreetbets/comments/sdhypx/httpswwwthesuncomnews4541224ozziezooatlantaoldestg/,NYLawyer770,1,2022-01-26 16:12:56
ORIGINAL NFT ARTS ____ GOO CHECK MY PROFILE! 50% of the money will be forwarded to donations.,,/r/wallstreetbets/comments/sdhz42/original_nft_arts_goo_check_my_profile_50_of_the/,Professional_Let2852,1,2022-01-26 16:13:25
Seeking TSP Advice - Exiting military service 30APR2023. Any advice to move a thing or 2 around to make the balance grow higher/faster @ my ETS date would be much appreciated.,,/r/wallstreetbets/comments/sdhzng/seeking_tsp_advice_exiting_military_service/,Unable_Unit_9208,1,2022-01-26 16:14:05
Fuck Microvision,,/r/wallstreetbets/comments/sdi0ro/fuck_microvision/,chercover,1,2022-01-26 16:15:24
"If you inverse WSB, do you inverse a post telling you to inverse WSB?",,/r/wallstreetbets/comments/sdi4w2/if_you_inverse_wsb_do_you_inverse_a_post_telling/,King0fTheNorthh,1,2022-01-26 16:20:16
how are you taggling this market? I am doing bad in this,,/r/wallstreetbets/comments/sdi4wk/how_are_you_taggling_this_market_i_am_doing_bad/,1amTimon,1,2022-01-26 16:20:17
I accidentally stumbled into Bogleheads. Worse than r/investing,,/r/wallstreetbets/comments/sdi4yx/i_accidentally_stumbled_into_bogleheads_worse/,Janto_2021,1,2022-01-26 16:20:22
Now this is the kinda action I like,,/r/wallstreetbets/comments/sdi6hs/now_this_is_the_kinda_action_i_like/,vocatus,1,2022-01-26 16:22:13
"don’t know much ab stocks ngl just like the content but i’m looking to put in like 2,000$ what stock or stocks would be good?",,/r/wallstreetbets/comments/sdi6rg/dont_know_much_ab_stocks_ngl_just_like_the/,Much_Night1846,1,2022-01-26 16:22:31
My loss porn (I pulled out of the market temporarily on December 27),,/r/wallstreetbets/comments/sdi77s/my_loss_porn_i_pulled_out_of_the_market/,cbrad1713,1,2022-01-26 16:23:06
The year of nintendo,,/r/wallstreetbets/comments/sdi7ag/the_year_of_nintendo/,Pilot_Mosley,1,2022-01-26 16:23:12
Cathies $ARKK 🍆,,/r/wallstreetbets/comments/sdi81p/cathies_arkk/,pvr90,1,2022-01-26 16:24:07
Into the mind of the fearful investor...,,/r/wallstreetbets/comments/sdi8jf/into_the_mind_of_the_fearful_investor/,Master-Kittens777,1,2022-01-26 16:24:43
Help Single Mom Start Dream Business,,/r/wallstreetbets/comments/sdic2d/help_single_mom_start_dream_business/,amaturedetective,1,2022-01-26 16:28:55
This pretty much sumps up the market,,/r/wallstreetbets/comments/sdicno/this_pretty_much_sumps_up_the_market/,prettyboyv,1,2022-01-26 16:29:38
any thoughts on XELA in the 60 cent range?,,/r/wallstreetbets/comments/sdidud/any_thoughts_on_xela_in_the_60_cent_range/,RevolutionarySwan267,1,2022-01-26 16:31:04
~30k loss porn FOMC day trading — do not revenge/overtrade/force trades 🤦🏻‍♂️,,/r/wallstreetbets/comments/sdigk3/30k_loss_porn_fomc_day_trading_do_not/,wsbthroaway69420,1,2022-01-26 16:34:17
don’t know much ab stocks ngl,,/r/wallstreetbets/comments/sdih9c/dont_know_much_ab_stocks_ngl/,Much_Night1846,1,2022-01-26 16:35:09
The shit you see on tiktok 🤣🤦‍♂️,,/r/wallstreetbets/comments/sdihf9/the_shit_you_see_on_tiktok/,Justinn18,1,2022-01-26 16:35:21
A wild retard appears!,,/r/wallstreetbets/comments/sdiihq/a_wild_retard_appears/,whirling_cynic,1,2022-01-26 16:36:43
"I’ve had enough, if the market won’t give me any I will just buy my own.",,/r/wallstreetbets/comments/sdiij9/ive_had_enough_if_the_market_wont_give_me_any_i/,OldMansMiniVan26,1,2022-01-26 16:36:46
It really be like this with you retarded apes.,,/r/wallstreetbets/comments/sdiiv0/it_really_be_like_this_with_you_retarded_apes/,savagemode777,1,2022-01-26 16:37:11
Commodity Club - 1 Year Update,,/r/wallstreetbets/comments/sdiiyr/commodity_club_1_year_update/,willowpiper3,1,2022-01-26 16:37:21
NRx Receives Initial Report of Patient Safety and Survival from Right to Try use of ZYESAMI® (aviptadil) during Omicron Surge,,/r/wallstreetbets/comments/sdij1p/nrx_receives_initial_report_of_patient_safety_and/,Sarfaraz82,1,2022-01-26 16:37:27
In jpow we trust,,/r/wallstreetbets/comments/sdij5x/in_jpow_we_trust/,Curiousthrowzone,1,2022-01-26 16:37:37
Dumb question: How does apple report Q1 2022* earnings in january?,,/r/wallstreetbets/comments/sdilbe/dumb_question_how_does_apple_report_q1_2022/,Many-Ferret7600,1,2022-01-26 16:40:16
CNN VS NPR on this weekend's snow forecast lol lesson for going off stock headlines?,,/r/wallstreetbets/comments/sdimrl/cnn_vs_npr_on_this_weekends_snow_forecast_lol/,Impossible-Tomato-15,1,2022-01-26 16:42:06
How does apple report 2022 earnings in january? Im assuming this is a “fiscal quarter” that ended very early 2022. Did anyone load up today?,,/r/wallstreetbets/comments/sdimyb/how_does_apple_report_2022_earnings_in_january_im/,Many-Ferret7600,1,2022-01-26 16:42:20
$TSLA calls regarding IV crush,,/r/wallstreetbets/comments/sdio99/tsla_calls_regarding_iv_crush/,TruthAlwaysHurtss,1,2022-01-26 16:44:00
Fuck your automoderator,,/r/wallstreetbets/comments/sdir8a/fuck_your_automoderator/,Many-Ferret7600,1,2022-01-26 16:47:43
They killin my man Powell with these awful thumbnails 😤,,/r/wallstreetbets/comments/sdiwek/they_killin_my_man_powell_with_these_awful/,minnelist,1,2022-01-26 16:54:12
Let's keep it secret,,/r/wallstreetbets/comments/sdj05p/lets_keep_it_secret/,tomusfl,1,2022-01-26 16:58:51
"r/antiwork went private, how do I make money from this?",,/r/wallstreetbets/comments/sdj1vw/rantiwork_went_private_how_do_i_make_money_from/,Dabestheris,1,2022-01-26 17:00:32
"🍃 🍃 Opinion on OGI, OrganiGram 🍃 🍃",,/r/wallstreetbets/comments/sdj3ir/opinion_on_ogi_organigram/,floman19,1,2022-01-26 17:02:32
Finally found Satoshi! 🇬🇧,,/r/wallstreetbets/comments/sdj4uz/finally_found_satoshi/,Unclebaj,1,2022-01-26 17:04:12
100 upvotes and I yolo everything on Nuralink Corp.,,/r/wallstreetbets/comments/sdj501/100_upvotes_and_i_yolo_everything_on_nuralink_corp/,Ok_Needleworker_1882,1,2022-01-26 17:04:24
"I decided to say screw it, and start a weekly financial e-letter",,/r/wallstreetbets/comments/sdj5yi/i_decided_to_say_screw_it_and_start_a_weekly/,ridethewood,1,2022-01-26 17:05:41
Neuralink Yolo?,,/r/wallstreetbets/comments/sdj8aj/neuralink_yolo/,Ok_Needleworker_1882,1,2022-01-26 17:08:42
Anyone else been in tech stocks for the last 8 years?,,/r/wallstreetbets/comments/sdja9n/anyone_else_been_in_tech_stocks_for_the_last_8/,msnf,1,2022-01-26 17:11:10
FSD will be out soon,,/r/wallstreetbets/comments/sdjc1s/fsd_will_be_out_soon/,flying_cofin,1,2022-01-26 17:13:27
"💎No Pressure, No Diamonds…No Diamonds, No Pressure💎",,/r/wallstreetbets/comments/sdje0y/no_pressure_no_diamondsno_diamonds_no_pressure/,ChinnocioChinchilla,1,2022-01-26 17:16:00
That look when your account hits 7 figures,,/r/wallstreetbets/comments/sdjeew/that_look_when_your_account_hits_7_figures/,PermissionTime5681,1,2022-01-26 17:16:29
"Daddy Elon says ""Fuck your Puts""",,/r/wallstreetbets/comments/sdjjdt/daddy_elon_says_fuck_your_puts/,TrollyJamesTurner,1,2022-01-26 17:22:44
HTBX MAY SKYROCKET THIS QUARTER!!,,/r/wallstreetbets/comments/sdjmwy/htbx_may_skyrocket_this_quarter/,SignificanceOk1211,1,2022-01-26 17:27:19
"If the gamble pays off, the sex will never stop. So it’s worth the gamble haha",,/r/wallstreetbets/comments/sdjo2m/if_the_gamble_pays_off_the_sex_will_never_stop_so/,SpaceTraderB,1,2022-01-26 17:28:50
Tesla's Record Q4 in 5 Must-See Takeaways | The Motley Fool,,/r/wallstreetbets/comments/sdjq85/teslas_record_q4_in_5_mustsee_takeaways_the/,toydan,1,2022-01-26 17:31:37
Damn and poor Russians! Have something to do every freaking time!,,/r/wallstreetbets/comments/sdjq9v/damn_and_poor_russians_have_something_to_do_every/,drazda,1,2022-01-26 17:31:41
"Anywhere I can buy VOO, but make it hard to withdraw?",,/r/wallstreetbets/comments/sdjrc4/anywhere_i_can_buy_voo_but_make_it_hard_to/,Altair1776,1,2022-01-26 17:33:03
Smoothening,,/r/wallstreetbets/comments/sdjsjr/smoothening/,Kylearean,1,2022-01-26 17:34:40
TSLA to the Moon?? - Musk's SpaceX rocket on collision course with moon,,/r/wallstreetbets/comments/sdjsu6/tsla_to_the_moon_musks_spacex_rocket_on_collision/,McNuty,1,2022-01-26 17:35:02
DRS EVERYWHERE,,/r/wallstreetbets/comments/sdjuoz/drs_everywhere/,strongApe99,1,2022-01-26 17:37:20
"We take the shares TAL! We take out shortist. Now their price is $2,75. Up to $4 we will lift easily!",,/r/wallstreetbets/comments/sdjvel/we_take_the_shares_tal_we_take_out_shortist_now/,Nazzaro_invest,1,2022-01-26 17:38:16
$SPY CHART LEAVE PREDICTION COMMENTS BASED ON CHART,,/r/wallstreetbets/comments/sdjwvv/spy_chart_leave_prediction_comments_based_on_chart/,Airlineshoddy888,1,2022-01-26 17:40:10
Sharesis sign-up bonus,,/r/wallstreetbets/comments/sdjxcj/sharesis_signup_bonus/,spokenhush,1,2022-01-26 17:40:42
If a war will happen in Eastern Europe then the market will likely crash in my opinion but some say that the market will go up what do you guys think about all this?,,/r/wallstreetbets/comments/sdjxej/if_a_war_will_happen_in_eastern_europe_then_the/,Venture_Capital,1,2022-01-26 17:40:45
Most Popular Daytrading Platforms?,,/r/wallstreetbets/comments/sdjzpj/most_popular_daytrading_platforms/,mollyallan,1,2022-01-26 17:43:45
Putin Must Attack Ukraine to Maintain Russia's Natural Gas Strangehold,,/r/wallstreetbets/comments/sdjzqm/putin_must_attack_ukraine_to_maintain_russias/,Theodamusei,1,2022-01-26 17:43:47
Which dip are you supposed to buy?,,/r/wallstreetbets/comments/sdk0mm/which_dip_are_you_supposed_to_buy/,moonbadger13,1,2022-01-26 17:45:00
Most Popular Daytrading Platforms?,,/r/wallstreetbets/comments/sdk1p4/most_popular_daytrading_platforms/,mollyallan,1,2022-01-26 17:46:25
DFV where you be?,,/r/wallstreetbets/comments/sdk3rc/dfv_where_you_be/,sjnuen,3,2022-01-26 17:49:13
Which dip are we supposed to buy?,,/r/wallstreetbets/comments/sdk5eh/which_dip_are_we_supposed_to_buy/,moonbadger13,1,2022-01-26 17:51:22
Before and after FED day,,/r/wallstreetbets/comments/sdk5ur/before_and_after_fed_day/,LeaderElectrical8294,1,2022-01-26 17:51:55
"Getting all conspiracy and I thought Greg mannarino was looking kinda Nordic. Was trying to search his height, and we'll.... I cannot believe this.",,/r/wallstreetbets/comments/sdk6wd/getting_all_conspiracy_and_i_thought_greg/,jeffreystrykowski,1,2022-01-26 17:53:18
Time to invest in commodity?,,/r/wallstreetbets/comments/sdk8d0/time_to_invest_in_commodity/,ialghamdi1,1,2022-01-26 17:55:19
Greg mannarino ILLUMINATI,,/r/wallstreetbets/comments/sdk8mi/greg_mannarino_illuminati/,jeffreystrykowski,1,2022-01-26 17:55:39
It's war will happen in Eastern Europe then the market will crash in my opinion but some say that the market will go up from any news about a war because that means that there is going to be lots of demand for oil and everything else which will subdue inflation and cause the federal reserve to,,/r/wallstreetbets/comments/sdk91q/its_war_will_happen_in_eastern_europe_then_the/,Venture_Capital,1,2022-01-26 17:56:12
It’s time to Fight. Short Squeeze like lemons time.,,/r/wallstreetbets/comments/sdk9ao/its_time_to_fight_short_squeeze_like_lemons_time/,Airlineshoddy888,1,2022-01-26 17:56:29
"Yes bagholders, fight the good fight.",,/r/wallstreetbets/comments/sdkb1s/yes_bagholders_fight_the_good_fight/,TheJandkerchief,1,2022-01-26 17:58:46
Daytrading Platforms With Lowest Commissions?,,/r/wallstreetbets/comments/sdkb8u/daytrading_platforms_with_lowest_commissions/,mollyallan,1,2022-01-26 17:59:02
JPOW and the us government just prevented WWIII,,/r/wallstreetbets/comments/sdkbsy/jpow_and_the_us_government_just_prevented_wwiii/,randomRedditAccountA,1,2022-01-26 17:59:48
Fami going up tommrow.. woot woot I say .40,,/r/wallstreetbets/comments/sdkg4j/fami_going_up_tommrow_woot_woot_i_say_40/,RedDragonDevil,1,2022-01-26 18:05:10
"Greenhorn who loves trees, needs money",,/r/wallstreetbets/comments/sdkiyo/greenhorn_who_loves_trees_needs_money/,soularjyn2010,1,2022-01-26 18:08:56
“Inflation is Transitory”,,/r/wallstreetbets/comments/sdkn56/inflation_is_transitory/,Garshreddo,1,2022-01-26 18:14:19
Who is making these trades after market close?,,/r/wallstreetbets/comments/sdknpl/who_is_making_these_trades_after_market_close/,Marketvictim,1,2022-01-26 18:15:05
Context 365 Miami Day 3: Back to Earth with Alpine 4 Holdings,,/r/wallstreetbets/comments/sdkphv/context_365_miami_day_3_back_to_earth_with_alpine/,Lookiehookieinmijama,1,2022-01-26 18:17:25
"https://opensea.io/itokano. CHECK OUR MY NEW NFT, YOU GONNA LIKE IT. THERE IS A GIVEAWAY TOO.",,/r/wallstreetbets/comments/sdkpjm/httpsopenseaioitokano_check_our_my_new_nft_you/,nwigate,1,2022-01-26 18:17:29
"$5,000 loan",,/r/wallstreetbets/comments/sdks4f/5000_loan/,Mr2day2,1,2022-01-26 18:21:02
"don't blame me, Gary Vee told me to make content so here it is",,/r/wallstreetbets/comments/sdks90/dont_blame_me_gary_vee_told_me_to_make_content_so/,SlizzleDoesNotGiveA,1,2022-01-26 18:21:11
