Wood's Arkk is moving into deep value territory (2-yr vs. Buffett's Brk-B),,/r/wallstreetbets/comments/sb2r1v/woods_arkk_is_moving_into_deep_value_territory/,egreenfruit,1,2022-01-23 14:17:16
Next week be like,,/r/wallstreetbets/comments/sb2rxe/next_week_be_like/,I_whip_idiots,1,2022-01-23 14:18:20
"The squeeze has not occured, the consistent unusual extremely high short interest oF AMC and GME compared to any other given stock is the evidence. The idea that it will never squeeze ""again"" is misleading, it is also the same type of idea being spread during the February 2021 crash.",,/r/wallstreetbets/comments/sb2t6z/the_squeeze_has_not_occured_the_consistent/,alphaomega_2021,1,2022-01-23 14:19:58
Avoiding the big declines,,/r/wallstreetbets/comments/sb30j3/avoiding_the_big_declines/,DavidThi303,1,2022-01-23 14:28:53
HIT ME UP ASAP‼️ Cue Banks Wallstreet Academy Trading Course For Sale. Serious Inquiries Only.,,/r/wallstreetbets/comments/sb36pj/hit_me_up_asap_cue_banks_wallstreet_academy/,ItzzHuncho,1,2022-01-23 14:36:10
Are YOU supporting the war effort?,,/r/wallstreetbets/comments/sb39u3/are_you_supporting_the_war_effort/,Special-Wolverine,1,2022-01-23 14:40:09
I think I found an ape in the wild.,,/r/wallstreetbets/comments/sb3bs9/i_think_i_found_an_ape_in_the_wild/,docohm,1,2022-01-23 14:42:13
Astra Space ($ASTR) to the moon,,/r/wallstreetbets/comments/sb3cc7/astra_space_astr_to_the_moon/,Straight-Astronaut-2,1,2022-01-23 14:42:55
Coin Yolo,,/r/wallstreetbets/comments/sb3d0s/coin_yolo/,Rameist2,1,2022-01-23 14:43:44
Get the puts ready!!!!!!,,/r/wallstreetbets/comments/sb3e9r/get_the_puts_ready/,SnooShortcuts8717,1,2022-01-23 14:45:20
GameStop meme stocks documentary hits theaters this week,,/r/wallstreetbets/comments/sb3gta/gamestop_meme_stocks_documentary_hits_theaters/,nicefowla,1,2022-01-23 14:48:36
GameStop stock trading documentary premiering in theaters next week,,/r/wallstreetbets/comments/sb3ie9/gamestop_stock_trading_documentary_premiering_in/,nicefowla,1,2022-01-23 14:50:31
Buying the Dip,,/r/wallstreetbets/comments/sb3kd5/buying_the_dip/,Missionximpossible,1,2022-01-23 14:52:45
Wallstreetbets Hands Up 3D printed 😎🚀🚀🚀,,/r/wallstreetbets/comments/sb3oxg/wallstreetbets_hands_up_3d_printed/,Trick-Golf-2441,1,2022-01-23 14:58:39
"FYI for gas prices, especially in California. Ugh.",,/r/wallstreetbets/comments/sb3qan/fyi_for_gas_prices_especially_in_california_ugh/,DieselLovers,1,2022-01-23 15:00:12
Capitol Trades - What's Trading On Capitol Hill? Search stock transactions by members of congress.,,/r/wallstreetbets/comments/sb3taw/capitol_trades_whats_trading_on_capitol_hill/,StonksAndBlondz,1,2022-01-23 15:03:16
The Vladdening,,/r/wallstreetbets/comments/sb3vxl/the_vladdening/,Sickmagik,1,2022-01-23 15:06:27
Faceless Selfie on OpenSea!!!,,/r/wallstreetbets/comments/sb3wf8/faceless_selfie_on_opensea/,KJ_NFT_PHOTO,1,2022-01-23 15:07:04
Buy the dip they say,,/r/wallstreetbets/comments/sb3wl4/buy_the_dip_they_say/,Missionximpossible,1,2022-01-23 15:07:16
The Vladdening,,/r/wallstreetbets/comments/sb3x58/the_vladdening/,[deleted],1,2022-01-23 15:07:57
Who’s holding in Houston?,,/r/wallstreetbets/comments/sb3x7e/whos_holding_in_houston/,TaborToss,1,2022-01-23 15:08:01
The Vladdening,,/r/wallstreetbets/comments/sb3xww/the_vladdening/,Sickmagik,1,2022-01-23 15:08:55
WELCOME TO THE JUNGLE,,/r/wallstreetbets/comments/sb3za4/welcome_to_the_jungle/,whereisizzy,1,2022-01-23 15:10:27
Started Trading last year. Am I doing it right?,,/r/wallstreetbets/comments/sb42zn/started_trading_last_year_am_i_doing_it_right/,_Defiant_Photo_,1,2022-01-23 15:14:38
Got this fortune from the local Chinese eatery 💎,,/r/wallstreetbets/comments/sb44gw/got_this_fortune_from_the_local_chinese_eatery/,mitchieums,1,2022-01-23 15:16:21
Mmf farming or vault?,,/r/wallstreetbets/comments/sb46un/mmf_farming_or_vault/,noremac2022,1,2022-01-23 15:19:17
Can I wake up as a millionaire tomorrow?,,/r/wallstreetbets/comments/sb4d3h/can_i_wake_up_as_a_millionaire_tomorrow/,osgss,1,2022-01-23 15:26:40
"Don't pay fuel bills, kidnap 700 passengers and bring them to a foreign country... Cruise ship industry collapse predicted.",,/r/wallstreetbets/comments/sb4eee/dont_pay_fuel_bills_kidnap_700_passengers_and/,yellenbubbleblower,1,2022-01-23 15:28:24
Currency market impact will be interesting. Gaddafi also tried something similar to this.,,/r/wallstreetbets/comments/sb4ej9/currency_market_impact_will_be_interesting/,j_stars,1,2022-01-23 15:28:35
Currency market impact will be interesting. Gaddafi also tried something like this.,,/r/wallstreetbets/comments/sb4g7q/currency_market_impact_will_be_interesting/,j_stars,1,2022-01-23 15:30:29
up up and away,,/r/wallstreetbets/comments/sb4h60/up_up_and_away/,mydumbpicks420,1,2022-01-23 15:31:25
Don’t worry about the impending crash FAQ for gay bears,,/r/wallstreetbets/comments/sb4i6b/dont_worry_about_the_impending_crash_faq_for_gay/,cathie_burry,1,2022-01-23 15:32:32
The Stock Market When Gme Turns Green Tomorrow,,/r/wallstreetbets/comments/sb4mtl/the_stock_market_when_gme_turns_green_tomorrow/,Unsquidabls,1,2022-01-23 15:38:14
Who's ready for mondayy🤑🤑,,/r/wallstreetbets/comments/sb4nc3/whos_ready_for_mondayy/,JohnD767,1,2022-01-23 15:38:53
Vlad and I have something in common,,/r/wallstreetbets/comments/sb4oww/vlad_and_i_have_something_in_common/,riffrefraf,1,2022-01-23 15:40:39
If VLAD somehow gets fired ( if that's even possible ) could that cause $Hood to 🚀 🚀 🚀 ??,,/r/wallstreetbets/comments/sb4vgz/if_vlad_somehow_gets_fired_if_thats_even_possible/,alphaomega_2021,1,2022-01-23 15:48:14
IMO: Dead cat bounce Monday and Tuesday. Then more pain.,,/r/wallstreetbets/comments/sb4xcq/imo_dead_cat_bounce_monday_and_tuesday_then_more/,Cutlercares,1,2022-01-23 15:50:30
Just some bears fucking each other.. they could be 🌈,,/r/wallstreetbets/comments/sb4ybx/just_some_bears_fucking_each_other_they_could_be/,consciousnes5,1,2022-01-23 15:51:31
Potential BNSF Railway Strike and Impact on Supply Change?,,/r/wallstreetbets/comments/sb500t/potential_bnsf_railway_strike_and_impact_on/,jjd1226,1,2022-01-23 15:53:35
GME posts being removed from new when it’s harmless memes make me think stuffs still wacky with GME,,/r/wallstreetbets/comments/sb50fm/gme_posts_being_removed_from_new_when_its/,Sickmagik,1,2022-01-23 15:54:06
Even deleting the app doesn't work . . .,,/r/wallstreetbets/comments/sb54fp/even_deleting_the_app_doesnt_work/,QuirkyAverageJoe,1,2022-01-23 15:58:56
"Week 3 Earnings Plays Analysis and Historical Post Earnings Moves MEGA Compilation - $MSFT, $AAPL, $TSLA, $INTC, $HOOD, $BA, $T, and More",,/r/wallstreetbets/comments/sb57c6/week_3_earnings_plays_analysis_and_historical/,UniqueCod69,1,2022-01-23 16:01:52
Even the fortunes are spot on,,/r/wallstreetbets/comments/sb57im/even_the_fortunes_are_spot_on/,Bunnyrichsl,1,2022-01-23 16:02:05
All my lunch 💰 is going to AT&amp;T.,,/r/wallstreetbets/comments/sb58d4/all_my_lunch_is_going_to_att/,_-Drifter-_,1,2022-01-23 16:03:08
This is what i think is gonna happen next,,/r/wallstreetbets/comments/sb58f4/this_is_what_i_think_is_gonna_happen_next/,Venuss2415,1,2022-01-23 16:03:11
AMBA and NVDA,,/r/wallstreetbets/comments/sb58kq/amba_and_nvda/,ZataTrading,1,2022-01-23 16:03:23
TSLA Balance Sheet (Earnings),,/r/wallstreetbets/comments/sb58y5/tsla_balance_sheet_earnings/,2blentendre,1,2022-01-23 16:03:51
RELI HAS 183% SI LIKE GME LAST JANUARY!,,/r/wallstreetbets/comments/sb59tg/reli_has_183_si_like_gme_last_january/,beautyhoneybabe,1,2022-01-23 16:04:55
Looking at my portfolio,,/r/wallstreetbets/comments/sb59u1/looking_at_my_portfolio/,Dirtychorizo,1,2022-01-23 16:04:55
2021-2022 school-year P-EBT program update,,/r/wallstreetbets/comments/sb5a22/20212022_schoolyear_pebt_program_update/,habibur_r_babu,1,2022-01-23 16:05:14
A New Rally Will Come.,,/r/wallstreetbets/comments/sb5cy7/a_new_rally_will_come/,pkinz,1,2022-01-23 16:08:38
I'm really new to trading and I would like to have a good start into it!,,/r/wallstreetbets/comments/sb5esb/im_really_new_to_trading_and_i_would_like_to_have/,42xSam,1,2022-01-23 16:10:40
Taxpayers face overloaded IRS as filing season opens Monday,,/r/wallstreetbets/comments/sb5j1g/taxpayers_face_overloaded_irs_as_filing_season/,murdocjx714,1,2022-01-23 16:15:27
"Oh, honey...",,/r/wallstreetbets/comments/sb5k27/oh_honey/,animalturds,1,2022-01-23 16:16:42
confused on good faith violations,,/r/wallstreetbets/comments/sb5lmz/confused_on_good_faith_violations/,ferna707,1,2022-01-23 16:18:40
This is more about Family than NFT's,,/r/wallstreetbets/comments/sb5m57/this_is_more_about_family_than_nfts/,JamesDolan4,1,2022-01-23 16:19:18
This is hot,,/r/wallstreetbets/comments/sb5mol/this_is_hot/,JamesDolan4,1,2022-01-23 16:19:58
"Oh, honey...",,/r/wallstreetbets/comments/sb5nba/oh_honey/,animalturds,1,2022-01-23 16:20:35
The universe has spoken🤣🤣,,/r/wallstreetbets/comments/sb5q9s/the_universe_has_spoken/,tunedevo,1,2022-01-23 16:24:05
Will $NFLX continue to dip on Monday?!,,/r/wallstreetbets/comments/sb5qng/will_nflx_continue_to_dip_on_monday/,True-Effective7443,1,2022-01-23 16:24:33
Can someone tell me which stocks are going to go up?,,/r/wallstreetbets/comments/sb5rqv/can_someone_tell_me_which_stocks_are_going_to_go/,theflyingdutchman234,1,2022-01-23 16:25:52
$NFLX new intro for stockholders,,/r/wallstreetbets/comments/sb5umb/nflx_new_intro_for_stockholders/,totoorozco,1,2022-01-23 16:29:20
Will $NFLX continue to dip on Monday?,,/r/wallstreetbets/comments/sb5wyw/will_nflx_continue_to_dip_on_monday/,True-Effective7443,1,2022-01-23 16:31:57
My black friday. Cyber Monday tomorrow? Thoughts?,,/r/wallstreetbets/comments/sb5yse/my_black_friday_cyber_monday_tomorrow_thoughts/,rs06rs,1,2022-01-23 16:34:13
"I'm an Ape and when they tell me to zoom out, i fucking zoom out the whole thing",,/r/wallstreetbets/comments/sb5zdn/im_an_ape_and_when_they_tell_me_to_zoom_out_i/,michaelmens,1,2022-01-23 16:35:02
MeetKevin selloff? Your honest opinion?,,/r/wallstreetbets/comments/sb5zgm/meetkevin_selloff_your_honest_opinion/,tobyPuppy,1,2022-01-23 16:35:10
The Big Scam,,/r/wallstreetbets/comments/sb5zl1/the_big_scam/,wotsell,1,2022-01-23 16:35:18
More bad news for Peloton: Another TV show character has a heart attack while riding its bike,,/r/wallstreetbets/comments/sb604v/more_bad_news_for_peloton_another_tv_show/,diffcalculus,1,2022-01-23 16:36:04
"$XBI biotech index fell in half, so there must be some good deals in biotech. What has great potential or is currently a good value?",,/r/wallstreetbets/comments/sb65l7/xbi_biotech_index_fell_in_half_so_there_must_be/,NoonInTown,1,2022-01-23 16:42:43
Your next EA,,/r/wallstreetbets/comments/sb66tv/your_next_ea/,Caughttoast,1,2022-01-23 16:44:21
I took “only invest what you can afford to lose” literally,,/r/wallstreetbets/comments/sb69gt/i_took_only_invest_what_you_can_afford_to_lose/,Environmental_Yard29,1,2022-01-23 16:47:44
This is may be more serious than imagined.,,/r/wallstreetbets/comments/sb69xd/this_is_may_be_more_serious_than_imagined/,Aptsag,1,2022-01-23 16:48:17
I’ve been seeing more and more people mentioning that biotech is getting whacked and cheap. Then I saw that $XBI fell in half. There’s probably some good values in biotech now. What do you like and why? What has great potential?,,/r/wallstreetbets/comments/sb6au4/ive_been_seeing_more_and_more_people_mentioning/,NoonInTown,1,2022-01-23 16:49:24
"Opinion: Big Banks are moving markets, what will small fry's like me do?",,/r/wallstreetbets/comments/sb6c53/opinion_big_banks_are_moving_markets_what_will/,EntrepreNarNar,1,2022-01-23 16:50:53
Puts / Calls as a gamble,,/r/wallstreetbets/comments/sb6kb7/puts_calls_as_a_gamble/,Hendrik_six,1,2022-01-23 17:00:59
🤡,,/r/wallstreetbets/comments/sb6lkb/_/,Lotus_Stalker,1,2022-01-23 17:02:23
"Local Tip for NASDAQ:UONE (former penny stock, currently @$4.19)",,/r/wallstreetbets/comments/sb6m6o/local_tip_for_nasdaquone_former_penny_stock/,RichmondSquirrel,1,2022-01-23 17:03:09
What if Russia invades the same day as FOMC (1.25) meeting?,,/r/wallstreetbets/comments/sb6o6f/what_if_russia_invades_the_same_day_as_fomc_125/,Delicious_Still5526,1,2022-01-23 17:05:43
"Alright Reddit, I have 10K to spend. What 3 stocks would you invest in?",,/r/wallstreetbets/comments/sb6t76/alright_reddit_i_have_10k_to_spend_what_3_stocks/,cachurch2,1,2022-01-23 17:11:54
Our token is going to be The Last Hype,,/r/wallstreetbets/comments/sb6tsu/our_token_is_going_to_be_the_last_hype/,PumpforceArmy,1,2022-01-23 17:12:41
Do you guys know this token?,,/r/wallstreetbets/comments/sb6v57/do_you_guys_know_this_token/,PumpforceArmy,1,2022-01-23 17:14:27
You degens were warned in October,,/r/wallstreetbets/comments/sb6vgd/you_degens_were_warned_in_october/,Janto_2021,1,2022-01-23 17:14:51
How it feels trying to figure out IBKR after leaving Robinhood,,/r/wallstreetbets/comments/sb6zhy/how_it_feels_trying_to_figure_out_ibkr_after/,ethanhopps,1,2022-01-23 17:20:04
Puts on NASDAQ 100 N100?,,/r/wallstreetbets/comments/sb70ip/puts_on_nasdaq_100_n100/,bcaw1,1,2022-01-23 17:21:12
"This is horrible DD, but did y’all see the post in r/antiwork about Musk?",,/r/wallstreetbets/comments/sb70xg/this_is_horrible_dd_but_did_yall_see_the_post_in/,good-wolf,1,2022-01-23 17:21:40
BATTLE OF HODLER'S DEEP,,/r/wallstreetbets/comments/sb723b/battle_of_hodlers_deep/,SmoothBrainedApe47,1,2022-01-23 17:23:13
"What Are Your Moves Tomorrow, January 24, 2022",,/r/wallstreetbets/comments/sb7258/what_are_your_moves_tomorrow_january_24_2022/,AutoModerator,1,2022-01-23 17:23:18
Robinhood a thirsty hoe and I’m out of water.,,/r/wallstreetbets/comments/sb75n5/robinhood_a_thirsty_hoe_and_im_out_of_water/,Mysterious_Turnip_67,1,2022-01-23 17:28:00
Great reset in da house,,/r/wallstreetbets/comments/sb790j/great_reset_in_da_house/,MEISTERderMACHT,1,2022-01-23 17:31:53
Breaking: Cathie about to be outperformed by 91-year-old man who doesn't like the internet,,/r/wallstreetbets/comments/sb7ari/breaking_cathie_about_to_be_outperformed_by/,MonteyMonteyMontey,1,2022-01-23 17:34:10
"This is horrible DD, but did any of y’all see the post in r/antiwork about musk?",,/r/wallstreetbets/comments/sb7b50/this_is_horrible_dd_but_did_any_of_yall_see_the/,good-wolf,1,2022-01-23 17:34:40
How can I lose more money than the market please?,,/r/wallstreetbets/comments/sb7ck5/how_can_i_lose_more_money_than_the_market_please/,Hassanpyoo,1,2022-01-23 17:36:41
Smile direct club to be bought by Amazon. Girlfriend workes there .,,/r/wallstreetbets/comments/sb7dy9/smile_direct_club_to_be_bought_by_amazon/,gwk74,1,2022-01-23 17:38:37
Why do you wsb r words care about being bull/bear?,,/r/wallstreetbets/comments/sb7hff/why_do_you_wsb_r_words_care_about_being_bullbear/,Jcxx_93,1,2022-01-23 17:42:52
Hear me out...,,/r/wallstreetbets/comments/sb7i9z/hear_me_out/,flightmanofhtemoon,1,2022-01-23 17:43:57
Did I do a good job?,,/r/wallstreetbets/comments/sb7kwr/did_i_do_a_good_job/,MoonsOutGoonzOut,1,2022-01-23 17:47:37
Giddy Up Buy the Dip (DD),,/r/wallstreetbets/comments/sb7mhd/giddy_up_buy_the_dip_dd/,dasilvan2000,1,2022-01-23 17:49:50
How my friday went,,/r/wallstreetbets/comments/sb7mp4/how_my_friday_went/,Fluid_Engineering789,1,2022-01-23 17:50:07
Alright guys looks like the crash is postponed let’s keep the retard levels high.,,/r/wallstreetbets/comments/sb7pjl/alright_guys_looks_like_the_crash_is_postponed/,_Frazzle_,1,2022-01-23 17:53:36
Chuck E. Cheese might be the next gamestop,,/r/wallstreetbets/comments/sb7r6l/chuck_e_cheese_might_be_the_next_gamestop/,northkorearocks-KJU,1,2022-01-23 17:55:54
7k cash app dm with best offer and it’s all yours,,/r/wallstreetbets/comments/sb8720/7k_cash_app_dm_with_best_offer_and_its_all_yours/,Icy_Investigator_803,1,2022-01-23 18:16:05
"Is anyone expecting a reversal and FED decision, this week? 🤷‍♀️",,/r/wallstreetbets/comments/sb87ex/is_anyone_expecting_a_reversal_and_fed_decision/,Baby_Girl_1126,1,2022-01-23 18:16:36
Advice for a newbie in the market,,/r/wallstreetbets/comments/sb87kd/advice_for_a_newbie_in_the_market/,yusuo85,1,2022-01-23 18:16:49
Wednesday $TSLA earnings: WSB Superbowl,,/r/wallstreetbets/comments/sb87q5/wednesday_tsla_earnings_wsb_superbowl/,IS_JOKE_COMRADE2,1,2022-01-23 18:17:04
"Robinhood’s Struggles Continue: Its Cofounders Are No Longer Billionaires, Shares Down 60% Since IPO",,/r/wallstreetbets/comments/sb89z4/robinhoods_struggles_continue_its_cofounders_are/,TheJunkyVirus,1,2022-01-23 18:20:08
Wife trying to convince me that MSFT earnings will prop up the market this week,,/r/wallstreetbets/comments/sb8die/wife_trying_to_convince_me_that_msft_earnings/,SwitchbladeNClark,1,2022-01-23 18:24:30
LOGI EARNINGS TOMORROW. How are we feeling about this? (Personally I’m Bearish!),,/r/wallstreetbets/comments/sb8e49/logi_earnings_tomorrow_how_are_we_feeling_about/,NameCalm,1,2022-01-23 18:25:17
Wife trying to convince her boyfriend that MSFT earnings will prop up the market this week,,/r/wallstreetbets/comments/sb8ejs/wife_trying_to_convince_her_boyfriend_that_msft/,SwitchbladeNClark,1,2022-01-23 18:25:53
"There are subreddits that hate on AMC, those bag holders make AMC more relevant. + PLTR is building an empire.",,/r/wallstreetbets/comments/sb8f47/there_are_subreddits_that_hate_on_amc_those_bag/,alphaomega_2021,1,2022-01-23 18:26:40
Retards are trying to scam,,/r/wallstreetbets/comments/sb8fgl/retards_are_trying_to_scam/,Xdimao1,1,2022-01-23 18:27:11
Where can I buy really long rope,,/r/wallstreetbets/comments/sb8fz1/where_can_i_buy_really_long_rope/,ElPotato117,1,2022-01-23 18:27:54
Where Can I buy very long rope,,/r/wallstreetbets/comments/sb8i22/where_can_i_buy_very_long_rope/,ElPotato117,1,2022-01-23 18:30:30
"He spelt ""Wendy's"" wrong",,/r/wallstreetbets/comments/sb8jmk/he_spelt_wendys_wrong/,Janto_2021,1,2022-01-23 18:32:25
If the republicans win midterms does the market rally?,,/r/wallstreetbets/comments/sb8kdk/if_the_republicans_win_midterms_does_the_market/,BigDGuitars,1,2022-01-23 18:33:25
🏳️‍🌈Bear MSFT,,/r/wallstreetbets/comments/sb8owv/bear_msft/,lilgayboi009,1,2022-01-23 18:39:56
BVN is currently going bankrupt my last post got deleted here is evidence,,/r/wallstreetbets/comments/sb8r7u/bvn_is_currently_going_bankrupt_my_last_post_got/,gameworld3d,1,2022-01-23 18:42:35
How my last bet ended up,,/r/wallstreetbets/comments/sb8rv2/how_my_last_bet_ended_up/,bbull412,1,2022-01-23 18:43:30
CRIMEA,,/r/wallstreetbets/comments/sb8u4i/crimea/,mecrolla,1,2022-01-23 18:46:42
JUMP IN EARLY BEFORE MARKETING STARTS,,/r/wallstreetbets/comments/sb8x0i/jump_in_early_before_marketing_starts/,Financial_Resort264,1,2022-01-23 18:50:35
Officially 18 just applied for options can’t wait to watch my $400 bi weekly paycheck get drained!,,/r/wallstreetbets/comments/sb8yy6/officially_18_just_applied_for_options_cant_wait/,JohnnyRosso,1,2022-01-23 18:52:57
Spotted in the wild. That makes one right?,,/r/wallstreetbets/comments/sb90nv/spotted_in_the_wild_that_makes_one_right/,BWStearns,1,2022-01-23 18:55:22
jk there’s nothing to take,,/r/wallstreetbets/comments/sb926l/jk_theres_nothing_to_take/,backleftwindowseat,1,2022-01-23 18:57:30
"PSD stands for poor, smart, and a deep desire to become rich",,/r/wallstreetbets/comments/sb930m/psd_stands_for_poor_smart_and_a_deep_desire_to/,Su-Bae-Bae,1,2022-01-23 18:58:36
OVERALL MARKET SENTIMENT,,/r/wallstreetbets/comments/sb93fm/overall_market_sentiment/,Hot-Childhood2707,1,2022-01-23 18:59:09
some memes write themselves,,/r/wallstreetbets/comments/sb947u/some_memes_write_themselves/,ItchyRice69,1,2022-01-23 19:00:07
"I wish I could short the actual soul that is Jim ""Cuck"" Cramer. He's too used to talking over people who disagree with him on TV so he has to resort to blocking ppl on Twitter.",,/r/wallstreetbets/comments/sb94ho/i_wish_i_could_short_the_actual_soul_that_is_jim/,complicatedchimp,1,2022-01-23 19:00:14
Pretty much,,/r/wallstreetbets/comments/sb94yc/pretty_much/,SomeKindOfSorbet,1,2022-01-23 19:00:43
Wages should become some sort of financial product,,/r/wallstreetbets/comments/sb96pw/wages_should_become_some_sort_of_financial_product/,isheep225,1,2022-01-23 19:02:50
Pretty much that,,/r/wallstreetbets/comments/sb9fox/pretty_much_that/,SomeKindOfSorbet,1,2022-01-23 19:14:56
Chuck Schwab over here with Kung-Fu shit,,/r/wallstreetbets/comments/sb9g4c/chuck_schwab_over_here_with_kungfu_shit/,-MrChickenNugget-,1,2022-01-23 19:15:34
Hello I need everybody to come together!,,/r/wallstreetbets/comments/sb9i3x/hello_i_need_everybody_to_come_together/,bigballer0179,1,2022-01-23 19:18:29
History of Stock Market Crashes,,/r/wallstreetbets/comments/sb9ida/history_of_stock_market_crashes/,gorays21,1,2022-01-23 19:18:51
Always an amazing feeling until I wake up and see what happened overnight,,/r/wallstreetbets/comments/sb9kwe/always_an_amazing_feeling_until_i_wake_up_and_see/,TheAmeritrader,1,2022-01-23 19:22:03
Am I doing this right?,,/r/wallstreetbets/comments/sb9nsl/am_i_doing_this_right/,sammy2607,1,2022-01-23 19:26:10
Confusing with this whether to go for put this week,,/r/wallstreetbets/comments/sb9pqy/confusing_with_this_whether_to_go_for_put_this/,inewbee,1,2022-01-23 19:29:09
For all the 🌈🐻 out there,,/r/wallstreetbets/comments/sb9rec/for_all_the_out_there/,Love_Juggz,1,2022-01-23 19:31:07
NFL Playoffs?? Pfft. This is the only matchup that matters to WSB on Sunday Night.,,/r/wallstreetbets/comments/sb9rjq/nfl_playoffs_pfft_this_is_the_only_matchup_that/,TheKingInTheNorth,1,2022-01-23 19:31:15
After watching Patrick Bryne explaining fake shares video,,/r/wallstreetbets/comments/sb9s52/after_watching_patrick_bryne_explaining_fake/,CoffeeLover789,1,2022-01-23 19:32:08
"So if I over leverage myself in RH and they go out of business, do I still owe them money?",,/r/wallstreetbets/comments/sb9sbo/so_if_i_over_leverage_myself_in_rh_and_they_go/,Crafty-Dragonfruit60,1,2022-01-23 19:32:22
NFL Playoffs?? Pfft. This is the only matchup WSB cares about on Sunday Night.,,/r/wallstreetbets/comments/sb9szj/nfl_playoffs_pfft_this_is_the_only_matchup_wsb/,wsb_alt,1,2022-01-23 19:33:18
Stock futures rise following S&amp;P 500′s worst week since March 2020,,/r/wallstreetbets/comments/sb9umg/stock_futures_rise_following_sp_500s_worst_week/,gorays21,1,2022-01-23 19:35:43
After watching Patrick Bryne explaining fake shares video,,/r/wallstreetbets/comments/sb9ymy/after_watching_patrick_bryne_explaining_fake/,CoffeeLover789,1,2022-01-23 19:41:08
I DAY TRADE ! BUT I DON'T KNOW HOW TO TRADE OPTIONS !!,,/r/wallstreetbets/comments/sb9zmd/i_day_trade_but_i_dont_know_how_to_trade_options/,Hefty-Economist-8883,1,2022-01-23 19:42:22
Fuck it I want my street cred 😤,,/r/wallstreetbets/comments/sba0e3/fuck_it_i_want_my_street_cred/,cclem0013,1,2022-01-23 19:43:32
Spotted in the wild. There’s at least one then.,,/r/wallstreetbets/comments/sba1es/spotted_in_the_wild_theres_at_least_one_then/,BWStearns,2,2022-01-23 19:45:00
"People have ridiculed GameStop shareholders throughout this whole ride that we've been on. They've lied and tried everything in their power to get us to sell from name calling like a 3rd grader to insulting our ability to understand the market. In short, I like the stock and I'm not fucking leaving.",,/r/wallstreetbets/comments/sba2uc/people_have_ridiculed_gamestop_shareholders/,PermissionAware2410,1,2022-01-23 19:46:54
These are my moves. I like my moves,,/r/wallstreetbets/comments/sba57v/these_are_my_moves_i_like_my_moves/,PM_game,1,2022-01-23 19:50:11
GME,,/r/wallstreetbets/comments/sba6dz/gme/,manakaaa,1,2022-01-23 19:51:29
AirBnb is the best short opportunity available,,/r/wallstreetbets/comments/sba810/airbnb_is_the_best_short_opportunity_available/,thanksalotFF,1,2022-01-23 19:53:57
2008 nightmare,,/r/wallstreetbets/comments/sba8zm/2008_nightmare/,midaar,1,2022-01-23 19:55:17
The market only goes up,,/r/wallstreetbets/comments/sbafo9/the_market_only_goes_up/,Rogocraft,1,2022-01-23 20:04:16
We just hold but Matt krantz job required him to write delusional silly shit all day. How retarted is his job?,,/r/wallstreetbets/comments/sbagan/we_just_hold_but_matt_krantz_job_required_him_to/,SeaKindly5892,1,2022-01-23 20:05:10
I cannot watch Jim Cramer talk without the subtitles on! he sounds like he has a bunch of wet dicks in his mouth!,,/r/wallstreetbets/comments/sbann1/i_cannot_watch_jim_cramer_talk_without_the/,Few_Hall3914,1,2022-01-23 20:15:12
I bet this retard is in this sub.,,/r/wallstreetbets/comments/sbapq9/i_bet_this_retard_is_in_this_sub/,Unfair_Holiday_3549,1,2022-01-23 20:18:17
-Hot mineur🔞 en,,/r/wallstreetbets/comments/sbasi2/hot_mineur_en/,Caked-_-,1,2022-01-23 20:21:47
I know one simple method to make money and I would give it out for free but I didn’t get it for free so I’ll be generous 10$ upfront and 10$ once I show u the method and you actually earn money. Massage me if interested,,/r/wallstreetbets/comments/sbaslt/i_know_one_simple_method_to_make_money_and_i/,Solid_Help_4029,1,2022-01-23 20:21:57
I cannot watch Jim Cramer speak without the subtitles on!!!! He sounds like he has a mouth full of wet dicks! And i think Mayhaps he snorts a bunch of cocain before hand... fastest talkin mouth full of cocks I ever heard!,,/r/wallstreetbets/comments/sbatbb/i_cannot_watch_jim_cramer_speak_without_the/,Few_Hall3914,1,2022-01-23 20:22:57
$UBER?,,/r/wallstreetbets/comments/sbaubp/uber/,faceyour100,1,2022-01-23 20:24:27
Just a moment...hi everyone please help and support my NFT project please thanks,,/r/wallstreetbets/comments/sbavnd/just_a_momenthi_everyone_please_help_and_support/,Comfortable_Baby3293,1,2022-01-23 20:26:27
Stocks/sectors to watch with current situation in Ukraine.,,/r/wallstreetbets/comments/sbavzz/stockssectors_to_watch_with_current_situation_in/,itsmytimetosmile,1,2022-01-23 20:27:01
