Toooo theeee moooooon,,/r/wallstreetbets/comments/s5ldln/toooo_theeee_moooooon/,Due-History517,1,2022-01-16 14:56:49
PICOWORKERS. EARN AS MUCH YOU WANT PAY WORKERS TO DO YOUR JOBS.,,/r/wallstreetbets/comments/s8ifoh/picoworkers_earn_as_much_you_want_pay_workers_to/,TargetAcademic2607,1,2022-01-20 07:00:20
Awww poor guy. Not a billionaire anymore.,,/r/wallstreetbets/comments/s8ii10/awww_poor_guy_not_a_billionaire_anymore/,Enigma_101,1,2022-01-20 07:03:23
Got my retard message.,,/r/wallstreetbets/comments/s8ili8/got_my_retard_message/,Motticin,1,2022-01-20 07:08:40
"WSB Pre-Market Community Talk for Thursday January 20th, 2022 (8:30am - 9:30am EST)",,/r/wallstreetbets/comments/s8j164/wsb_premarket_community_talk_for_thursday_january/,OPINION_IS_UNPOPULAR,1,2022-01-20 07:30:02
Potential NFT play?,,/r/wallstreetbets/comments/s8jdm5/potential_nft_play/,noahgsea,1,2022-01-20 07:47:26
FOMC NOT FOMO...,,/r/wallstreetbets/comments/s8jdvk/fomc_not_fomo/,Affectionate-Idea690,1,2022-01-20 07:47:49
"U.S. Stock Forecast | Post-Epidemic Era Coming? Wall Street Preference Has Switched to Banks and Energy Stocks; Hedge Fund Managers: Focus on Rate Hike Risks, Smaller Tech Stocks as Opportunities",,/r/wallstreetbets/comments/s8jdyc/us_stock_forecast_postepidemic_era_coming_wall/,abigaillv700,1,2022-01-20 07:47:56
WHEN YOUR TOP 3 POSITIONS ARE $BABA $PLTR $FTCV,,/r/wallstreetbets/comments/s8je4q/when_your_top_3_positions_are_baba_pltr_ftcv/,lvdoooo,1,2022-01-20 07:48:10
Best EV Play = F - Ford - Great entry point.,,/r/wallstreetbets/comments/s8jfvo/best_ev_play_f_ford_great_entry_point/,wagglefree,1,2022-01-20 07:50:28
I threw the last of my Wendy’s check into calls little did I know the same day the bank charter would be announced I wish I threw in more,,/r/wallstreetbets/comments/s8jg9u/i_threw_the_last_of_my_wendys_check_into_calls/,SUPERMEATYPASTA,1,2022-01-20 07:50:55
Anybody familiar with how cŕypto.com works?,,/r/wallstreetbets/comments/s8ji5g/anybody_familiar_with_how_cŕyptocom_works/,Wide-Ganache8922,1,2022-01-20 07:53:31
Buy the dip,,/r/wallstreetbets/comments/s8jtbk/buy_the_dip/,blueyeshack,1,2022-01-20 08:09:02
"SOFI 53,000,000 shorted yesterday alone after bank charter.",,/r/wallstreetbets/comments/s8juiv/sofi_53000000_shorted_yesterday_alone_after_bank/,boomthedragon,1,2022-01-20 08:10:35
https://seekingalpha.com/article/4480316-palantir-big-short-squeeze,,/r/wallstreetbets/comments/s8jx0l/httpsseekingalphacomarticle4480316palantirbigshort/,Sad_Nothing_1190,1,2022-01-20 08:13:47
Takeover case for HOOD,,/r/wallstreetbets/comments/s8jxlm/takeover_case_for_hood/,The_Sword_Itself,1,2022-01-20 08:14:37
make money online,,/r/wallstreetbets/comments/s8jz09/make_money_online/,angelica496,1,2022-01-20 08:16:38
Palantir short (squeeze),,/r/wallstreetbets/comments/s8jz24/palantir_short_squeeze/,Sad_Nothing_1190,1,2022-01-20 08:16:42
Any advice to someone new in investment?,,/r/wallstreetbets/comments/s8k1pe/any_advice_to_someone_new_in_investment/,Jetpere,1,2022-01-20 08:20:21
Am I doing this right?,,/r/wallstreetbets/comments/s8k5iu/am_i_doing_this_right/,shankers125,1,2022-01-20 08:25:22
Have your been watching the Squeeze TO THE MOON !,,/r/wallstreetbets/comments/s8k5jc/have_your_been_watching_the_squeeze_to_the_moon/,InstructionOld2725,1,2022-01-20 08:25:23
When my entire portfolio is metaverse and -30%,,/r/wallstreetbets/comments/s8k5jz/when_my_entire_portfolio_is_metaverse_and_30/,brickhouse1013,1,2022-01-20 08:25:24
AMC investors distraught due to insider selling. Price is headed below $15,,/r/wallstreetbets/comments/s8k7ny/amc_investors_distraught_due_to_insider_selling/,Doyoufeelme101,1,2022-01-20 08:28:15
Who would have thought .......,,/r/wallstreetbets/comments/s8kaqa/who_would_have_thought/,Lucis1250,1,2022-01-20 08:31:47
"BLINK. Just noticed this high short% stock... As EVs tend to be a patience play, isnt this one vowed to grow??",,/r/wallstreetbets/comments/s8kf4g/blink_just_noticed_this_high_short_stock_as_evs/,empty-space-,1,2022-01-20 08:37:44
$CENN Cenntro Auto 🚘🚘🚘🚘🚘🚘🚘,,/r/wallstreetbets/comments/s8kfkq/cenn_cenntro_auto/,Successful_Emu_5109,1,2022-01-20 08:38:21
"Technically, it's not much. But I'll let the smarter autists figure it out. Puts on Robinhood!",,/r/wallstreetbets/comments/s8khez/technically_its_not_much_but_ill_let_the_smarter/,ThrowawayLegendZ,1,2022-01-20 08:40:48
DWAC back in the 80's,,/r/wallstreetbets/comments/s8khju/dwac_back_in_the_80s/,MrBills07,1,2022-01-20 08:41:01
$SOFI will continue to moon. Super bowl coming soon.,,/r/wallstreetbets/comments/s8ki2i/sofi_will_continue_to_moon_super_bowl_coming_soon/,Wide-Bandicoot7189,1,2022-01-20 08:41:44
Just made my very first options trade!,,/r/wallstreetbets/comments/s8kl5k/just_made_my_very_first_options_trade/,SILTHONIL,1,2022-01-20 08:46:10
Super Noob question NVD and NVDA,,/r/wallstreetbets/comments/s8klep/super_noob_question_nvd_and_nvda/,Uxepro,1,2022-01-20 08:46:31
You Know We Are In a Bubble When Financial News Is Pushing Retarded Options Plays Like WSB,,/r/wallstreetbets/comments/s8kng7/you_know_we_are_in_a_bubble_when_financial_news/,TheRealJugger,1,2022-01-20 08:49:16
Here you go … $DXLG gross profit up 96.2%,,/r/wallstreetbets/comments/s8kngq/here_you_go_dxlg_gross_profit_up_962/,rrsafety,1,2022-01-20 08:49:17
PLTR,,/r/wallstreetbets/comments/s8kohw/pltr/,jm10023,1,2022-01-20 08:50:42
TLRY GME YOLO update — Jan 20 2022 — Baby's college account,,/r/wallstreetbets/comments/s8kokj/tlry_gme_yolo_update_jan_20_2022_babys_college/,Thump4,1,2022-01-20 08:50:49
Obi Wan Sensing the Markets,,/r/wallstreetbets/comments/s8kp7h/obi_wan_sensing_the_markets/,TheVelcropenguin,2,2022-01-20 08:51:45
VOTE!!!!!,,/r/wallstreetbets/comments/s8krcn/vote/,Ok_Storm6900,1,2022-01-20 08:54:31
"Tauriga Sciences, Inc. (OTCQB: TAUG)",,/r/wallstreetbets/comments/s8ku5a/tauriga_sciences_inc_otcqb_taug/,Milestone_MS,1,2022-01-20 08:58:05
Someone has PTSD,,/r/wallstreetbets/comments/s8kuhy/someone_has_ptsd/,StrongLogan,1,2022-01-20 08:58:34
Fun Police: All Growed Up,,/r/wallstreetbets/comments/s8kv3f/fun_police_all_growed_up/,FromTheDeskOfDooky,1,2022-01-20 08:59:24
Is Palantir still a stock to the moon or you guys are tired already?,,/r/wallstreetbets/comments/s8kweg/is_palantir_still_a_stock_to_the_moon_or_you_guys/,crakb,1,2022-01-20 09:00:49
Not much but honest work $SOFI,,/r/wallstreetbets/comments/s8kxr1/not_much_but_honest_work_sofi/,SchmidtHappens18,1,2022-01-20 09:02:34
Citron being passive aggressive,,/r/wallstreetbets/comments/s8kxrh/citron_being_passive_aggressive/,ddropthesoap,1,2022-01-20 09:02:35
Shitron,,/r/wallstreetbets/comments/s8ky8p/shitron/,ddropthesoap,1,2022-01-20 09:03:09
Stock options question,,/r/wallstreetbets/comments/s8l236/stock_options_question/,track729,1,2022-01-20 09:08:12
Just got my WSB Academy entrance exam results back. I'm in!,,/r/wallstreetbets/comments/s8l28k/just_got_my_wsb_academy_entrance_exam_results/,rustie_shackelford,1,2022-01-20 09:08:24
Another xela open,,/r/wallstreetbets/comments/s8l2gb/another_xela_open/,Loneotter1,1,2022-01-20 09:08:44
How I feel today,,/r/wallstreetbets/comments/s8l2zu/how_i_feel_today/,boomersoonerxxxx,1,2022-01-20 09:09:26
Why the hell not?!! lol,,/r/wallstreetbets/comments/s8l51f/why_the_hell_not_lol/,Endlessfour,1,2022-01-20 09:12:09
Are these trading courses worth it?,,/r/wallstreetbets/comments/s8l5i2/are_these_trading_courses_worth_it/,Helpful_Farm_298,1,2022-01-20 09:12:44
My best trade ever 🥳,,/r/wallstreetbets/comments/s8l731/my_best_trade_ever/,MustachedTrader,1,2022-01-20 09:14:47
BYND most shorted stock?,,/r/wallstreetbets/comments/s8l7d5/bynd_most_shorted_stock/,Competitive_Piano542,1,2022-01-20 09:15:10
"There’s 55,000+ calls expiring on First Majestic (AG) between $12 and $15 tomorrow. AG went up a lot yesterday. Rumors have BoA trying to cover their massive metal short position as they’ve been a large buyer on the COMEX. Not financial advice. I am long AG (stock and calls) and the metals.",,/r/wallstreetbets/comments/s8l9cw/theres_55000_calls_expiring_on_first_majestic_ag/,CommodityMoney,1,2022-01-20 09:17:48
ARK today,,/r/wallstreetbets/comments/s8lbwc/ark_today/,neverender716,1,2022-01-20 09:21:10
NFT Talk opinions? This will be the next to blow up with rappers/gangs https://discord.gg/AKbM9u5U,,/r/wallstreetbets/comments/s8ldcf/nft_talk_opinions_this_will_be_the_next_to_blow/,Ok-Indication-6083,1,2022-01-20 09:23:01
Anyone Else think AMC FD's Are Hella Cheap?,,/r/wallstreetbets/comments/s8lgac/anyone_else_think_amc_fds_are_hella_cheap/,The_Stein_Lives,1,2022-01-20 09:26:45
"EV Battery Tech &amp; IONiX Pro Receives Order for 10,000 Smart",,/r/wallstreetbets/comments/s8lglr/ev_battery_tech_ionix_pro_receives_order_for/,bitcoinbp,1,2022-01-20 09:27:06
Garmin Stock - GRMN Opinions and Questions,,/r/wallstreetbets/comments/s8lh9j/garmin_stock_grmn_opinions_and_questions/,Agreeable-Relief9612,1,2022-01-20 09:27:54
"You guys do realize $SOFI is not a meme stonk, right?",,/r/wallstreetbets/comments/s8lknu/you_guys_do_realize_sofi_is_not_a_meme_stonk_right/,Fi_Nom,1,2022-01-20 09:32:07
"55,000+ calls between $12 and $15 expiring on First Majestic ($AG) tomorrow.",,/r/wallstreetbets/comments/s8lmcy/55000_calls_between_12_and_15_expiring_on_first/,CommodityMoney,1,2022-01-20 09:34:18
"Screw Your Economics Class, We Have Anime",,/r/wallstreetbets/comments/s8lo1k/screw_your_economics_class_we_have_anime/,SirWhateversAlot,1,2022-01-20 09:36:28
Bet on SNDL Avoiding Delisting,,/r/wallstreetbets/comments/s8loin/bet_on_sndl_avoiding_delisting/,thegreatgumbini,1,2022-01-20 09:37:05
#LossPorn Am I doing it right?,,/r/wallstreetbets/comments/s8lp1m/lossporn_am_i_doing_it_right/,TrulsTroll,1,2022-01-20 09:37:44
Someone let me know if this is actually an insane question. Using Robinhood Margin to stake Gemini stablecoin.,,/r/wallstreetbets/comments/s8lpbk/someone_let_me_know_if_this_is_actually_an_insane/,franzkls,1,2022-01-20 09:38:05
Betting on SNDL Avoiding Delisting,,/r/wallstreetbets/comments/s8lqe3/betting_on_sndl_avoiding_delisting/,thegreatgumbini,1,2022-01-20 09:39:28
$100 or BAN he owes us…,,/r/wallstreetbets/comments/s8lrkw/100_or_ban_he_owes_us/,DirtyJimCramer,1,2022-01-20 09:40:57
"HERTZ, don't it?",,/r/wallstreetbets/comments/s8lseo/hertz_dont_it/,filterface,1,2022-01-20 09:42:03
Am I doing it right? #LossPorn,,/r/wallstreetbets/comments/s8lsfp/am_i_doing_it_right_lossporn/,TrulsTroll,1,2022-01-20 09:42:05
If only ..,,/r/wallstreetbets/comments/s8lt9p/if_only/,a_broken_lion,1,2022-01-20 09:43:14
Citron is at it again,,/r/wallstreetbets/comments/s8luaz/citron_is_at_it_again/,sammyaxelrod,1,2022-01-20 09:44:36
I got 100k to put towards something what should i buy?,,/r/wallstreetbets/comments/s8lwyk/i_got_100k_to_put_towards_something_what_should_i/,jindakillla,1,2022-01-20 09:47:59
Koenigsegg is now making Tesla aftermarket parts through collaboration with Unplugged Performance,,/r/wallstreetbets/comments/s8lzd3/koenigsegg_is_now_making_tesla_aftermarket_parts/,aniccavatasankara,1,2022-01-20 09:50:58
Serious: How is Robinhood's security?,,/r/wallstreetbets/comments/s8m02p/serious_how_is_robinhoods_security/,garrickd,1,2022-01-20 09:51:56
SOFI,,/r/wallstreetbets/comments/s8m3wt/sofi/,UndergroundTD,1,2022-01-20 09:56:45
I’m honestly fucking insane,,/r/wallstreetbets/comments/s8m5t5/im_honestly_fucking_insane/,-Ninjalu-,1,2022-01-20 09:59:11
$SOFI APES COME ON IN,,/r/wallstreetbets/comments/s8m660/sofi_apes_come_on_in/,Ibangpandas,1,2022-01-20 09:59:39
Ooh wee we wah,,/r/wallstreetbets/comments/s8m8iu/ooh_wee_we_wah/,Uncle-Samsquanch,1,2022-01-20 10:02:18
First time I bought an option for a non meme stock. Am I doing it right?,,/r/wallstreetbets/comments/s8mac6/first_time_i_bought_an_option_for_a_non_meme/,Sandro757,1,2022-01-20 10:04:34
I think we should buy NBC/Comcast stock ASAP,,/r/wallstreetbets/comments/s8mawu/i_think_we_should_buy_nbccomcast_stock_asap/,Squeaky148,1,2022-01-20 10:05:18
Does this meant moon RCL?,,/r/wallstreetbets/comments/s8mc7x/does_this_meant_moon_rcl/,Anteup21,1,2022-01-20 10:06:56
I just liked it.,,/r/wallstreetbets/comments/s8mcht/i_just_liked_it/,wicz28,2,2022-01-20 10:07:16
$SOFI #IMNOTFHCKINGSELLING,,/r/wallstreetbets/comments/s8md9h/sofi_imnotfhckingselling/,Ibangpandas,1,2022-01-20 10:08:15
Plug Power Up 10%!,,/r/wallstreetbets/comments/s8mepi/plug_power_up_10/,Biccus-Dickus12,1,2022-01-20 10:10:06
I feel like this is true for 98% of the people on this sub.,,/r/wallstreetbets/comments/s8mf0y/i_feel_like_this_is_true_for_98_of_the_people_on/,Full-Inevitable-3229,1,2022-01-20 10:10:29
Time to buttfck some 🌈🐻🐻🐻,,/r/wallstreetbets/comments/s8mg4g/time_to_buttfck_some/,Tasty-Temperature569,1,2022-01-20 10:11:49
Is this a space to ask for trading advice?,,/r/wallstreetbets/comments/s8mgvg/is_this_a_space_to_ask_for_trading_advice/,x-bean-x,1,2022-01-20 10:12:43
When my friends ask if I'm still day trading,,/r/wallstreetbets/comments/s8mju1/when_my_friends_ask_if_im_still_day_trading/,spoolingaround,1,2022-01-20 10:16:20
"Cramer likes Oil now. Well, that's a bummer.",,/r/wallstreetbets/comments/s8mk8t/cramer_likes_oil_now_well_thats_a_bummer/,Grhod,2,2022-01-20 10:16:50
Bear-y confused rn,,/r/wallstreetbets/comments/s8mnhh/beary_confused_rn/,BooOnClay,1,2022-01-20 10:20:40
$HOOD in 23 seconds,,/r/wallstreetbets/comments/s8mqbv/hood_in_23_seconds/,Outof_ITM,1,2022-01-20 10:24:03
AMBO,,/r/wallstreetbets/comments/s8mqll/ambo/,MED2021man,1,2022-01-20 10:24:23
New day same headline..... more or less,,/r/wallstreetbets/comments/s8mqxs/new_day_same_headline_more_or_less/,SwitchbladeNClark,1,2022-01-20 10:24:49
Sometimes you gotta do what you gotta do!,,/r/wallstreetbets/comments/s8mrco/sometimes_you_gotta_do_what_you_gotta_do/,-Ninjalu-,1,2022-01-20 10:25:20
$SOFI. Eat it shorts!,,/r/wallstreetbets/comments/s8mwg1/sofi_eat_it_shorts/,bullishduck,1,2022-01-20 10:31:46
$Reto,,/r/wallstreetbets/comments/s8mx9m/reto/,KindlySalamander8,1,2022-01-20 10:32:49
Pot stocks are on the rise this morning as hoped for!! Looking for a rise at OGI if you want to join the fun! 💪🥳,,/r/wallstreetbets/comments/s8mxgy/pot_stocks_are_on_the_rise_this_morning_as_hoped/,floman19,1,2022-01-20 10:33:03
I'm not very good at this,,/r/wallstreetbets/comments/s8n041/im_not_very_good_at_this/,loss_burner,1,2022-01-20 10:36:33
Brazilian stock market index (IBOV) correlates (0.66) with number of covid-19 cases there since April 2020. So this is the sign for a bull market! IBOV is 8% up the since the past 2 weeks DD,,/r/wallstreetbets/comments/s8n1oi/brazilian_stock_market_index_ibov_correlates_066/,FarioLimo,1,2022-01-20 10:38:33
New research looks into cannabis as a weapon in the fight against the pandemic,,/r/wallstreetbets/comments/s8n2zv/new_research_looks_into_cannabis_as_a_weapon_in/,D33t3w,1,2022-01-20 10:40:09
proztitues21,,/r/wallstreetbets/comments/s8n4th/proztitues21/,Zestyclose-Fill9224,1,2022-01-20 10:42:26
McDonalds pattern forming. You know what that means 💵,,/r/wallstreetbets/comments/s8n53u/mcdonalds_pattern_forming_you_know_what_that_means/,isuggestyoumove,1,2022-01-20 10:42:50
$EBET tie up with perennial loss maker Colossusbets,,/r/wallstreetbets/comments/s8n59v/ebet_tie_up_with_perennial_loss_maker_colossusbets/,TracksuitDave,1,2022-01-20 10:43:03
rufilo loan customer care number❽❼❻❽❼⓿❷❾❽❷//❽❼❻❽❼⓿❷❾❽❷ - History - Webnovel,,/r/wallstreetbets/comments/s8n5ho/rufilo_loan_customer_care/,Clean_Ad5851,1,2022-01-20 10:43:19
$EBET Esports Technologies,,/r/wallstreetbets/comments/s8n7mt/ebet_esports_technologies/,TracksuitDave,1,2022-01-20 10:46:04
So fucking excited to YOLO my life savings into call options on the vague idea of breakfast.,,/r/wallstreetbets/comments/s8n8kz/so_fucking_excited_to_yolo_my_life_savings_into/,ZucchiniOverdose,1,2022-01-20 10:47:13
$BBIG is taking off!,,/r/wallstreetbets/comments/s8naw5/bbig_is_taking_off/,norcaltrd,1,2022-01-20 10:50:04
cathie's married to uncle leo.,,/r/wallstreetbets/comments/s8nbcd/cathies_married_to_uncle_leo/,dirty__dingus__mcgee,1,2022-01-20 10:50:40
$CLOV is primed for an explosion,,/r/wallstreetbets/comments/s8nbsd/clov_is_primed_for_an_explosion/,Bipolar_investor,1,2022-01-20 10:51:11
"Finally, can offered chicken tenders for dinner tonight",,/r/wallstreetbets/comments/s8nc45/finally_can_offered_chicken_tenders_for_dinner/,keenfeed,1,2022-01-20 10:51:38
SKLZ!!?,,/r/wallstreetbets/comments/s8nd3j/sklz/,MoosinandGoosin,1,2022-01-20 10:52:47
Robinhood wants to hear from investors...,,/r/wallstreetbets/comments/s8ndln/robinhood_wants_to_hear_from_investors/,slyman0123,1,2022-01-20 10:53:24
"It ain’t much, but it’s honest work.",,/r/wallstreetbets/comments/s8ndys/it_aint_much_but_its_honest_work/,ShreddedMeatloaf,1,2022-01-20 10:53:51
Tesla inks deal to get key battery component outside China,,/r/wallstreetbets/comments/s8nejc/tesla_inks_deal_to_get_key_battery_component/,aniccavatasankara,1,2022-01-20 10:54:31
"Yea, why?",,/r/wallstreetbets/comments/s8nf9k/yea_why/,idontknowanyonehere1,1,2022-01-20 10:55:21
Tesla inks deal to get key battery component outside China,,/r/wallstreetbets/comments/s8nh2y/tesla_inks_deal_to_get_key_battery_component/,aniccavatasankara,1,2022-01-20 10:57:36
Our dream as reality,,/r/wallstreetbets/comments/s8nml8/our_dream_as_reality/,LowLeak,1,2022-01-20 11:04:10
New at this and saw an article in an insurance magazine that HGTY is merging with State Farm.,,/r/wallstreetbets/comments/s8nmxi/new_at_this_and_saw_an_article_in_an_insurance/,russianmuzzie,1,2022-01-20 11:04:35
"I'm new to investing , i currently have Robinhood but people tell me to discard that app. My question is what's the best app for trading and ?",,/r/wallstreetbets/comments/s8nooz/im_new_to_investing_i_currently_have_robinhood/,EelChato,1,2022-01-20 11:06:42
"Tesla applies for a new trademark to sell its own audio equipment, like headphones and more",,/r/wallstreetbets/comments/s8nozu/tesla_applies_for_a_new_trademark_to_sell_its_own/,Roulettebellagio,1,2022-01-20 11:07:04
#phil #philstock #Pennystocks #pennystock #StocksToBuy #ShortSqueeze If you are into stocks. I have an opportunity to make Millions of 💸 Dollars!!! BUY OTC TICKER PHIL ONLY UNDER A PENNY stock can be purchased at etrade or td Ameritrade make 1 penny stock into a Dollar 💵,,/r/wallstreetbets/comments/s8np7o/phil_philstock_pennystocks_pennystock_stockstobuy/,TipstobRich,1,2022-01-20 11:07:20
💸💸Guy I have trading strategy which makes 2% every day most of the days.💸💸,,/r/wallstreetbets/comments/s8nslk/guy_i_have_trading_strategy_which_makes_2_every/,Mr_Vicky,1,2022-01-20 11:11:25
Coming to theaters spring 2022,,/r/wallstreetbets/comments/s8nweo/coming_to_theaters_spring_2022/,LowLeak,1,2022-01-20 11:16:00
Make Them Pay,,/r/wallstreetbets/comments/s8nwrr/make_them_pay/,broman500000,1,2022-01-20 11:16:25
Today is like 7 December when Nasdaq gained 3%,,/r/wallstreetbets/comments/s8nx5p/today_is_like_7_december_when_nasdaq_gained_3/,MAARJA007,1,2022-01-20 11:16:51
$Baba come back ya baba,,/r/wallstreetbets/comments/s8nzsj/baba_come_back_ya_baba/,GangoBango888,1,2022-01-20 11:20:09
Gamma w/ Clov (2.8),,/r/wallstreetbets/comments/s8o18x/gamma_w_clov_28/,SunComfortable9177,1,2022-01-20 11:21:57
If this medium dick energy keeps throwing off my autism I might have to start dating again. This wasn’t in the plan.,,/r/wallstreetbets/comments/s8o2cc/if_this_medium_dick_energy_keeps_throwing_off_my/,Inevitable_Spray_153,1,2022-01-20 11:23:14
$WISH - Why most retail investors lose money,,/r/wallstreetbets/comments/s8o3h6/wish_why_most_retail_investors_lose_money/,bbrooz,1,2022-01-20 11:24:40
I feel there is too much activity on Uber puts from lot of traders atleast 70% puts and 30% calls,,/r/wallstreetbets/comments/s8o479/i_feel_there_is_too_much_activity_on_uber_puts/,Educational_Low_6742,1,2022-01-20 11:25:36
I think mods here need to remove market cap limits on stocks and focus more on the setup of a play instead!! We all want to make money. Why does it have to be from big market caps only? Just my 2 cents.,,/r/wallstreetbets/comments/s8o4ku/i_think_mods_here_need_to_remove_market_cap/,cryptowhale80,1,2022-01-20 11:26:07
Pushing pennies,,/r/wallstreetbets/comments/s8o5hj/pushing_pennies/,pmk1001,1,2022-01-20 11:27:16
Greatest Country in World,,/r/wallstreetbets/comments/s8o5xv/greatest_country_in_world/,GrandChefOtto,1,2022-01-20 11:27:50
LMT,,/r/wallstreetbets/comments/s8o9jv/lmt/,pdizzle8422,1,2022-01-20 11:32:13
Freeline Therapeutics Holding,,/r/wallstreetbets/comments/s8o9qp/freeline_therapeutics_holding/,Beginning-Animator77,1,2022-01-20 11:32:29
Top 5 best-selling computer brands,,/r/wallstreetbets/comments/s8oadn/top_5_bestselling_computer_brands/,EsayTech,1,2022-01-20 11:33:15
VIAC will 2X by March 2022,,/r/wallstreetbets/comments/s8oadw/viac_will_2x_by_march_2022/,greggo92,1,2022-01-20 11:33:15
Market cap requirements in this sub.,,/r/wallstreetbets/comments/s8oct0/market_cap_requirements_in_this_sub/,cryptowhale80,1,2022-01-20 11:36:16
DKNG Stock: Buy the Dip Before Its Emphatic Rebound,,/r/wallstreetbets/comments/s8oe3f/dkng_stock_buy_the_dip_before_its_emphatic_rebound/,Street_Country_1266,1,2022-01-20 11:37:53
I’m slowly loading up on $OSCR…. It’s $7 a share now…,,/r/wallstreetbets/comments/s8oeii/im_slowly_loading_up_on_oscr_its_7_a_share_now/,Puzzleheaded_Bear_58,1,2022-01-20 11:38:22
PaySafe ($PSFE) Partnership with TransCoin.me bumped the stock 11% on News but nobody reports TransCoin is an Estonian-based sham of a company,,/r/wallstreetbets/comments/s8of3p/paysafe_psfe_partnership_with_transcoinme_bumped/,RetardHereFolks,1,2022-01-20 11:39:04
"Based on the market trajectory and data I have observed through DD of other people's trades, I believe that SPY puts are the way going forward for everyone. Why hold onto your continually red stocks when you could potentially make life changing money by going against the red? Be smart, make money?",,/r/wallstreetbets/comments/s8ogac/based_on_the_market_trajectory_and_data_i_have/,RandomHumanQuesting,1,2022-01-20 11:40:27
"I’m loading up on $OSCR…it’s $7 a share now, google is invested and they have a good product especially for a pandemic (heavy on the tele health) when (if) it does turn around it’ll fly. Get in where you fit in!",,/r/wallstreetbets/comments/s8ogj3/im_loading_up_on_oscrits_7_a_share_now_google_is/,Puzzleheaded_Bear_58,1,2022-01-20 11:40:46
"Based on the market trajectory and data I have observed through DD of other people's trades, I believe that SPY puts are the way going forward for everyone. Why hold onto your continually red stocks when you could potentially make life changing money by going against the red? Be smart, make money?",,/r/wallstreetbets/comments/s8ohhd/based_on_the_market_trajectory_and_data_i_have/,RandomHumanQuesting,1,2022-01-20 11:41:51
Please don’t delete for the sake of the global market.,,/r/wallstreetbets/comments/s8oj17/please_dont_delete_for_the_sake_of_the_global/,nelwitch22,1,2022-01-20 11:43:43
Sell me this pen.,,/r/wallstreetbets/comments/s8ol2o/sell_me_this_pen/,NovaStubble,1,2022-01-20 11:46:06
TASKUS stock tanks after Motley Fool defames company with absolute lies,,/r/wallstreetbets/comments/s8ol6a/taskus_stock_tanks_after_motley_fool_defames/,HopefulLead314,1,2022-01-20 11:46:13
"Peloton to halt production of its Bikes, treadmills as demand wanes",,/r/wallstreetbets/comments/s8oo2k/peloton_to_halt_production_of_its_bikes/,DrioMarqui,1,2022-01-20 11:49:47
"Peloton to halt production of its Bikes, treadmills as demand wanes",,/r/wallstreetbets/comments/s8oo50/peloton_to_halt_production_of_its_bikes/,getBusyChild,1,2022-01-20 11:49:52
A green day is a green day,,/r/wallstreetbets/comments/s8oq9w/a_green_day_is_a_green_day/,Gijsmeneerman,1,2022-01-20 11:52:32
I never got to buy that Peloton bike,,/r/wallstreetbets/comments/s8oso8/i_never_got_to_buy_that_peloton_bike/,jfremmy,1,2022-01-20 11:55:32
Lets give $bb some love :),,/r/wallstreetbets/comments/s8ot86/lets_give_bb_some_love/,dxude69,1,2022-01-20 11:56:14
WHO ELSE FUCKING CAUGHT IT?!! PTON TO THE FUCKING GROUND 🔥🔥🔥,,/r/wallstreetbets/comments/s8otod/who_else_fucking_caught_it_pton_to_the_fucking/,StraightOil4,1,2022-01-20 11:56:49
"XBI is forming the ""Happy Alligator Climbs Out of the Swamp and Evolves into a Poorly-Drawn Bird"" pattern on the 5y scale",,/r/wallstreetbets/comments/s8oxmt/xbi_is_forming_the_happy_alligator_climbs_out_of/,TBSchemer,1,2022-01-20 12:01:26
Im about to really fuck some shit up... just fyi.,,/r/wallstreetbets/comments/s8oxnu/im_about_to_really_fuck_some_shit_up_just_fyi/,Gewoongary,1,2022-01-20 12:01:27
"What are the odds, both new accounts, too! Wsb used to be a cool place.",,/r/wallstreetbets/comments/s8ozdu/what_are_the_odds_both_new_accounts_too_wsb_used/,PhNx_RiZe,1,2022-01-20 12:03:29
"Have a margin account, but PDT rules suck. If I switch to a cash account, can I day trade, but still have access to buying options?",,/r/wallstreetbets/comments/s8p1ws/have_a_margin_account_but_pdt_rules_suck_if_i/,IcedMelt,1,2022-01-20 12:06:41
"Peloton to halt production of its Bikes, treadmills as demand wanes",,/r/wallstreetbets/comments/s8p2ru/peloton_to_halt_production_of_its_bikes/,Secure-Internet-6695,1,2022-01-20 12:07:46
Hey Wallstreetbets have a look to the $WSB token! Its the official Wallstreetbets token. The boss is also in 😍 I think this going big! 💘🔝🚀,,/r/wallstreetbets/comments/s8p3a4/hey_wallstreetbets_have_a_look_to_the_wsb_token/,Materofdisas,1,2022-01-20 12:08:23
Microsoft - Activision Blizzard Deal Thoughts,,/r/wallstreetbets/comments/s8p4pw/microsoft_activision_blizzard_deal_thoughts/,absolutbrian,1,2022-01-20 12:10:10
Unpopular Opinion: idk something about GameStop probably,,/r/wallstreetbets/comments/s8p61f/unpopular_opinion_idk_something_about_gamestop/,Hyilix,1,2022-01-20 12:11:46
