Toooo theeee moooooon,,/r/wallstreetbets/comments/s5ldln/toooo_theeee_moooooon/,Due-History517,1,2022-01-16 14:56:49
Easy Fix Y’all,,/r/wallstreetbets/comments/s7aasx/easy_fix_yall/,Obvious_Lock,1,2022-01-18 16:49:59
Sofi 🚀🚀🚀🚀🚀 another 1k in margin today before close,,/r/wallstreetbets/comments/s7aay5/sofi_another_1k_in_margin_today_before_close/,sjoe63,1,2022-01-18 16:50:10
Your employer must provide a W-2 by the end of Jan so why does Robinhood get till mid FEB on the 1099?,,/r/wallstreetbets/comments/s7abiw/your_employer_must_provide_a_w2_by_the_end_of_jan/,LineDramatic3499,1,2022-01-18 16:50:52
"Find a solution for my portfolio, shark mentality, always winning 🏆",,/r/wallstreetbets/comments/s7ah4x/find_a_solution_for_my_portfolio_shark_mentality/,Purple-Duck1185,1,2022-01-18 16:57:34
"anono-mon update: $452, 568 return on a covered call sold January 2021. Remember I started with $460. 🤑🤑",,/r/wallstreetbets/comments/s7ahx5/anonomon_update_452_568_return_on_a_covered_call/,Anono-mon,1,2022-01-18 16:58:28
100 percent accuracy on SPY.,,/r/wallstreetbets/comments/s7ahxs/100_percent_accuracy_on_spy/,Freetrilly,1,2022-01-18 16:58:30
Is it bad to be constantly check my phone for ‘gains’ - what is your screen time? Go to Settings &gt; Screen Time and let me know if I’m normal,,/r/wallstreetbets/comments/s7ahz8/is_it_bad_to_be_constantly_check_my_phone_for/,ErgonomicExpert,1,2022-01-18 16:58:33
Professional stock trader GriffenA leaked info on GME🚀🚀🚀🚀,,/r/wallstreetbets/comments/s7aiae/professional_stock_trader_griffena_leaked_info_on/,xtratrades,1,2022-01-18 16:58:55
Put entire savings in $ATVI with 2x leverage. I believed in Diablo 4 😆,,/r/wallstreetbets/comments/s7ajan/put_entire_savings_in_atvi_with_2x_leverage_i/,ListOld1638,1,2022-01-18 17:00:04
SOFI Charter! Vamos!,,/r/wallstreetbets/comments/s7ajgt/sofi_charter_vamos/,JTNYC76,1,2022-01-18 17:00:15
First real gain from Activison,,/r/wallstreetbets/comments/s7aly2/first_real_gain_from_activison/,quarter-in,1,2022-01-18 17:02:57
True apes never had any grip to lose.. Bi hi cell low!!,,/r/wallstreetbets/comments/s7amwi/true_apes_never_had_any_grip_to_lose_bi_hi_cell/,ReadySomewhere9573,1,2022-01-18 17:04:03
Yolo on $HEPS.,,/r/wallstreetbets/comments/s7andl/yolo_on_heps/,itsabigigloo,1,2022-01-18 17:04:37
$ATVI not a YOLO. Just bought a couple of months ago.,,/r/wallstreetbets/comments/s7aps6/atvi_not_a_yolo_just_bought_a_couple_of_months_ago/,Known_Contact,1,2022-01-18 17:07:25
Would now be a good time for AMC to get bought out at a $9 Billion Market Cap?,,/r/wallstreetbets/comments/s7aqqq/would_now_be_a_good_time_for_amc_to_get_bought/,Garshreddo,1,2022-01-18 17:08:34
What the hell is going on here?,,/r/wallstreetbets/comments/s7aqv3/what_the_hell_is_going_on_here/,sunshine562,1,2022-01-18 17:08:44
GriffenA leaks info on GME🚀🚀🚀,,/r/wallstreetbets/comments/s7atjf/griffena_leaks_info_on_gme/,xtratrades,1,2022-01-18 17:11:51
SOFI gets approval to become a bank!,,/r/wallstreetbets/comments/s7az6z/sofi_gets_approval_to_become_a_bank/,IndependentSwimmer67,1,2022-01-18 17:18:44
Will ARKK see a dip to 42? If so would you buy?,,/r/wallstreetbets/comments/s7az89/will_arkk_see_a_dip_to_42_if_so_would_you_buy/,DaddyDersch,1,2022-01-18 17:18:46
Test,,/r/wallstreetbets/comments/s7b0vb/test/,mlamping,1,2022-01-18 17:20:44
"OCC Conditionally Approves SoFi Bank, National Association",,/r/wallstreetbets/comments/s7b3ez/occ_conditionally_approves_sofi_bank_national/,kb144-trading,1,2022-01-18 17:23:48
How it feels waiting for the dip to stop dipping,,/r/wallstreetbets/comments/s7b47v/how_it_feels_waiting_for_the_dip_to_stop_dipping/,PapaRL,1,2022-01-18 17:24:47
S&amp;P 500 there’s a lot of white down there!,,/r/wallstreetbets/comments/s7b5nu/sp_500_theres_a_lot_of_white_down_there/,Former-Bumblebee-311,1,2022-01-18 17:26:27
"Who here can't wait for the ""degen"" era?",,/r/wallstreetbets/comments/s7b63b/who_here_cant_wait_for_the_degen_era/,MagneticWaves,1,2022-01-18 17:27:02
You guys have more in common than one might expect...,,/r/wallstreetbets/comments/s7b6r8/you_guys_have_more_in_common_than_one_might_expect/,HeLLRaYz0r,1,2022-01-18 17:27:53
May be Russian Stocks? A lot of short in Russian stock),,/r/wallstreetbets/comments/s7b7k6/may_be_russian_stocks_a_lot_of_short_in_russian/,RussiantraderZarj,1,2022-01-18 17:28:52
UPDATE: $SPY longterm uptrend channel is still intact... BUT...,,/r/wallstreetbets/comments/s7b8yw/update_spy_longterm_uptrend_channel_is_still/,cowboy1015,1,2022-01-18 17:30:36
Free NFT information given daily,,/r/wallstreetbets/comments/s7b97f/free_nft_information_given_daily/,Alternative_Ant_2801,1,2022-01-18 17:30:53
IBRX on the verge of skyrocketing,,/r/wallstreetbets/comments/s7b9gn/ibrx_on_the_verge_of_skyrocketing/,drclick23,1,2022-01-18 17:31:15
Is there anything to RAD?,,/r/wallstreetbets/comments/s7bbfp/is_there_anything_to_rad/,8-1044,1,2022-01-18 17:33:40
Thoughts on $BBIG?,,/r/wallstreetbets/comments/s7bbsi/thoughts_on_bbig/,loan0515,1,2022-01-18 17:34:07
Thoughts on $BBIG?,,/r/wallstreetbets/comments/s7bdjo/thoughts_on_bbig/,loan0515,1,2022-01-18 17:36:16
The charter is here!,,/r/wallstreetbets/comments/s7bebp/the_charter_is_here/,FocusedADHD,1,2022-01-18 17:37:12
Sofi charter is here!!!,,/r/wallstreetbets/comments/s7beot/sofi_charter_is_here/,FocusedADHD,1,2022-01-18 17:37:40
Thoughts on $BBIG? Normally the volume is around 6 millions shares being traded a day. Today there were 250 million shares being traded.,,/r/wallstreetbets/comments/s7bfoj/thoughts_on_bbig_normally_the_volume_is_around_6/,loan0515,1,2022-01-18 17:38:52
Apparently when a Put expires ITM it becomes worthless…,,/r/wallstreetbets/comments/s7bg7g/apparently_when_a_put_expires_itm_it_becomes/,Zealousideal_Age_419,1,2022-01-18 17:39:30
When the copium wears off,,/r/wallstreetbets/comments/s7bh3z/when_the_copium_wears_off/,az_is,2,2022-01-18 17:40:34
"C35 + T2 on XRP ETF Massive FTDs. (Not OP, just spreading the word.)",,/r/wallstreetbets/comments/s7bhed/c35_t2_on_xrp_etf_massive_ftds_not_op_just/,Tygiuu,1,2022-01-18 17:40:56
GME YOLO 🚀 1/18/2022,,/r/wallstreetbets/comments/s7bhfc/gme_yolo_1182022/,Lumpy-Leather2151,1,2022-01-18 17:40:59
Is Square Enix next?,,/r/wallstreetbets/comments/s7bi4l/is_square_enix_next/,mybluecathasballs,1,2022-01-18 17:41:50
did we forget this??,,/r/wallstreetbets/comments/s7bkwi/did_we_forget_this/,gnarly__roots,1,2022-01-18 17:45:17
Oil and Nokia are the future… bungholes,,/r/wallstreetbets/comments/s7bkwm/oil_and_nokia_are_the_future_bungholes/,johnnygobbs1,1,2022-01-18 17:45:17
Oil and Nokia are the future… bungholes,,/r/wallstreetbets/comments/s7bm83/oil_and_nokia_are_the_future_bungholes/,johnnygobbs1,1,2022-01-18 17:46:57
8 Calls And I Pulled Out Way Too Early . Bad Memories Lol 😩,,/r/wallstreetbets/comments/s7bnen/8_calls_and_i_pulled_out_way_too_early_bad/,ExcellentProcedure94,1,2022-01-18 17:48:28
"So hey guys BBE is climbing a lot after closing today, anyone happen to know what’s going on with the stock?",,/r/wallstreetbets/comments/s7bnjr/so_hey_guys_bbe_is_climbing_a_lot_after_closing/,Xarakax,1,2022-01-18 17:48:38
I was told!,,/r/wallstreetbets/comments/s7boae/i_was_told/,FuturisticTrout,1,2022-01-18 17:49:33
SOFI Bank Charter OCC (conditional) approval!!,,/r/wallstreetbets/comments/s7bp86/sofi_bank_charter_occ_conditional_approval/,oreverthrowaway,1,2022-01-18 17:50:47
About to risk it all on HOOD puts,,/r/wallstreetbets/comments/s7bpbn/about_to_risk_it_all_on_hood_puts/,Accomplished_Week885,1,2022-01-18 17:50:55
What do you think about game stop NFT marketplace ?,,/r/wallstreetbets/comments/s7bqcq/what_do_you_think_about_game_stop_nft_marketplace/,na7oul,1,2022-01-18 17:52:16
"Hey guys first time poster here. I was curious what if anyone knows what’s going on with the BBE stock, it’s been climbing and doing well today? Even up after the markets closed.",,/r/wallstreetbets/comments/s7bqoz/hey_guys_first_time_poster_here_i_was_curious/,Xarakax,1,2022-01-18 17:52:41
DCA BABY. LFG!!!,,/r/wallstreetbets/comments/s7bqw2/dca_baby_lfg/,th3layman,1,2022-01-18 17:52:58
Thoughts on $BBIG?,,/r/wallstreetbets/comments/s7br1w/thoughts_on_bbig/,loan0515,1,2022-01-18 17:53:11
Donate and help this tard before he kills himself,,/r/wallstreetbets/comments/s7buhy/donate_and_help_this_tard_before_he_kills_himself/,Independent-Two-5889,1,2022-01-18 17:57:34
Strictly enforced,,/r/wallstreetbets/comments/s7buv8/strictly_enforced/,Freeyzz,1,2022-01-18 17:58:03
Trap!!!! This has happen so many times before. Everyone is hyping the same $40 BBIG just so u sell Low on GME and ride the BBIG wave this week but only to see it crash,,/r/wallstreetbets/comments/s7byup/trap_this_has_happen_so_many_times_before/,SeaKindly5892,1,2022-01-18 18:02:43
GME Bag Holders Right Now,,/r/wallstreetbets/comments/s7byz1/gme_bag_holders_right_now/,DontPooOnMe,1,2022-01-18 18:02:52
Meme stocks,,/r/wallstreetbets/comments/s7bzxz/meme_stocks/,BachirDD,1,2022-01-18 18:04:06
$SOFI at 52 week low- bank charter approved AH and it’s going to go nuts,,/r/wallstreetbets/comments/s7c0ac/sofi_at_52_week_low_bank_charter_approved_ah_and/,ApprehensiveAd9884,1,2022-01-18 18:04:31
Retard Opinion: GME is headed for $500 before $0,,/r/wallstreetbets/comments/s7c0f6/retard_opinion_gme_is_headed_for_500_before_0/,donwantellu,1,2022-01-18 18:04:40
Potential gamma squeeze on SOFI?,,/r/wallstreetbets/comments/s7c1em/potential_gamma_squeeze_on_sofi/,Random_Guy_47,1,2022-01-18 18:05:52
I wish to hear arguments about the pros and cons of each most prominent stocks of compinies that are interested in augmented reality.,,/r/wallstreetbets/comments/s7c1mw/i_wish_to_hear_arguments_about_the_pros_and_cons/,Irrisorie,1,2022-01-18 18:06:09
Retard Opinion: GME is headed for $500 before $0,,/r/wallstreetbets/comments/s7c1vn/retard_opinion_gme_is_headed_for_500_before_0/,donwantellu,1,2022-01-18 18:06:26
GME - IMMINENT GAMMA SQUEEZE WITH 741% FLOAT CLAIMED BY OI 🚀🚀🚀,,/r/wallstreetbets/comments/s7c36v/gme_imminent_gamma_squeeze_with_741_float_claimed/,PercAndOptionsAddict,1,2022-01-18 18:08:05
Fortune favors the wrinkle brains,,/r/wallstreetbets/comments/s7c56t/fortune_favors_the_wrinkle_brains/,groovy5000,1,2022-01-18 18:10:40
I bet 500indian rupees into stock,,/r/wallstreetbets/comments/s7c59c/i_bet_500indian_rupees_into_stock/,Freeyzz,1,2022-01-18 18:10:44
SOFI Squeeze. This is my current position. Knew bank charter was imminent. You’re going to want to board this train.,,/r/wallstreetbets/comments/s7c5vp/sofi_squeeze_this_is_my_current_position_knew/,Slapmyask45,1,2022-01-18 18:11:32
Blend Labs (BLND) DD,,/r/wallstreetbets/comments/s7c7ih/blend_labs_blnd_dd/,BigSasquatch47,1,2022-01-18 18:13:33
My portfolio after joining WSB,,/r/wallstreetbets/comments/s7c9tl/my_portfolio_after_joining_wsb/,Rivian-Bull-2025,1,2022-01-18 18:16:23
"🕵️‍♂️ I SPY TA - Wednesday Jan. 19, 2022",,/r/wallstreetbets/comments/s7ccip/i_spy_ta_wednesday_jan_19_2022/,jjd1226,1,2022-01-18 18:19:45
Blend Labs (BLND) DD,,/r/wallstreetbets/comments/s7ccjq/blend_labs_blnd_dd/,BigSasquatch47,1,2022-01-18 18:19:47
Screeners?,,/r/wallstreetbets/comments/s7cgfx/screeners/,buickcoburn,1,2022-01-18 18:24:31
Don’t be sleeping on the video game industry 😴🎮,,/r/wallstreetbets/comments/s7cgmc/dont_be_sleeping_on_the_video_game_industry/,SgtBooo,1,2022-01-18 18:24:45
Allow me to sum up what WSB has now become.,,/r/wallstreetbets/comments/s7ch2q/allow_me_to_sum_up_what_wsb_has_now_become/,WiiidePutin,2,2022-01-18 18:25:17
Actual results may differ from expectations,,/r/wallstreetbets/comments/s7chhu/actual_results_may_differ_from_expectations/,brody182,1,2022-01-18 18:25:48
Decide my fate. Do I continue to hold my two biggest losers or cut my losses. Comment with most upvotes wins.,,/r/wallstreetbets/comments/s7chir/decide_my_fate_do_i_continue_to_hold_my_two/,Bropat05,1,2022-01-18 18:25:50
SOFI bank charter approved. We have liftoff,,/r/wallstreetbets/comments/s7cht2/sofi_bank_charter_approved_we_have_liftoff/,Stock_Whisperer06,1,2022-01-18 18:26:12
Thats why I love WSB 😂,,/r/wallstreetbets/comments/s7ckp2/thats_why_i_love_wsb/,pretzelbet99,1,2022-01-18 18:29:54
"Unpopular AND Popular opinion: GME Headed between $0 and $1,0000,000 sometime anytime",,/r/wallstreetbets/comments/s7d37d/unpopular_and_popular_opinion_gme_headed_between/,ImFedUpWithItAll,1,2022-01-18 18:53:42
$2.7 Billion in Credit Default Swaps Blew Up One Day Before the Fed Launched Its Repo Loan Bailouts in 2019,,/r/wallstreetbets/comments/s7d49y/27_billion_in_credit_default_swaps_blew_up_one/,Dangerous-Falcon5267,1,2022-01-18 18:55:09
Rate My Portfolio (New Investor),,/r/wallstreetbets/comments/s7d5n4/rate_my_portfolio_new_investor/,Gavin_Law,1,2022-01-18 18:57:00
China Number one 🇨🇳,,/r/wallstreetbets/comments/s7d602/china_number_one/,Kaimu_Azu,1,2022-01-18 18:57:27
$AMC 211K Open Call Contract 125 strike,,/r/wallstreetbets/comments/s7d6ot/amc_211k_open_call_contract_125_strike/,Boforizzle,1,2022-01-18 18:58:22
What's the best etf to track the vix?,,/r/wallstreetbets/comments/s7d7uv/whats_the_best_etf_to_track_the_vix/,mhmm314,1,2022-01-18 19:00:04
RMSL. Thank me later.,,/r/wallstreetbets/comments/s7d87i/rmsl_thank_me_later/,An_Asshole_Gentleman,1,2022-01-18 19:00:21
Will it ever end?,,/r/wallstreetbets/comments/s7da6h/will_it_ever_end/,bucsjosh,1,2022-01-18 19:02:54
"WSB Sentiment Analysis for Monday, January 17th",,/r/wallstreetbets/comments/s7da8m/wsb_sentiment_analysis_for_monday_january_17th/,MGeeeeeezy,1,2022-01-18 19:02:57
$SOFI is heading to the moon after the bank charter got approved in the after hours today.,,/r/wallstreetbets/comments/s7daz3/sofi_is_heading_to_the_moon_after_the_bank/,Wide-Bandicoot7189,1,2022-01-18 19:03:56
"Lucid bitches hold strong don't be scared.. it will be 53 next week this day... Have a dubby, er antacid and deal with it roller coaster if you can take big gain dooo it. I just don't get short gain cunt moves to jump back in .. it ain't going under 38...?",,/r/wallstreetbets/comments/s7dbjd/lucid_bitches_hold_strong_dont_be_scared_it_will/,natas2466,1,2022-01-18 19:04:40
Bought these today on a whim…,,/r/wallstreetbets/comments/s7dbr8/bought_these_today_on_a_whim/,Slave_to_the_bets,1,2022-01-18 19:04:58
"Just incase anyone is curios about what stocks politicians like. I know there are several of these types of sites around, but this one seems easy on the eyes.",,/r/wallstreetbets/comments/s7dhir/just_incase_anyone_is_curios_about_what_stocks/,thebigjohnshow,1,2022-01-18 19:12:43
Autonomous vehicle stocks like Microvision MVIS and Foresight FRSX are about to pop.....,,/r/wallstreetbets/comments/s7di4o/autonomous_vehicle_stocks_like_microvision_mvis/,Barnz905,1,2022-01-18 19:13:30
$QQQ Making Money w/ Range Chart &amp; Trend Channel 💰💰💰 Not for apes.,,/r/wallstreetbets/comments/s7dik9/qqq_making_money_w_range_chart_trend_channel_not/,SPYOptions,1,2022-01-18 19:14:04
Why do you think eToro did this on 28.01.2021?,,/r/wallstreetbets/comments/s7dily/why_do_you_think_etoro_did_this_on_28012021/,Biskupath,1,2022-01-18 19:14:08
I hodl both,,/r/wallstreetbets/comments/s7djdl/i_hodl_both/,Tealrider,1,2022-01-18 19:15:07
Sofi,,/r/wallstreetbets/comments/s7dk3d/sofi/,Sensitive_Bus4,1,2022-01-18 19:16:03
The next Big MoonShot!,,/r/wallstreetbets/comments/s7dkbw/the_next_big_moonshot/,weidemanwoodworking,1,2022-01-18 19:16:21
How I know I belong here….,,/r/wallstreetbets/comments/s7dn0d/how_i_know_i_belong_here/,TheTimbalaya,1,2022-01-18 19:19:47
"Alright, which one of you retards did this? You could've gotten at least $420.69",,/r/wallstreetbets/comments/s7dnb8/alright_which_one_of_you_retards_did_this_you/,DemonOfLight13,1,2022-01-18 19:20:10
Will we still be able to dig in to this even after she steps down?,,/r/wallstreetbets/comments/s7dnl3/will_we_still_be_able_to_dig_in_to_this_even/,Lerdburgers,1,2022-01-18 19:20:30
Xi Jinping urges West not to 'slam the brakes' by hiking interest rates too quickly - KTVZ,,/r/wallstreetbets/comments/s7dp3z/xi_jinping_urges_west_not_to_slam_the_brakes_by/,Janto_2021,1,2022-01-18 19:22:26
Squidward helps Patrick with his bags.,,/r/wallstreetbets/comments/s7dp97/squidward_helps_patrick_with_his_bags/,BallinCupEnthusiast,1,2022-01-18 19:22:38
Microsoft’s $ATVI acquisition is a bullish signal for tech stocks.,,/r/wallstreetbets/comments/s7dtul/microsofts_atvi_acquisition_is_a_bullish_signal/,bwang29,1,2022-01-18 19:28:52
I want to get off Cathie Wood's wild ride,,/r/wallstreetbets/comments/s7dv60/i_want_to_get_off_cathie_woods_wild_ride/,focault123,1,2022-01-18 19:30:29
Hello SEC? These guys right here.,,/r/wallstreetbets/comments/s7dxo2/hello_sec_these_guys_right_here/,4606120,1,2022-01-18 19:33:54
The other portfolio is holding up,,/r/wallstreetbets/comments/s7e04q/the_other_portfolio_is_holding_up/,bucsjosh,1,2022-01-18 19:37:15
This was posted in the beginning of 2021 as a youtube ad. Anyone know this degen and were the entire video can be found?,,/r/wallstreetbets/comments/s7e1q1/this_was_posted_in_the_beginning_of_2021_as_a/,JuicyLoogie,1,2022-01-18 19:39:21
And just like that you Activision bagholders had a blast today,,/r/wallstreetbets/comments/s7e361/and_just_like_that_you_activision_bagholders_had/,NNT888,1,2022-01-18 19:41:16
diAmOnD hAnDs,,/r/wallstreetbets/comments/s7e3at/diamond_hands/,CheahNz,1,2022-01-18 19:41:27
The reality of the GME saga: demi-popular opinion.,,/r/wallstreetbets/comments/s7e3nc/the_reality_of_the_gme_saga_demipopular_opinion/,KdizzyRbets,1,2022-01-18 19:41:57
PSA - highly shorted stocks lose a f$$kload of money (with pictures!),,/r/wallstreetbets/comments/s7e3ta/psa_highly_shorted_stocks_lose_a_fkload_of_money/,Araphoren,1,2022-01-18 19:42:11
SoFi Gang - SoFi stock soars after clearing final regulatory hurdle to become a bank,,/r/wallstreetbets/comments/s7e5hk/sofi_gang_sofi_stock_soars_after_clearing_final/,rebelo55,1,2022-01-18 19:44:28
I really am one of you now 🦍,,/r/wallstreetbets/comments/s7e6rn/i_really_am_one_of_you_now/,CombinedTurtle,1,2022-01-18 19:46:08
SPY bulls be like…,,/r/wallstreetbets/comments/s7ea9n/spy_bulls_be_like/,ItsBstone,1,2022-01-18 19:50:47
A Case For BB At $33 (DD),,/r/wallstreetbets/comments/s7ectf/a_case_for_bb_at_33_dd/,Nblearchangel,1,2022-01-18 19:54:11
All Hail Queen of the Retards,,/r/wallstreetbets/comments/s7eea8/all_hail_queen_of_the_retards/,circdenomore,1,2022-01-18 19:56:11
Is this the future ?,,/r/wallstreetbets/comments/s7efch/is_this_the_future/,SignificanceNo8512,1,2022-01-18 19:57:39
"If the upside of any individual stock pick is infinite, and the downside is finite, isn’t the expected return infinite %?",,/r/wallstreetbets/comments/s7eg75/if_the_upside_of_any_individual_stock_pick_is/,JeffSokolPizza,1,2022-01-18 19:58:45
SAVA,,/r/wallstreetbets/comments/s7eisk/sava/,stockskc,1,2022-01-18 20:02:07
Trend lines for GME: Excel data vs “GME hits $50 before $250” guy,,/r/wallstreetbets/comments/s7ejor/trend_lines_for_gme_excel_data_vs_gme_hits_50/,Ninja47,1,2022-01-18 20:03:17
I woke up today to $ATVI and $MSFT news. $77.5c exp 1/21/22. SUPER LUCKY! I made bank on the puts during the harassment scandal too!,,/r/wallstreetbets/comments/s7ejx8/i_woke_up_today_to_atvi_and_msft_news_775c_exp/,SillyGuy,1,2022-01-18 20:03:35
First time buying a stock. Beginners luck. If I sell before the market opens tomorrow is it a “day trade”? I don’t want to pay extra taxes. $Sofi,,/r/wallstreetbets/comments/s7ek2z/first_time_buying_a_stock_beginners_luck_if_i/,DoubtingTomsAss,1,2022-01-18 20:03:48
Printing Bagholders,,/r/wallstreetbets/comments/s7emac/printing_bagholders/,NikeExchange,1,2022-01-18 20:06:48
This is definitely where I belong.,,/r/wallstreetbets/comments/s7emd4/this_is_definitely_where_i_belong/,MustyMoist,1,2022-01-18 20:06:53
F...,,/r/wallstreetbets/comments/s7enew/f/,agoodnightasleeper,1,2022-01-18 20:08:20
SoFi Receives Regulatory Approval to Become a National Bank. Sofi hiring?,,/r/wallstreetbets/comments/s7er3o/sofi_receives_regulatory_approval_to_become_a/,Spirited_Hawk_6461,1,2022-01-18 20:13:23
I ain’t hear no bell #sofi 🚀🚀🚀🚀🚀🚀🚀🚀🚀🚀🚀🚀🚀🚀🚀🚀🚀,,/r/wallstreetbets/comments/s7exoo/i_aint_hear_no_bell_sofi/,SUPERMEATYPASTA,1,2022-01-18 20:22:18
Maybe a stupid question but what’s a Bloomberg Urinal?,,/r/wallstreetbets/comments/s7extl/maybe_a_stupid_question_but_whats_a_bloomberg/,Your_Nerdy_Bull,1,2022-01-18 20:22:29
Maybe stupid question but what’s a Bloomberg Urinal?,,/r/wallstreetbets/comments/s7ezp9/maybe_stupid_question_but_whats_a_bloomberg_urinal/,Your_Nerdy_Bull,1,2022-01-18 20:25:05
Join the Trillionaire Thugs Discord Server! Dont miss this one fastest growing community of 2022🔥🚀,,/r/wallstreetbets/comments/s7f5if/join_the_trillionaire_thugs_discord_server_dont/,Ancient-Physics906,1,2022-01-18 20:32:44
Bull Case - BAC,,/r/wallstreetbets/comments/s7f6dr/bull_case_bac/,carsonthecarsonthe,1,2022-01-18 20:33:54
ER should be coming out towards the end of February!,,/r/wallstreetbets/comments/s7f742/er_should_be_coming_out_towards_the_end_of/,DormiSaul,1,2022-01-18 20:34:55
Who wants to ride 🚀🚀 to SPCE?,,/r/wallstreetbets/comments/s7f7ny/who_wants_to_ride_to_spce/,Crazylegs_8909,1,2022-01-18 20:35:39
Nobody cares...,,/r/wallstreetbets/comments/s7fb91/nobody_cares/,agoodnightasleeper,1,2022-01-18 20:40:45
$BB …It’s coming.,,/r/wallstreetbets/comments/s7fbng/bb_its_coming/,VizzleG,1,2022-01-18 20:41:21
The wallstreetbets way,,/r/wallstreetbets/comments/s7fbq2/the_wallstreetbets_way/,thebigbagwolf,1,2022-01-18 20:41:27
The NFT Cycle,,/r/wallstreetbets/comments/s7fc54/the_nft_cycle/,ReallySillyLily36,1,2022-01-18 20:42:02
Sofi charter! Boom,,/r/wallstreetbets/comments/s7fcdk/sofi_charter_boom/,birdie123456789,1,2022-01-18 20:42:20
IRL Money Glitch,,/r/wallstreetbets/comments/s7fdd0/irl_money_glitch/,SensitiveWiteBoy,1,2022-01-18 20:43:48
"Let the robots make us rich! Self-driving truck stocks (AUR, TSP, EMBK)",,/r/wallstreetbets/comments/s7fdtm/let_the_robots_make_us_rich_selfdriving_truck/,Street_Ad_7140,1,2022-01-18 20:44:25
Market crash? Nonsense,,/r/wallstreetbets/comments/s7fega/market_crash_nonsense/,Swedish-chimp,1,2022-01-18 20:45:17
Don't listen to the two guys before. I make it a DBZ episode and now is fun.,,/r/wallstreetbets/comments/s7fh70/dont_listen_to_the_two_guys_before_i_make_it_a/,PleuraZoom,1,2022-01-18 20:49:06
The amount is shill attack is tremendous.,,/r/wallstreetbets/comments/s7fl5r/the_amount_is_shill_attack_is_tremendous/,SeaKindly5892,1,2022-01-18 20:54:34
Ok retards we going to the moon fuck earth,,/r/wallstreetbets/comments/s7fobt/ok_retards_we_going_to_the_moon_fuck_earth/,ProudHeron5768,1,2022-01-18 20:59:02
"Justin Trudeau puts 38,000 Truckers on unpaid leave. 76,000 shipments of freight are now suspended.",,/r/wallstreetbets/comments/s7frtm/justin_trudeau_puts_38000_truckers_on_unpaid/,Useful-Importance-20,1,2022-01-18 21:03:31
Pelosi Portfilio loss porn update 💎 👐,,/r/wallstreetbets/comments/s7ftvg/pelosi_portfilio_loss_porn_update/,sylphvanas,1,2022-01-18 21:06:12
Sofi,,/r/wallstreetbets/comments/s7fv6y/sofi/,Sensitive_Bus4,1,2022-01-18 21:08:02
Draftkings,,/r/wallstreetbets/comments/s7fvin/draftkings/,BigBabyHeyZeus,1,2022-01-18 21:08:29
Microsoft buying Activison,,/r/wallstreetbets/comments/s7fwaw/microsoft_buying_activison/,cincyroofer,1,2022-01-18 21:09:43
hi,,/r/wallstreetbets/comments/s7g7mh/hi/,Empty_Ad9012,1,2022-01-18 21:25:42
The classic game World of Witchcraft lol,,/r/wallstreetbets/comments/s7g8t7/the_classic_game_world_of_witchcraft_lol/,King-of-Limbs-07,1,2022-01-18 21:27:25
Am I doing this right?,,/r/wallstreetbets/comments/s7g9im/am_i_doing_this_right/,TheMovieSnowman,1,2022-01-18 21:28:29
Stock Market Right Now,,/r/wallstreetbets/comments/s7gatq/stock_market_right_now/,siav8,1,2022-01-18 21:30:17
The country is fucked but I’m getting that bag…,,/r/wallstreetbets/comments/s7gbhj/the_country_is_fucked_but_im_getting_that_bag/,SoggyLog2321,1,2022-01-18 21:31:09
This guy,,/r/wallstreetbets/comments/s7gbz9/this_guy/,praetorain112,1,2022-01-18 21:31:53
The Biggest day in CRSR's history,,/r/wallstreetbets/comments/s7gdyx/the_biggest_day_in_crsrs_history/,_Orlandoo,1,2022-01-18 21:34:27
Thanks team very convincing,,/r/wallstreetbets/comments/s7geie/thanks_team_very_convincing/,Rogocraft,1,2022-01-18 21:35:10
The classic game World of Witchcraft !,,/r/wallstreetbets/comments/s7gfgf/the_classic_game_world_of_witchcraft/,King-of-Limbs-07,1,2022-01-18 21:36:26
Amc to the moon 1000 still holding,,/r/wallstreetbets/comments/s7gilt/amc_to_the_moon_1000_still_holding/,After-Barnacle-3214,1,2022-01-18 21:40:53
Unpopular opinion,,/r/wallstreetbets/comments/s7gltz/unpopular_opinion/,johnboi244,1,2022-01-18 21:45:11
AMC 🚀🌙,,/r/wallstreetbets/comments/s7gmtj/amc/,alexmtz92,1,2022-01-18 21:46:27
What’s next for the markets? The truth is that nobody knows.,,/r/wallstreetbets/comments/s7gmuw/whats_next_for_the_markets_the_truth_is_that/,Spirited_Hawk_6461,1,2022-01-18 21:46:30
GAMESTOP: RISE OF THE PLAYERS,,/r/wallstreetbets/comments/s7gooo/gamestop_rise_of_the_players/,eastono,3,2022-01-18 21:48:58
Like I always know this is just a data glitch- but that doesn’t mean it doesn’t take a couple years off of my life.,,/r/wallstreetbets/comments/s7gvgm/like_i_always_know_this_is_just_a_data_glitch_but/,12345toomanynames,1,2022-01-18 21:58:06
GAMESTOP: RISE OF THE PLAYERS,,/r/wallstreetbets/comments/s7gvox/gamestop_rise_of_the_players/,eastono,1,2022-01-18 21:58:26
"Couldn’t help myself, went ahead and listed this bad boy for a measly 69,420 starting price. Who knows, maybe someone will love the price and just buy it.",,/r/wallstreetbets/comments/s7gvxd/couldnt_help_myself_went_ahead_and_listed_this/,Alex_Henry2011,1,2022-01-18 21:58:47
