Toooo theeee moooooon,,/r/wallstreetbets/comments/s5ldln/toooo_theeee_moooooon/,Due-History517,1,2022-01-16 14:56:49
My last 2 months 9 days 4hrs and 20 minutes,,/r/wallstreetbets/comments/s9hzcn/my_last_2_months_9_days_4hrs_and_20_minutes/,haventreadityett,1,2022-01-21 12:55:33
Holding till it turns to Diamonds or Dust,,/r/wallstreetbets/comments/s9hzef/holding_till_it_turns_to_diamonds_or_dust/,Rob_to_Riches,1,2022-01-21 12:55:37
"PTON is up 15% and their bulls are sure it’s going back to 100. Anyways, anybody buying puts?",,/r/wallstreetbets/comments/s9hzxs/pton_is_up_15_and_their_bulls_are_sure_its_going/,dabskinumba9,1,2022-01-21 12:56:20
Hedging RSUs with a put option,,/r/wallstreetbets/comments/s9i16d/hedging_rsus_with_a_put_option/,Electronic-Door-39,1,2022-01-21 12:57:53
Total Newbie,,/r/wallstreetbets/comments/s9i20o/total_newbie/,Imreallyadonut,1,2022-01-21 12:59:00
YOLO on TLT put?,,/r/wallstreetbets/comments/s9i2z8/yolo_on_tlt_put/,PumpMasterFlex69,1,2022-01-21 13:00:11
Thinking about pawning my car.,,/r/wallstreetbets/comments/s9i37c/thinking_about_pawning_my_car/,MartisTh3EviL,1,2022-01-21 13:00:19
"""Meme stocks"" basket looks to be decoupling from indices...",,/r/wallstreetbets/comments/s9i4v5/meme_stocks_basket_looks_to_be_decoupling_from/,ImmediateShape4204,1,2022-01-21 13:02:07
Can I do it again?,,/r/wallstreetbets/comments/s9i59s/can_i_do_it_again/,drhalxx,1,2022-01-21 13:02:34
GameStop Apes Are All Talk,,/r/wallstreetbets/comments/s9i5an/gamestop_apes_are_all_talk/,CLVR12CJan2022,1,2022-01-21 13:02:37
Portfolio value going down? Dedicated to all my fellow retarded 💎🙌🏼. Don't be a 🌈🐻.,,/r/wallstreetbets/comments/s9i5rb/portfolio_value_going_down_dedicated_to_all_my/,flying_cofin,1,2022-01-21 13:03:09
&amp; Now A Live Look At The Tendie Man Negotiating With The Market:,,/r/wallstreetbets/comments/s9i62o/now_a_live_look_at_the_tendie_man_negotiating/,zenszola,1,2022-01-21 13:03:32
Endgame,,/r/wallstreetbets/comments/s9i6cs/endgame/,easymoneeybabe,1,2022-01-21 13:03:54
Recruiting: retards with good DD skills to go after vulture hedge funds,,/r/wallstreetbets/comments/s9i9bw/recruiting_retards_with_good_dd_skills_to_go/,MaybeRocketScience,1,2022-01-21 13:07:47
An interesting tit,,/r/wallstreetbets/comments/s9ic0q/an_interesting_tit/,Hesitantterain,1,2022-01-21 13:11:01
What are you guys buying to hedge against the upcoming downturn??,,/r/wallstreetbets/comments/s9ie4x/what_are_you_guys_buying_to_hedge_against_the/,randyrando101,1,2022-01-21 13:13:23
Let’s move,,/r/wallstreetbets/comments/s9ifcv/lets_move/,leftheadcash,1,2022-01-21 13:14:53
Wtf is this sub,,/r/wallstreetbets/comments/s9ig9l/wtf_is_this_sub/,ad_396,1,2022-01-21 13:16:01
I'm just going to leave this here. Whole market crashing and what stonk is going up? GME 🚀,,/r/wallstreetbets/comments/s9ihrn/im_just_going_to_leave_this_here_whole_market/,j__walla,1,2022-01-21 13:17:58
Averaging up hopefully just in time! Let's go!!!,,/r/wallstreetbets/comments/s9ii9o/averaging_up_hopefully_just_in_time_lets_go/,bestbagholder,1,2022-01-21 13:18:39
NETFLIX YOLO,,/r/wallstreetbets/comments/s9iifz/netflix_yolo/,Ronswansons_Bacon,1,2022-01-21 13:18:53
IBRK liquidated my GME call,,/r/wallstreetbets/comments/s9iihb/ibrk_liquidated_my_gme_call/,andtim123,1,2022-01-21 13:18:56
Me at the office today,,/r/wallstreetbets/comments/s9iiuq/me_at_the_office_today/,Replicant6666,1,2022-01-21 13:19:24
AMC,,/r/wallstreetbets/comments/s9iivs/amc/,TheJuicer_420,1,2022-01-21 13:19:27
"Ill be able to tell the grandkids of my wifes boyfriend that i was there when Netflix lost a quarter of its worth, toast to the streaming wars🥂",,/r/wallstreetbets/comments/s9ij70/ill_be_able_to_tell_the_grandkids_of_my_wifes/,Glwhite1991,1,2022-01-21 13:19:51
How do I short myself?,,/r/wallstreetbets/comments/s9ijtq/how_do_i_short_myself/,Lusinious,1,2022-01-21 13:20:33
How retarded am I ?,,/r/wallstreetbets/comments/s9ikj8/how_retarded_am_i/,Informal_Change7004,1,2022-01-21 13:21:18
Road to Positive (hopefully),,/r/wallstreetbets/comments/s9il8m/road_to_positive_hopefully/,Whatchawnt,1,2022-01-21 13:22:02
Most accurate stock market video,,/r/wallstreetbets/comments/s9ipc5/most_accurate_stock_market_video/,Rel1gionLOL,1,2022-01-21 13:27:13
Might have to pay my coworker a lil visit,,/r/wallstreetbets/comments/s9ipmn/might_have_to_pay_my_coworker_a_lil_visit/,SoopaHot,1,2022-01-21 13:27:35
"#SEC PLEASE explain to us investors how our stock is going down when the buy ratio is a HELL OF A LOT MORE than the sell ratio. We talk about other countries being Corrupt, maybe this country should take a long hard look in the mirror before passing judgment",,/r/wallstreetbets/comments/s9iq43/sec_please_explain_to_us_investors_how_our_stock/,Jseinfeld9,1,2022-01-21 13:28:12
Why I’ve shorted the market,,/r/wallstreetbets/comments/s9iqeh/why_ive_shorted_the_market/,L0LINAD,1,2022-01-21 13:28:35
IBRK liquidated my GME call,,/r/wallstreetbets/comments/s9ir2c/ibrk_liquidated_my_gme_call/,andtim123,1,2022-01-21 13:29:27
A question,,/r/wallstreetbets/comments/s9is8j/a_question/,Blanksuu,1,2022-01-21 13:30:52
Trump stock will hit the 🌙 moon,,/r/wallstreetbets/comments/s9ismm/trump_stock_will_hit_the_moon/,Big-Gas-788,1,2022-01-21 13:31:18
"Fuck the Motley Fool, total pyramid scheme. I’M gonna go lose $30,000 on MARA like a real investor 😤",,/r/wallstreetbets/comments/s9iueo/fuck_the_motley_fool_total_pyramid_scheme_im/,EuphoricSuccess1997,1,2022-01-21 13:33:20
No idea what’s going on here but it sure feels funny,,/r/wallstreetbets/comments/s9iukr/no_idea_whats_going_on_here_but_it_sure_feels/,PooPooDooDoo,1,2022-01-21 13:33:33
Tech stocks never recovering,,/r/wallstreetbets/comments/s9iuwx/tech_stocks_never_recovering/,redditsucks9812,1,2022-01-21 13:34:00
Retard strength,,/r/wallstreetbets/comments/s9ix7y/retard_strength/,Zllimpat,1,2022-01-21 13:37:00
Unpopulair opinion: The ‘Crash’ is happening|has already happend RN,,/r/wallstreetbets/comments/s9ixoe/unpopulair_opinion_the_crash_is_happeninghas/,0ldpk3r,1,2022-01-21 13:37:34
🤔,,/r/wallstreetbets/comments/s9iyz5/_/,EpicAssassin09,1,2022-01-21 13:39:14
$SHOP in hell rn is anyone planning on buying?,,/r/wallstreetbets/comments/s9j06q/shop_in_hell_rn_is_anyone_planning_on_buying/,Few-Requirement-5012,1,2022-01-21 13:40:42
Like GME?,,/r/wallstreetbets/comments/s9j2rw/like_gme/,rocketman65478,1,2022-01-21 13:43:47
$50K Into Disney Leaps,,/r/wallstreetbets/comments/s9j4o2/50k_into_disney_leaps/,3whitelights,1,2022-01-21 13:46:18
FAANG without Netflix is FAAG.,,/r/wallstreetbets/comments/s9j4y8/faang_without_netflix_is_faag/,trycatchblock22,1,2022-01-21 13:46:42
Life in 2022,,/r/wallstreetbets/comments/s9j5tl/life_in_2022/,2Denk4irl_,1,2022-01-21 13:47:53
#1 Short Squeeze! !! NKLA !!,,/r/wallstreetbets/comments/s9j7gb/1_short_squeeze_nkla/,D0z3r999,1,2022-01-21 13:50:00
Why Not?,,/r/wallstreetbets/comments/s9jaic/why_not/,Subject-Confusion-66,1,2022-01-21 13:53:32
Brothers STAND UP JOIN US BEFORE THE MARKET CLOSES,,/r/wallstreetbets/comments/s9jbx4/brothers_stand_up_join_us_before_the_market_closes/,Zuentax,1,2022-01-21 13:55:19
$AMD sure as hell on that list?,,/r/wallstreetbets/comments/s9jc0i/amd_sure_as_hell_on_that_list/,Alive_Till4633,1,2022-01-21 13:55:25
It's a matrjoschka dip attack,,/r/wallstreetbets/comments/s9jcep/its_a_matrjoschka_dip_attack/,b3MxZG8R3C9GRTHV,1,2022-01-21 13:55:57
🤔guess hedgies don’t like BSV?,,/r/wallstreetbets/comments/s9jehz/guess_hedgies_dont_like_bsv/,Sparky12421,1,2022-01-21 13:58:36
Fundstrat usually much better than this…. Thanks Carl… https://twitter.com/carlquintanilla/status/1481092043829133312?s=21,,/r/wallstreetbets/comments/s9jguy/fundstrat_usually_much_better_than_this_thanks/,Alive_Till4633,1,2022-01-21 14:01:10
Want to short ARK? Buy SARK!,,/r/wallstreetbets/comments/s9jh1t/want_to_short_ark_buy_sark/,dilkmud0002,1,2022-01-21 14:01:22
I hope I'm doing this right..,,/r/wallstreetbets/comments/s9ji00/i_hope_im_doing_this_right/,JoseM217,1,2022-01-21 14:02:27
die Netflix die,,/r/wallstreetbets/comments/s9jj96/die_netflix_die/,FyenacialAdvisor,1,2022-01-21 14:04:01
Caught him in 4K,,/r/wallstreetbets/comments/s9jlh7/caught_him_in_4k/,yolocallking,1,2022-01-21 14:06:46
How does the yield curve affect savings bonds?,,/r/wallstreetbets/comments/s9jlmi/how_does_the_yield_curve_affect_savings_bonds/,Massive_bull_worm,1,2022-01-21 14:06:58
Getting ready to look at my portfolio,,/r/wallstreetbets/comments/s9jmep/getting_ready_to_look_at_my_portfolio/,Janto_2021,1,2022-01-21 14:08:00
BUY THE DIP 🙌🏼,,/r/wallstreetbets/comments/s9jnf6/buy_the_dip/,DependentInternal188,1,2022-01-21 14:09:19
Follow-up on the girl who exercised 10 call options and was down 50%,,/r/wallstreetbets/comments/s9jnhi/followup_on_the_girl_who_exercised_10_call/,UpGoodDownBad,1,2022-01-21 14:09:24
What u wizzards think of Spell token ?,,/r/wallstreetbets/comments/s9jnq9/what_u_wizzards_think_of_spell_token/,alexTrade1,1,2022-01-21 14:09:42
A photo you can cum on,,/r/wallstreetbets/comments/s9jp3t/a_photo_you_can_cum_on/,mynameisjeffbezos,1,2022-01-21 14:11:15
Guys I found this really cool stock called PTON,,/r/wallstreetbets/comments/s9jp49/guys_i_found_this_really_cool_stock_called_pton/,Staticoli,1,2022-01-21 14:11:16
There is no spoon...,,/r/wallstreetbets/comments/s9jpdy/there_is_no_spoon/,IAintSelling,1,2022-01-21 14:11:34
Airline stocks big drop in 2020 I just noticed,,/r/wallstreetbets/comments/s9jppa/airline_stocks_big_drop_in_2020_i_just_noticed/,WaterbottleMilkshake,1,2022-01-21 14:11:57
Alibozo yolo,,/r/wallstreetbets/comments/s9jud6/alibozo_yolo/,OccasionAware,1,2022-01-21 14:17:37
Wen Moon,,/r/wallstreetbets/comments/s9juhi/wen_moon/,MichKOG,1,2022-01-21 14:17:47
Indicators!!,,/r/wallstreetbets/comments/s9juqk/indicators/,TYTJOKER,1,2022-01-21 14:18:06
It has been an absolute honor serving you you retards the last 3 months. My hands will remain 💎. Cheers to another shit quarter.,,/r/wallstreetbets/comments/s9jv3i/it_has_been_an_absolute_honor_serving_you_you/,rayjape,1,2022-01-21 14:18:34
Ecommerce giants getting killed,,/r/wallstreetbets/comments/s9jv5g/ecommerce_giants_getting_killed/,saurin212,1,2022-01-21 14:18:38
Pelosi says she's open to stock trading ban for Congress,,/r/wallstreetbets/comments/s9jvg3/pelosi_says_shes_open_to_stock_trading_ban_for/,MF266,1,2022-01-21 14:19:03
Time to find the nearest building. What a bloody week. Still holding all.,,/r/wallstreetbets/comments/s9jxyx/time_to_find_the_nearest_building_what_a_bloody/,Chadio8999,1,2022-01-21 14:22:00
my wifes husband is 30min into being a 🌈🐻,,/r/wallstreetbets/comments/s9jyhp/my_wifes_husband_is_30min_into_being_a/,Basic-Helicopter-253,1,2022-01-21 14:22:32
Nasdaq Average Performance after Correction,,/r/wallstreetbets/comments/s9jyvx/nasdaq_average_performance_after_correction/,shashwat73,1,2022-01-21 14:23:04
After a volatile week in the market - let’s check in with our wallstreetbets correspondent down in the pit. Chad?,,/r/wallstreetbets/comments/s9jyxk/after_a_volatile_week_in_the_market_lets_check_in/,_premium_grade,1,2022-01-21 14:23:07
Basically January,,/r/wallstreetbets/comments/s9k1s3/basically_january/,NotAGimpLmao,1,2022-01-21 14:26:48
I’m ready to go back to the dollar menu which with inflation is now the 2 dollars menu..,,/r/wallstreetbets/comments/s9k3d8/im_ready_to_go_back_to_the_dollar_menu_which_with/,mariajoseh,1,2022-01-21 14:28:55
Bear Wear Goggles,,/r/wallstreetbets/comments/s9k3xn/bear_wear_goggles/,dobolina,1,2022-01-21 14:29:39
Invest in your future!,,/r/wallstreetbets/comments/s9k4o7/invest_in_your_future/,redditsucks9812,1,2022-01-21 14:30:29
Still buying more,,/r/wallstreetbets/comments/s9k4v1/still_buying_more/,Kevin850850,1,2022-01-21 14:30:43
2022 ↘️,,/r/wallstreetbets/comments/s9k54q/2022/,No-Bad5971,1,2022-01-21 14:31:00
"Mickey Mouse (DIS) Gains, 1DTE.",,/r/wallstreetbets/comments/s9k5gf/mickey_mouse_dis_gains_1dte/,MingusChrl,1,2022-01-21 14:31:21
All in on Kramerica Inc,,/r/wallstreetbets/comments/s9k5lx/all_in_on_kramerica_inc/,HalKitzmiller,1,2022-01-21 14:31:32
Just to be clear on this…,,/r/wallstreetbets/comments/s9k6pq/just_to_be_clear_on_this/,Rare_P,1,2022-01-21 14:32:43
You Find Out Who A Real Trader Is When Your Down 70% Smiling And Laughing While The Whole Market Tanks On A Rocket To Infinity,,/r/wallstreetbets/comments/s9k7p9/you_find_out_who_a_real_trader_is_when_your_down/,Unsquidabls,1,2022-01-21 14:33:58
Buy $TASK.. heavily shorted.,,/r/wallstreetbets/comments/s9k9ur/buy_task_heavily_shorted/,Ok-Salary-7059,1,2022-01-21 14:36:38
Congrats and fuck each and every one of you.,,/r/wallstreetbets/comments/s9ka2e/congrats_and_fuck_each_and_every_one_of_you/,im-jared-im-19,1,2022-01-21 14:36:54
Top 10 Photos Taken Moments Before Disaster,,/r/wallstreetbets/comments/s9kaje/top_10_photos_taken_moments_before_disaster/,0DayOTM,1,2022-01-21 14:37:28
Buy TASK (Taskus) short sellers attacked this week with lies and it’s heavily shorted with low float. Let’s go Apes. GME these mofos.,,/r/wallstreetbets/comments/s9kaxa/buy_task_taskus_short_sellers_attacked_this_week/,Ok-Salary-7059,1,2022-01-21 14:38:00
"This is first time i bought few shares and they went green in few hours, lets gooo !",,/r/wallstreetbets/comments/s9kb1q/this_is_first_time_i_bought_few_shares_and_they/,Badgerv12,1,2022-01-21 14:38:11
Peak WSB. When the promoted posts blend in perfectly with the user posts,,/r/wallstreetbets/comments/s9kbh2/peak_wsb_when_the_promoted_posts_blend_in/,ImFedUpWithItAll,1,2022-01-21 14:38:41
Gain and loss porn 🤣,,/r/wallstreetbets/comments/s9kc3j/gain_and_loss_porn/,DaddyDersch,1,2022-01-21 14:39:33
I think I’m finally getting a hang of this,,/r/wallstreetbets/comments/s9kcz9/i_think_im_finally_getting_a_hang_of_this/,yummypotato12,1,2022-01-21 14:40:32
You are HERE. Think it can't drop any further?,,/r/wallstreetbets/comments/s9kdfo/you_are_here_think_it_cant_drop_any_further/,kviehdor,1,2022-01-21 14:41:03
This is first time i bought few shares and it went green the same day !!! Lets gooo !,,/r/wallstreetbets/comments/s9kdvw/this_is_first_time_i_bought_few_shares_and_it/,Badgerv12,1,2022-01-21 14:41:33
"Wendy's won't pay nearly enough. If you see me with my new wearable billboard at the street corner toss me a few coins. $SHOP 7K, $F 2/4 calls $4K, $PTON 1/28 put 4$K all vaporized in a single 3 hour bloodbath",,/r/wallstreetbets/comments/s9kirq/wendys_wont_pay_nearly_enough_if_you_see_me_with/,workinguntil65oridie,1,2022-01-21 14:47:33
"Burned $200 buying 2 QQQ puts in the last hour preventing resistance break, you are welcome!",,/r/wallstreetbets/comments/s9kjkv/burned_200_buying_2_qqq_puts_in_the_last_hour/,G000z,1,2022-01-21 14:48:38
Tell me Apes are winning without telling me…,,/r/wallstreetbets/comments/s9kkdq/tell_me_apes_are_winning_without_telling_me/,Kupaloidzki,1,2022-01-21 14:49:44
After a volatile week in the market - let’s check in with our wallstreetbets correspondent down in the pit. Chad?,,/r/wallstreetbets/comments/s9kkj5/after_a_volatile_week_in_the_market_lets_check_in/,_premium_grade,1,2022-01-21 14:49:55
"When marge calls amzn traders, buy 0dte calls",,/r/wallstreetbets/comments/s9kl0n/when_marge_calls_amzn_traders_buy_0dte_calls/,Araphoren,1,2022-01-21 14:50:26
"$GME: not the refuge we deserve, but the refuge we need in these trying times",,/r/wallstreetbets/comments/s9klro/gme_not_the_refuge_we_deserve_but_the_refuge_we/,HardtackOrange,1,2022-01-21 14:51:18
Ya’ll talking about CNBC’s Cramer… this is the only Kramer I’m following on my stock advice.,,/r/wallstreetbets/comments/s9knty/yall_talking_about_cnbcs_cramer_this_is_the_only/,frichdan,1,2022-01-21 14:53:43
Alright this is the beginning of the end,,/r/wallstreetbets/comments/s9kp5j/alright_this_is_the_beginning_of_the_end/,SnooLemons5535,1,2022-01-21 14:55:21
Shopify Gains Porn,,/r/wallstreetbets/comments/s9kpke/shopify_gains_porn/,Patient_Song1172,1,2022-01-21 14:55:53
Can someone explain this letter to me? All I can read is “Buy $EB”,,/r/wallstreetbets/comments/s9kptb/can_someone_explain_this_letter_to_me_all_i_can/,fanseman,1,2022-01-21 14:56:11
Can someone explain this letter to me? All I can read is “Buy $EB”,,/r/wallstreetbets/comments/s9kqm7/can_someone_explain_this_letter_to_me_all_i_can/,fanseman,1,2022-01-21 14:57:13
"Weekend Discussion Thread for the Weekend of January 22, 2022",,/r/wallstreetbets/comments/s9kt45/weekend_discussion_thread_for_the_weekend_of/,AutoModerator,1,2022-01-21 15:00:17
How I feel after buying the dip today.,,/r/wallstreetbets/comments/s9ktks/how_i_feel_after_buying_the_dip_today/,CurlySuefromSweden,1,2022-01-21 15:00:38
UPDATE: A captain goes down with his ship.,,/r/wallstreetbets/comments/s9ku3l/update_a_captain_goes_down_with_his_ship/,pizzabeercode,1,2022-01-21 15:01:13
It was his plan all along...,,/r/wallstreetbets/comments/s9kxch/it_was_his_plan_all_along/,drewsaster,2,2022-01-21 15:05:08
BTFD but.. Is it the dip?,,/r/wallstreetbets/comments/s9kxem/btfd_but_is_it_the_dip/,New-Radish3311,1,2022-01-21 15:05:12
Am I a little retard yet?,,/r/wallstreetbets/comments/s9kxi7/am_i_a_little_retard_yet/,Triggeralert411,1,2022-01-21 15:05:20
just needed like another.. week??,,/r/wallstreetbets/comments/s9kxrx/just_needed_like_another_week/,cEastwood1885,1,2022-01-21 15:05:41
ARKK,,/r/wallstreetbets/comments/s9kxt9/arkk/,super_trooper,1,2022-01-21 15:05:44
Feel really bad for my grand grand kids,,/r/wallstreetbets/comments/s9kydq/feel_really_bad_for_my_grand_grand_kids/,Universe-Science,1,2022-01-21 15:06:26
Porn Loss,,/r/wallstreetbets/comments/s9kyo5/porn_loss/,callmez4,1,2022-01-21 15:06:48
Bulls when they see green in after hours,,/r/wallstreetbets/comments/s9kz05/bulls_when_they_see_green_in_after_hours/,RealDandyBaby,1,2022-01-21 15:07:14
$TSLA $20k lost today. Of course the day I hit six figure gains on the year I act like a 🤡,,/r/wallstreetbets/comments/s9l04s/tsla_20k_lost_today_of_course_the_day_i_hit_six/,TuaTurnsdaballova,1,2022-01-21 15:08:40
Me after this week,,/r/wallstreetbets/comments/s9l07m/me_after_this_week/,CaptainPlatano,1,2022-01-21 15:08:47
$TSLA $20k loss today. Of course the day I hit six figure gains on the year I act like a 🤡,,/r/wallstreetbets/comments/s9l156/tsla_20k_loss_today_of_course_the_day_i_hit_six/,TuaTurnsdaballova,1,2022-01-21 15:09:58
How I feel after buying the dip today.,,/r/wallstreetbets/comments/s9l1lg/how_i_feel_after_buying_the_dip_today/,CurlySuefromSweden,1,2022-01-21 15:10:25
Time to increase the yearly 3K capital loss limit.,,/r/wallstreetbets/comments/s9l28o/time_to_increase_the_yearly_3k_capital_loss_limit/,askflask,1,2022-01-21 15:11:07
What would happen if we all bought in on inverse leveraged ETFs?,,/r/wallstreetbets/comments/s9l2px/what_would_happen_if_we_all_bought_in_on_inverse/,pbjames23,1,2022-01-21 15:11:39
How does this get reversed?,,/r/wallstreetbets/comments/s9l2sf/how_does_this_get_reversed/,Embarrassed_Fennel_1,1,2022-01-21 15:11:44
Guh,,/r/wallstreetbets/comments/s9l339/guh/,Rockoalol,1,2022-01-21 15:12:05
So I may just be a retarded boy. But over 700% shares short and counting seems like a good time for us to squeeze it. Can someone smart come in here and disprove me.,,/r/wallstreetbets/comments/s9l9nh/so_i_may_just_be_a_retarded_boy_but_over_700/,TEDDYKnighty,1,2022-01-21 15:20:16
$70k to 0 😂,,/r/wallstreetbets/comments/s9l9u8/70k_to_0/,coolfrog39,1,2022-01-21 15:20:28
"It was guaranteed right here on Reddit that the market would drop between October 24, 2021 and January 24, 2022",,/r/wallstreetbets/comments/s9lacl/it_was_guaranteed_right_here_on_reddit_that_the/,thedowcast,1,2022-01-21 15:21:01
Anyone else not ok? 💔,,/r/wallstreetbets/comments/s9lc3v/anyone_else_not_ok/,lostinallways,1,2022-01-21 15:22:55
PSA: Close your calendar spreads early. Way too leveraged now.,,/r/wallstreetbets/comments/s9lcmc/psa_close_your_calendar_spreads_early_way_too/,SinglePartyLeader,1,2022-01-21 15:23:36
If you don’t look it doesn’t hurt.,,/r/wallstreetbets/comments/s9lct9/if_you_dont_look_it_doesnt_hurt/,killergahndi,1,2022-01-21 15:23:51
DOWN WITH THE SHIP APES,,/r/wallstreetbets/comments/s9lcu9/down_with_the_ship_apes/,Life_Organization_56,1,2022-01-21 15:23:53
$CENN 🟢🟢🟢🟢🟢💎💎💎💎💎 Cenntro Electric.,,/r/wallstreetbets/comments/s9ldm5/cenn_cenntro_electric/,Successful_Emu_5109,1,2022-01-21 15:24:52
How my account feels right now.,,/r/wallstreetbets/comments/s9ldrl/how_my_account_feels_right_now/,ariesdrifter77,1,2022-01-21 15:25:03
Upvote if you just signed!,,/r/wallstreetbets/comments/s9ldtz/upvote_if_you_just_signed/,hump-a-doo_trump,1,2022-01-21 15:25:09
"Opps, GameStop was one of the few to close Green.. What happened there?. GME is a sleeper ready to awaken. Wouldn’t bet agains it personally.😂🚀👐💵📈🆙🚀🌜",,/r/wallstreetbets/comments/s9lf3c/opps_gamestop_was_one_of_the_few_to_close_green/,KIitComander,1,2022-01-21 15:26:52
Got absolutely wrecked today by Tesla and SPY calls. Anyone else? In need of support,,/r/wallstreetbets/comments/s9lf5e/got_absolutely_wrecked_today_by_tesla_and_spy/,Zealousideal-Fly6318,1,2022-01-21 15:26:56
Reddit understands my handicap isn't just mental...,,/r/wallstreetbets/comments/s9lgbx/reddit_understands_my_handicap_isnt_just_mental/,FishTarTarSauce,1,2022-01-21 15:28:31
JPMorgan bank has absolutely collapsed down through the 200 day MA and is still heading south. Watch closely - let's see what's revealed.,,/r/wallstreetbets/comments/s9lgrd/jpmorgan_bank_has_absolutely_collapsed_down/,j_stars,1,2022-01-21 15:29:06
This is a Hieronymus Bosch sub now,,/r/wallstreetbets/comments/s9lhxv/this_is_a_hieronymus_bosch_sub_now/,WilhelmSuperhitler,1,2022-01-21 15:30:35
I didn’t follow my ER plan but who cares 😂 puts for life hahahaha,,/r/wallstreetbets/comments/s9liu8/i_didnt_follow_my_er_plan_but_who_cares_puts_for/,Professssssssor,1,2022-01-21 15:31:35
Meet Brian sleazy the bottom feeding shill:,,/r/wallstreetbets/comments/s9lj3h/meet_brian_sleazy_the_bottom_feeding_shill/,Bernardsman,1,2022-01-21 15:31:51
$CENN 🟢🟢🟢🟢💎💎💎💎 Cenntro Electric.Might be a good time for squeeze…just saying.,,/r/wallstreetbets/comments/s9ljp2/cenn_cenntro_electricmight_be_a_good_time_for/,Successful_Emu_5109,1,2022-01-21 15:32:32
"58k &gt; 106k &gt; 7k &gt; 118k since November. Cashed out today, taking a break.",,/r/wallstreetbets/comments/s9ljwu/58k_106k_7k_118k_since_november_cashed_out_today/,TrappedUnderVice,1,2022-01-21 15:32:48
SPY- who let the bears out?,,/r/wallstreetbets/comments/s9lke8/spy_who_let_the_bears_out/,DaddyDersch,1,2022-01-21 15:33:23
I know nothing but after watching 30rock after having Covid for 10 days. GE is for ME,,/r/wallstreetbets/comments/s9ln6a/i_know_nothing_but_after_watching_30rock_after/,Wopolie,1,2022-01-21 15:36:56
Are GME shorts proper fukt or only actually a little bit but not too seriously fukt?,,/r/wallstreetbets/comments/s9ln9v/are_gme_shorts_proper_fukt_or_only_actually_a/,MacJac13,1,2022-01-21 15:37:04
Reddit wants real losses so here we go. Anyway else not ok?,,/r/wallstreetbets/comments/s9lpo8/reddit_wants_real_losses_so_here_we_go_anyway/,lostinallways,1,2022-01-21 15:40:03
Never been able to figure this out,,/r/wallstreetbets/comments/s9lrob/never_been_able_to_figure_this_out/,chrishansonnbc,1,2022-01-21 15:42:16
"I didn’t execute my plan, went on puts, not a bad decision haha",,/r/wallstreetbets/comments/s9lrsv/i_didnt_execute_my_plan_went_on_puts_not_a_bad/,Professssssssor,1,2022-01-21 15:42:24
Robin Hood be wildin,,/r/wallstreetbets/comments/s9lrx8/robin_hood_be_wildin/,UnionCounty22,1,2022-01-21 15:42:32
"the most likely happened, we got to the target in AMC.",,/r/wallstreetbets/comments/s9lu3g/the_most_likely_happened_we_got_to_the_target_in/,tcriptoarts,1,2022-01-21 15:45:15
Another 52 week low - Another post about DKNG - Highlighting its positives,,/r/wallstreetbets/comments/s9luqy/another_52_week_low_another_post_about_dkng/,Street_Country_1266,1,2022-01-21 15:46:05
Bears go BRRRRRRRRRRR,,/r/wallstreetbets/comments/s9lvs3/bears_go_brrrrrrrrrrr/,Thelastret2,1,2022-01-21 15:47:23
Returning from the market after getting mauled by Bears today,,/r/wallstreetbets/comments/s9lvue/returning_from_the_market_after_getting_mauled_by/,stinkingstonks,1,2022-01-21 15:47:29
"TSG. @thatstocksgirl that lost 50% on options / Sound on/ This is so good. TSG: She doesn't care, my life is amazing, amazing wardrobe etc. We all need to learn from this women how to handle 50% losses hahaha",,/r/wallstreetbets/comments/s9lvw5/tsg_thatstocksgirl_that_lost_50_on_options_sound/,Simplevice,1,2022-01-21 15:47:32
Buy The Dip.,,/r/wallstreetbets/comments/s9lxh8/buy_the_dip/,BigTimeLA,1,2022-01-21 15:49:36
This is GME boat and Apes is th SEA,,/r/wallstreetbets/comments/s9m0vp/this_is_gme_boat_and_apes_is_th_sea/,keenfeed,1,2022-01-21 15:53:27
Fed Rate hikes this year,,/r/wallstreetbets/comments/s9m236/fed_rate_hikes_this_year/,maahhkus,1,2022-01-21 15:55:07
Am I doing this right folks? ;-(,,/r/wallstreetbets/comments/s9m3d2/am_i_doing_this_right_folks/,Dota_296,1,2022-01-21 15:56:45
Since everything is down today I'm going to do something that's the complete opposite.,,/r/wallstreetbets/comments/s9m3hm/since_everything_is_down_today_im_going_to_do/,En4cr,1,2022-01-21 15:56:55
NFLX and surreal &lt;$200- -&gt;$3300,,/r/wallstreetbets/comments/s9m3yu/nflx_and_surreal_200_3300/,tendiesamust,1,2022-01-21 15:57:31
So hard to leave Bull Gang,,/r/wallstreetbets/comments/s9m4g5/so_hard_to_leave_bull_gang/,jok3r925,1,2022-01-21 15:58:11
WSB members rn and month ago,,/r/wallstreetbets/comments/s9m5xu/wsb_members_rn_and_month_ago/,Emotional-Roof-7728,1,2022-01-21 16:00:03
"the most likely happened, we got to the target in AMC.",,/r/wallstreetbets/comments/s9maq1/the_most_likely_happened_we_got_to_the_target_in/,tcriptoarts,1,2022-01-21 16:05:29
