Toooo theeee moooooon,,/r/wallstreetbets/comments/s5ldln/toooo_theeee_moooooon/,Due-History517,1,2022-01-16 14:56:49
"Free 100 in e t h no BS, easy to sign up and can pay with your bank account! Did I mention polygon gas fees ;) no 200+ in gas fees to buy coins",,/r/wallstreetbets/comments/s5ll4w/free_100_in_e_t_h_no_bs_easy_to_sign_up_and_can/,Intergalacticapparel,1,2022-01-16 15:05:52
"A person can only YOLO so often otherwise it’s just how they invest. Follow me on this if someone sells uncovered calls in volatile stocks daily or weekly it’s not YOLO, it’s what they do. YOLO implies going for it once in a while. Tired of everything being YOLO.",,/r/wallstreetbets/comments/s5lmtq/a_person_can_only_yolo_so_often_otherwise_its/,yellowirish,1,2022-01-16 15:07:56
دراسة جدوي مشروع مغسله ملابس بالتفصيل 2022,,/r/wallstreetbets/comments/s5lpgz/دراسة_جدوي_مشروع_مغسله_ملابس_بالتفصيل_2022/,Straight_Resort9401,1,2022-01-16 15:11:12
TA on GME/AMC,,/r/wallstreetbets/comments/s5lscl/ta_on_gmeamc/,B2of7,1,2022-01-16 15:14:45
has anyone heard of Trillion coin? ticker TRLN. i just bought like 14 billion coins off pancakeswap for like .25$ lol should buy more?,,/r/wallstreetbets/comments/s5lsm1/has_anyone_heard_of_trillion_coin_ticker_trln_i/,CAD_Trader55,1,2022-01-16 15:15:05
My gfs boyfriend would be proud…,,/r/wallstreetbets/comments/s5ly4g/my_gfs_boyfriend_would_be_proud/,tsiike,1,2022-01-16 15:21:55
Tutes,,/r/wallstreetbets/comments/s5lzmt/tutes/,LouieThePigHunter,1,2022-01-16 15:23:47
Question: Does anyone on this thread invest in managed mutual funds of any kind?,,/r/wallstreetbets/comments/s5m044/question_does_anyone_on_this_thread_invest_in/,Ok-Cry8992,1,2022-01-16 15:24:24
"True story, good luck for everybody for the next week.",,/r/wallstreetbets/comments/s5m6qg/true_story_good_luck_for_everybody_for_the_next/,Standard-Year-1178,1,2022-01-16 15:32:41
I finally gathered enough Karma for my first WSB post.,,/r/wallstreetbets/comments/s5mc1m/i_finally_gathered_enough_karma_for_my_first_wsb/,E_the_V,1,2022-01-16 15:39:09
Dirty Work,,/r/wallstreetbets/comments/s5mci8/dirty_work/,wallystreetbetter,1,2022-01-16 15:39:43
$ALLO Bullish Engulfing on the Daily,,/r/wallstreetbets/comments/s5mjvj/allo_bullish_engulfing_on_the_daily/,Logandatogan,1,2022-01-16 15:48:52
Acorns,,/r/wallstreetbets/comments/s5mn2x/acorns/,CodyHillyer,1,2022-01-16 15:52:51
"Weekend Weed threw bought post Hype.. $GME ain’t dead, it’s sleeping. 😂💎👐💵📈🆙🚀🌖",,/r/wallstreetbets/comments/s5mnc1/weekend_weed_threw_bought_post_hype_gme_aint_dead/,KIitComander,1,2022-01-16 15:53:12
Drs your shares retards,,/r/wallstreetbets/comments/s5mp4k/drs_your_shares_retards/,Apes_and_dogs,1,2022-01-16 15:55:35
"New investing app, sign up get 20 EUR",,/r/wallstreetbets/comments/s5mp8t/new_investing_app_sign_up_get_20_eur/,Overall-Swing-5240,1,2022-01-16 15:55:44
Tesla earnings??,,/r/wallstreetbets/comments/s5mq9i/tesla_earnings/,Gloomy-Dig-6261,1,2022-01-16 15:57:01
Wtf means “ Like 4chan found a Bloomberg terminal”,,/r/wallstreetbets/comments/s5mtwf/wtf_means_like_4chan_found_a_bloomberg_terminal/,Much_Butterscotch_65,1,2022-01-16 16:01:23
Facebook faces $3.2 billion UK class action over market dominance,,/r/wallstreetbets/comments/s5mugh/facebook_faces_32_billion_uk_class_action_over/,apeonjupiter,1,2022-01-16 16:02:07
How do you short American Football?,,/r/wallstreetbets/comments/s5mv6e/how_do_you_short_american_football/,toenailclipping,1,2022-01-16 16:02:59
Nearly tripled the P-folio in first two weeks of 2022,,/r/wallstreetbets/comments/s5mx18/nearly_tripled_the_pfolio_in_first_two_weeks_of/,t0xic_platypus,1,2022-01-16 16:05:16
My portfolio is fine,,/r/wallstreetbets/comments/s5n8yy/my_portfolio_is_fine/,FuturisticTrout,1,2022-01-16 16:20:25
SOLO stock: Let's talk about a potentially lucrative aspect of this company that doesn't get much attention: Ridesharing.,,/r/wallstreetbets/comments/s5nauc/solo_stock_lets_talk_about_a_potentially/,Maxim859,1,2022-01-16 16:22:49
AMC is about to break records!!!!!,,/r/wallstreetbets/comments/s5nfbs/amc_is_about_to_break_records/,sears3576,1,2022-01-16 16:28:26
opinions on RIOT Blockchain?,,/r/wallstreetbets/comments/s5nibd/opinions_on_riot_blockchain/,bobica69,1,2022-01-16 16:32:08
Explaining technicals and logic in WSB,,/r/wallstreetbets/comments/s5niq2/explaining_technicals_and_logic_in_wsb/,CreamyChickenCock,1,2022-01-16 16:32:40
Adam Aron confessional leaked,,/r/wallstreetbets/comments/s5nkbw/adam_aron_confessional_leaked/,trapmitch,1,2022-01-16 16:34:39
Couple questions about stonks.,,/r/wallstreetbets/comments/s5nn87/couple_questions_about_stonks/,cwelch1204,1,2022-01-16 16:38:32
White Delilah Needs a New Home,,/r/wallstreetbets/comments/s5nnug/white_delilah_needs_a_new_home/,imnobodye,1,2022-01-16 16:39:22
Maybe being a wage-slave isn't so bad after all...,,/r/wallstreetbets/comments/s5noh8/maybe_being_a_wageslave_isnt_so_bad_after_all/,MelanieMoris,1,2022-01-16 16:40:06
I Can’t Figure Out Why I Keep Losing Money In The Market,,/r/wallstreetbets/comments/s5ns9j/i_cant_figure_out_why_i_keep_losing_money_in_the/,moneygrabber007,1,2022-01-16 16:45:02
can any of WSB admins message me it's important,,/r/wallstreetbets/comments/s5ntvf/can_any_of_wsb_admins_message_me_its_important/,xbillz,1,2022-01-16 16:47:05
"The Quiet kid in the back that does his own work usually has the best grades. LOL. $GME is a good investment. Shit, he has more money in it than we do...",,/r/wallstreetbets/comments/s5nut1/the_quiet_kid_in_the_back_that_does_his_own_work/,KIitComander,1,2022-01-16 16:48:17
WiISH bull,,/r/wallstreetbets/comments/s5nwek/wiish_bull/,Janto_2021,1,2022-01-16 16:50:18
Trading for the first time 😂📈📉📉,,/r/wallstreetbets/comments/s5nxnw/trading_for_the_first_time/,sears3576,1,2022-01-16 16:51:49
DD Buy my bags,,/r/wallstreetbets/comments/s5nyvz/dd_buy_my_bags/,Both-Employee-3421,1,2022-01-16 16:53:23
AMC GIVEAWAY,,/r/wallstreetbets/comments/s5o0p8/amc_giveaway/,AmcApe6996,1,2022-01-16 16:55:48
Dad is a certified bull,,/r/wallstreetbets/comments/s5o13o/dad_is_a_certified_bull/,roccoman123,1,2022-01-16 16:56:18
The Convergence to end them all,,/r/wallstreetbets/comments/s5o1an/the_convergence_to_end_them_all/,bakedbeansandwhich,1,2022-01-16 16:56:33
Coinbase,,/r/wallstreetbets/comments/s5o1o5/coinbase/,charlesmanabat,1,2022-01-16 16:57:01
"What if I told you there is a company trading at a $212.98M market cap, and 2021 fiscal year revenue is anticipated to be $621M - $629M",,/r/wallstreetbets/comments/s5oa2u/what_if_i_told_you_there_is_a_company_trading_at/,charlesholmes1,1,2022-01-16 17:07:19
My Tip is Green,,/r/wallstreetbets/comments/s5oddm/my_tip_is_green/,AmcApe6996,1,2022-01-16 17:11:25
"420 Tatto in my face, if Tilray hits 100 usd during 2022.",,/r/wallstreetbets/comments/s5oesr/420_tatto_in_my_face_if_tilray_hits_100_usd/,FeathersMountEbb,1,2022-01-16 17:13:13
Seven (7) reasons why I will be switching from CMEG to TradeZero in 2022!,,/r/wallstreetbets/comments/s5ofkt/seven_7_reasons_why_i_will_be_switching_from_cmeg/,eroban,1,2022-01-16 17:14:09
CMEG vs TradeZero,,/r/wallstreetbets/comments/s5ogw9/cmeg_vs_tradezero/,eroban,1,2022-01-16 17:15:43
Sun Country Airlines (SNCY),,/r/wallstreetbets/comments/s5opg3/sun_country_airlines_sncy/,CyberReddit48,1,2022-01-16 17:26:15
How I enter the market,,/r/wallstreetbets/comments/s5oqyj/how_i_enter_the_market/,Kick_Flip69,1,2022-01-16 17:28:10
How Can I Buy Puts on the US ?,,/r/wallstreetbets/comments/s5orgn/how_can_i_buy_puts_on_the_us/,Mundane_Win_1471,1,2022-01-16 17:28:47
NFLX staaaph it,,/r/wallstreetbets/comments/s5oru6/nflx_staaaph_it/,Hyp3rLyf3r,1,2022-01-16 17:29:15
IONQ,,/r/wallstreetbets/comments/s5ows8/ionq/,ionqarcx,1,2022-01-16 17:35:25
GME/AMC about to go brrrr,,/r/wallstreetbets/comments/s5ozo0/gmeamc_about_to_go_brrrr/,Njkoskin,2,2022-01-16 17:39:05
Puts on $DPZ,,/r/wallstreetbets/comments/s5p47c/puts_on_dpz/,WornToga,1,2022-01-16 17:44:50
please recomend brokers,,/r/wallstreetbets/comments/s5p47d/please_recomend_brokers/,Temporary-Doctor-446,1,2022-01-16 17:44:50
Turns out the Wizarding World were the OG WSB (saw this while re-watching Harry Potter),,/r/wallstreetbets/comments/s5p536/turns_out_the_wizarding_world_were_the_og_wsb_saw/,robml,1,2022-01-16 17:45:57
"Maybe next time, Uncle Sam",,/r/wallstreetbets/comments/s5pcgt/maybe_next_time_uncle_sam/,DemonOfLight13,1,2022-01-16 17:55:15
WSB in a nutshell,,/r/wallstreetbets/comments/s5pd4e/wsb_in_a_nutshell/,Mundane_Win_1471,1,2022-01-16 17:56:07
[Meme] Buy Puts!,,/r/wallstreetbets/comments/s5pdin/meme_buy_puts/,alsargeant312,1,2022-01-16 17:56:36
WSB in a nutshell,,/r/wallstreetbets/comments/s5pefs/wsb_in_a_nutshell/,Mundane_Win_1471,1,2022-01-16 17:57:49
"Trade with the best cryptocurrency platform and stop loosing your money to scammers, join the trading platform now and make more profit than you think, join now and avoid been scammed again click on the link now to join https://crudocoin.com",,/r/wallstreetbets/comments/s5pf8f/trade_with_the_best_cryptocurrency_platform_and/,Rosarionieva,1,2022-01-16 17:58:52
"Instala el navegador CryptoTab y comienza a ganar dinero extra por solo usarlo. Mientras estés viendo vídeos en YouTube, leyendo noticias y usando las redes sociales de la manera en la que lo haces a diario, consigues bitcoines reales.",,/r/wallstreetbets/comments/s5plny/instala_el_navegador_cryptotab_y_comienza_a_ganar/,Logical_Sherbert_904,1,2022-01-16 18:06:48
Plan for January earnings done.,,/r/wallstreetbets/comments/s5pund/plan_for_january_earnings_done/,Professssssssor,1,2022-01-16 18:18:43
Buy Calls on Russia!!!!,,/r/wallstreetbets/comments/s5pzfr/buy_calls_on_russia/,TTMoon_LLC,1,2022-01-16 18:25:01
Michael K. Williams interviewing a WSB mod,,/r/wallstreetbets/comments/s5q1k6/michael_k_williams_interviewing_a_wsb_mod/,zeroCool_69,1,2022-01-16 18:27:49
WISH longs looking at his and licking their lips,,/r/wallstreetbets/comments/s5q1yr/wish_longs_looking_at_his_and_licking_their_lips/,Janto_2021,1,2022-01-16 18:28:22
Hi,,/r/wallstreetbets/comments/s5q2yv/hi/,alphaomega_2021,1,2022-01-16 18:29:44
Found this unpublished piece of nostalgia next to my porn collection,,/r/wallstreetbets/comments/s5q3b9/found_this_unpublished_piece_of_nostalgia_next_to/,acapDD,1,2022-01-16 18:30:12
Best ETF to own for long term?,,/r/wallstreetbets/comments/s5q6qa/best_etf_to_own_for_long_term/,Over_Tomatillo_536,1,2022-01-16 18:34:50
🚀🌕,,/r/wallstreetbets/comments/s5q928/_/,Bigboy_23_Mlloy,1,2022-01-16 18:38:00
$CPNG Thoughts 🚀🚀🛸🛸🛸,,/r/wallstreetbets/comments/s5qbnm/cpng_thoughts/,NoPanda8490,1,2022-01-16 18:41:33
"A year after GameStop, Wall Street is still scared of the power of retail traders - and is tracking them closely | Markets Insider",,/r/wallstreetbets/comments/s5qdbi/a_year_after_gamestop_wall_street_is_still_scared/,Go_StreetBB,1,2022-01-16 18:43:46
"What’s everyone’s thoughts on https://www.reddit.com/r/hectordao/ ? I see it as very undervalued with high apys, great devs and a sick road map.",,/r/wallstreetbets/comments/s5qdzj/whats_everyones_thoughts_on/,Prestigious-Heat-642,1,2022-01-16 18:44:41
"BIG NEWS, seriously how isn't the media reporting on this?! Get on the 🚀 next stop 🌙, shills and 🌈 🐻 are fuds",,/r/wallstreetbets/comments/s5qel2/big_news_seriously_how_isnt_the_media_reporting/,Tidiliwomp,1,2022-01-16 18:45:28
FORD WILL BRRRRR. Why buy Tsla leaps at 30k+ when you can buy ford at $300? Just buy 30k ford leaps you dumb whales,,/r/wallstreetbets/comments/s5qexf/ford_will_brrrrr_why_buy_tsla_leaps_at_30k_when/,GoogleGooshGoosh,1,2022-01-16 18:45:55
"Chartists out there - opinions on my simple crazy crayon drawings, please. Never got into GME - but trying to figure out where it is headed because I'm retarted. Is GME about to go much lower?",,/r/wallstreetbets/comments/s5qffb/chartists_out_there_opinions_on_my_simple_crazy/,dishdasher,1,2022-01-16 18:46:33
Is he one of us ?,,/r/wallstreetbets/comments/s5qk14/is_he_one_of_us/,TrickyAcanthisitta84,1,2022-01-16 18:52:46
Thoughts of hec dao?🍉,,/r/wallstreetbets/comments/s5qky9/thoughts_of_hec_dao/,Prestigious-Heat-642,1,2022-01-16 18:54:03
Pre-Market Community talks about Canadian stocks for Monday January 17th 2022 Datametrex most undervalued stock just awarded 40m contract with Department of National Defence with a market cap of 80m this stock is severely undervalued.,,/r/wallstreetbets/comments/s5qmr6/premarket_community_talks_about_canadian_stocks/,c-ram91,1,2022-01-16 18:56:33
Pre-Market Community talks about Canadian stocks for Monday January 17th 2022 Datametrex most undervalued stock just awarded 40m contract with Department of National Defence with a market cap of 80m this stock is severely under valued. Another stock I believe has potential is ACDC Extreme Vehicle,,/r/wallstreetbets/comments/s5qoz5/premarket_community_talks_about_canadian_stocks/,c-ram91,1,2022-01-16 18:59:40
$CENN this guy. 💎💎💎💎💎💎🙌🙌🙌🙌🙌🙌🙌🙌🙌,,/r/wallstreetbets/comments/s5qqm1/cenn_this_guy/,Successful_Emu_5109,1,2022-01-16 19:01:34
So you guys remember that GameStop thing? Is it possible to do that with futures of another country’s currency?,,/r/wallstreetbets/comments/s5qy57/so_you_guys_remember_that_gamestop_thing_is_it/,YggdrasilFang,1,2022-01-16 19:11:31
Make easy money join the link 20€,,/r/wallstreetbets/comments/s5qya8/make_easy_money_join_the_link_20/,Moneymakerrrrrssss,1,2022-01-16 19:11:41
So do you guys remember that GameStop thing?,,/r/wallstreetbets/comments/s5qze5/so_do_you_guys_remember_that_gamestop_thing/,YggdrasilFang,1,2022-01-16 19:13:12
"Pre-Market for Canadian stocks January 17th,2022",,/r/wallstreetbets/comments/s5qzzn/premarket_for_canadian_stocks_january_17th2022/,c-ram91,1,2022-01-16 19:13:56
Are there any examples of people with gambling addictions who are wildly profitable?,,/r/wallstreetbets/comments/s5r2is/are_there_any_examples_of_people_with_gambling/,NervusTrader,1,2022-01-16 19:17:20
StreetPunks NFT ready to be a trendsetter on the Binance Smart Chain,,/r/wallstreetbets/comments/s5rcqt/streetpunks_nft_ready_to_be_a_trendsetter_on_the/,AcanthisittaDry3330,1,2022-01-16 19:31:01
"I have very overweighted exposure to SFR, what’s the best way to hedge against a real estate crash?",,/r/wallstreetbets/comments/s5rfvh/i_have_very_overweighted_exposure_to_sfr_whats/,WhiskyBravo13,1,2022-01-16 19:35:17
Fidelity helped me discover my retardment plan,,/r/wallstreetbets/comments/s5rhlo/fidelity_helped_me_discover_my_retardment_plan/,PotatoWriter,1,2022-01-16 19:37:38
The usual dinner for a degenerate,,/r/wallstreetbets/comments/s5rhnv/the_usual_dinner_for_a_degenerate/,lfaexs,1,2022-01-16 19:37:43
"""Yes hi mom, I lost all my money after I was scammed and bought a virtual plot of land on the metaverse. Could I please get this week's allowance earlier?""",,/r/wallstreetbets/comments/s5rirm/yes_hi_mom_i_lost_all_my_money_after_i_was/,Spirited-Cow-3211,1,2022-01-16 19:39:17
"FASTEST 3 WHEEL EV THAT CAN MAKE YOU MONEY WHILE PARKED. I put 5,000 down on this hoping it and will be ordering one when the stock price goes to mars before elon.",,/r/wallstreetbets/comments/s5rlwo/fastest_3_wheel_ev_that_can_make_you_money_while/,c-ram91,1,2022-01-16 19:43:36
Making 5K in 15 Minutes with Tesla Calls!,,/r/wallstreetbets/comments/s5rmfv/making_5k_in_15_minutes_with_tesla_calls/,danajamesjones,1,2022-01-16 19:44:19
What company do you like yoloing on?,,/r/wallstreetbets/comments/s5rn2d/what_company_do_you_like_yoloing_on/,ICumToOsama2021,1,2022-01-16 19:45:10
My story,,/r/wallstreetbets/comments/s5ro6l/my_story/,KarenFoundAStick,1,2022-01-16 19:46:37
HODL,,/r/wallstreetbets/comments/s5rptm/hodl/,phantom3199,1,2022-01-16 19:48:54
🇨🇳 up next,,/r/wallstreetbets/comments/s5rquf/up_next/,easymoneeybabe,1,2022-01-16 19:50:13
How would you hedge to protect a downturn in single family real estate values?,,/r/wallstreetbets/comments/s5ruwh/how_would_you_hedge_to_protect_a_downturn_in/,WhiskyBravo13,1,2022-01-16 19:55:40
Happy MLK Day to one of the original WSB members,,/r/wallstreetbets/comments/s5ruxq/happy_mlk_day_to_one_of_the_original_wsb_members/,needadvice881,1,2022-01-16 19:55:43
What is a good way to hedge against losses in single family home real estate values? If (when) they come back to earth?,,/r/wallstreetbets/comments/s5rwfd/what_is_a_good_way_to_hedge_against_losses_in/,WhiskyBravo13,1,2022-01-16 19:57:50
What is a good way to trade/hedge against a loss in single family home values? If (when) prices come back down to earth?,,/r/wallstreetbets/comments/s5rybb/what_is_a_good_way_to_tradehedge_against_a_loss/,WhiskyBravo13,1,2022-01-16 20:00:12
PHUN,,/r/wallstreetbets/comments/s5ryl3/phun/,Outside_Many_4767,1,2022-01-16 20:00:24
Cool street Art,,/r/wallstreetbets/comments/s5s0e7/cool_street_art/,Ape_with_shades,1,2022-01-16 20:02:46
Why you lose money on options while being right.,,/r/wallstreetbets/comments/s5s0yp/why_you_lose_money_on_options_while_being_right/,lenin_is_young,1,2022-01-16 20:03:29
Who wants to buy Wyoming?,,/r/wallstreetbets/comments/s5s1ls/who_wants_to_buy_wyoming/,HighskorzNFT,1,2022-01-16 20:04:19
When you buy the dip....,,/r/wallstreetbets/comments/s5s24g/when_you_buy_the_dip/,hiro-dogetagonist,1,2022-01-16 20:05:00
the only vaccine to prevent covid,,/r/wallstreetbets/comments/s5s4si/the_only_vaccine_to_prevent_covid/,LouieThePigHunter,1,2022-01-16 20:08:34
Maybe it’s not just a Nancy strategy anymore. What’s the “penalty”? $250?,,/r/wallstreetbets/comments/s5s8r2/maybe_its_not_just_a_nancy_strategy_anymore_whats/,8512764EA,1,2022-01-16 20:13:41
Maybe it’s not just a Nancy strategy anymore. What’s the “penalty”? $250?,,/r/wallstreetbets/comments/s5s8r3/maybe_its_not_just_a_nancy_strategy_anymore_whats/,8512764EA,1,2022-01-16 20:13:41
Maybe it’s not just a Nancy strategy anymore. What’s the “penalty”? $250?,,/r/wallstreetbets/comments/s5s8r5/maybe_its_not_just_a_nancy_strategy_anymore_whats/,8512764EA,1,2022-01-16 20:13:41
AI Nodes?,,/r/wallstreetbets/comments/s5s9wc/ai_nodes/,TJ-Debbi,1,2022-01-16 20:15:14
Google explain why you shouldn’t listen to Cramer advice anymore,,/r/wallstreetbets/comments/s5s9y4/google_explain_why_you_shouldnt_listen_to_cramer/,Hitlerism,1,2022-01-16 20:15:18
How the HF’s manipulate price down.,,/r/wallstreetbets/comments/s5sdcx/how_the_hfs_manipulate_price_down/,Spangler77,1,2022-01-16 20:19:59
SPELL token,,/r/wallstreetbets/comments/s5sji3/spell_token/,modern_butter,1,2022-01-16 20:28:22
“Tesla looks to Africa for key battery component to reduce dependence on China”,,/r/wallstreetbets/comments/s5sl3v/tesla_looks_to_africa_for_key_battery_component/,Theta_Lover,1,2022-01-16 20:30:30
You heard it here first.,,/r/wallstreetbets/comments/s5snne/you_heard_it_here_first/,Gudaxxx,1,2022-01-16 20:33:57
Energy play leading up to possible Russian invasion of Ukraine.,,/r/wallstreetbets/comments/s5sro0/energy_play_leading_up_to_possible_russian/,Billions_or_Bust,1,2022-01-16 20:39:30
Tendies needed for wife’s boyfriend sale,,/r/wallstreetbets/comments/s5suk6/tendies_needed_for_wifes_boyfriend_sale/,LetUsGoBrandon,1,2022-01-16 20:43:39
January has been fun so far,,/r/wallstreetbets/comments/s5svkf/january_has_been_fun_so_far/,Outof_ITM,1,2022-01-16 20:45:07
Has Ford already peaked?,,/r/wallstreetbets/comments/s5sxno/has_ford_already_peaked/,Captain_501st,1,2022-01-16 20:48:03
When you tell your date you're still bullish on $GME,,/r/wallstreetbets/comments/s5t2fi/when_you_tell_your_date_youre_still_bullish_on_gme/,fuckHg,1,2022-01-16 20:54:41
China cuts rates on policy loans for first time since April 2020. China has wiggle room while all western countries are already at zero. Just sayin....,,/r/wallstreetbets/comments/s5t32k/china_cuts_rates_on_policy_loans_for_first_time/,thehouseofcrazies,1,2022-01-16 20:55:35
I can stay retarded longer than I can stay solvent (guess what ticker?),,/r/wallstreetbets/comments/s5t4on/i_can_stay_retarded_longer_than_i_can_stay/,liftheavyscheisse,1,2022-01-16 20:57:53
Anyone else curious about GameFi like I was? I think I found a lovely place for the apes to start 😁🤜🤛,,/r/wallstreetbets/comments/s5tcav/anyone_else_curious_about_gamefi_like_i_was_i/,lunertendie,1,2022-01-16 21:08:21
Day Traders as ‘Dumb Money’? The Pros Are Now Paying Attention,,/r/wallstreetbets/comments/s5tdoz/day_traders_as_dumb_money_the_pros_are_now_paying/,LionIsHungry,1,2022-01-16 21:10:25
GMGI crushin it,,/r/wallstreetbets/comments/s5tg1z/gmgi_crushin_it/,uboatcommander159,1,2022-01-16 21:13:43
$OXY 🚀🚀🚀,,/r/wallstreetbets/comments/s5tijg/oxy/,Capital_Leader_2911,1,2022-01-16 21:17:09
INTC YOLO,,/r/wallstreetbets/comments/s5tiz6/intc_yolo/,Rifleman_JackCooper,1,2022-01-16 21:17:49
Your Top Brokerages (aside from Robinhood),,/r/wallstreetbets/comments/s5tt0l/your_top_brokerages_aside_from_robinhood/,KL808,1,2022-01-16 21:31:58
Don’t play these markets like a barbarian or a child,,/r/wallstreetbets/comments/s5tu0y/dont_play_these_markets_like_a_barbarian_or_a/,DallasAppraisal,1,2022-01-16 21:33:17
MU calls expire Friday come on Nancy........ should this be a nft ?,,/r/wallstreetbets/comments/s5txk8/mu_calls_expire_friday_come_on_nancy_should_this/,alldayforfun,1,2022-01-16 21:38:04
All my life saving is het on tesla . Is that is bad or good investment,,/r/wallstreetbets/comments/s5u03t/all_my_life_saving_is_het_on_tesla_is_that_is_bad/,OkPirate7933,1,2022-01-16 21:41:51
Nothing to See Here,,/r/wallstreetbets/comments/s5ua9t/nothing_to_see_here/,BikoKonstantinos,1,2022-01-16 21:56:11
Axie collection,,/r/wallstreetbets/comments/s5uc0m/axie_collection/,nohaylimite,1,2022-01-16 21:58:40
"I put my saving account in growth stocks last year and am down $18k.. i have high conviction in future growth potential but like come on, WTF!",,/r/wallstreetbets/comments/s5udwx/i_put_my_saving_account_in_growth_stocks_last/,KnightofAmethyst,1,2022-01-16 22:01:03
Just joined guys! Where do I find all the crazy bets coming up?,,/r/wallstreetbets/comments/s5umjc/just_joined_guys_where_do_i_find_all_the_crazy/,bipedalprimate1,1,2022-01-16 22:12:55
Beyond meat BYND is now one of the most shorted US companies,,/r/wallstreetbets/comments/s5unk5/beyond_meat_bynd_is_now_one_of_the_most_shorted/,JessiahBoi,1,2022-01-16 22:14:18
Gunderson Capital,,/r/wallstreetbets/comments/s5uoiw/gunderson_capital/,WaterMiserable2671,1,2022-01-16 22:15:40
these rappers made a song about investing lol,,/r/wallstreetbets/comments/s5upmv/these_rappers_made_a_song_about_investing_lol/,Unclebyo,1,2022-01-16 22:17:20
The casino should never close,,/r/wallstreetbets/comments/s5utt7/the_casino_should_never_close/,DogeDillionaire,1,2022-01-16 22:23:39
Supply Chain Woes Could Worsen as China Imposes New Covid Lockdowns,,/r/wallstreetbets/comments/s5uzi6/supply_chain_woes_could_worsen_as_china_imposes/,PerfectConfection578,1,2022-01-16 22:32:02
AMC GME MERGER,,/r/wallstreetbets/comments/s5v0wg/amc_gme_merger/,Anxious-Mongoose-347,1,2022-01-16 22:34:01
My trading system,,/r/wallstreetbets/comments/s5v1mg/my_trading_system/,Realistic_Plantain_6,1,2022-01-16 22:35:04
My trading system,,/r/wallstreetbets/comments/s5v22n/my_trading_system/,Realistic_Plantain_6,1,2022-01-16 22:35:45
i have 100 dollars what should i buy,,/r/wallstreetbets/comments/s5v6ko/i_have_100_dollars_what_should_i_buy/,TheIberDeber,1,2022-01-16 22:42:42
URGENT! Stop Jeff Bezos from launching his new D-Shaped rocket before it reaches Uranus! ;) Please support Elon! Uranus needs to be saved!,,/r/wallstreetbets/comments/s5va29/urgent_stop_jeff_bezos_from_launching_his_new/,elonmusk_robotrader,1,2022-01-16 22:48:05
What should I do?,,/r/wallstreetbets/comments/s5vaci/what_should_i_do/,ManagerMaleficent658,1,2022-01-16 22:48:35
"You might want to Google Which Industries are a fastest growing in India and TTML stock growth last 2 years, who gives a 10,000% growth in only 2 years",,/r/wallstreetbets/comments/s5verk/you_might_want_to_google_which_industries_are_a/,Direct-Strawberry-86,1,2022-01-16 22:55:14
The Two Towers,,/r/wallstreetbets/comments/s5vkmj/the_two_towers/,dale4101,1,2022-01-16 23:03:30
Possible short squeeze?,,/r/wallstreetbets/comments/s5vrgp/possible_short_squeeze/,zirkless,1,2022-01-16 23:13:58
GME is done: a Guide for Even the Most Retarded to Understand.,,/r/wallstreetbets/comments/s5vria/gme_is_done_a_guide_for_even_the_most_retarded_to/,Fun_Assistance_9389,1,2022-01-16 23:14:02
Were GME and AMC the only shorts worth exploiting,,/r/wallstreetbets/comments/s5vt66/were_gme_and_amc_the_only_shorts_worth_exploiting/,Dmolinari91,1,2022-01-16 23:16:28
Welcome to the sub,,/r/wallstreetbets/comments/s5vw0x/welcome_to_the_sub/,No_Hurry12,1,2022-01-16 23:20:52
Legit follow!!,,/r/wallstreetbets/comments/s5vwi4/legit_follow/,sammimak1,1,2022-01-16 23:21:34
Hahaha gotta love dating apps.,,/r/wallstreetbets/comments/s5vy84/hahaha_gotta_love_dating_apps/,JackMeoff710,1,2022-01-16 23:24:05
Could be a symptom of covid but *cough*#BBIG,,/r/wallstreetbets/comments/s5vzrb/could_be_a_symptom_of_covid_but_coughbbig/,Pitiful-Kiwi7452,1,2022-01-16 23:26:12
“Your disruptive innovation ETF”,,/r/wallstreetbets/comments/s5w0u3/your_disruptive_innovation_etf/,dumidiot69,1,2022-01-16 23:27:52
What could go wrong actively trading an actively traded ETF?,,/r/wallstreetbets/comments/s5w0w8/what_could_go_wrong_actively_trading_an_actively/,tortoisepump,1,2022-01-16 23:27:59
"Just do research folks, that's where it's at. Google TTML growth last 2 years. Numbers don't lie",,/r/wallstreetbets/comments/s5w35b/just_do_research_folks_thats_where_its_at_google/,Direct-Strawberry-86,1,2022-01-16 23:31:20
🚀🚀🚀,,/r/wallstreetbets/comments/s5w6d1/_/,RonaldoMusky,1,2022-01-16 23:36:05
